"comment_count","created","description","duration","group_created","group_id","group_join_mode","group_lat","group_lon","group_name","group_urlname","group_who","how_to_find_us","id","link","manual_attendance_count","name","rsvp_close_offset","rsvp_limit","rsvp_open_offset","status","time","updated","utc_offset","venue_address_1","venue_address_2","venue_city","venue_country","venue_id","venue_lat","venue_localized_country_name","venue_lon","venue_name","venue_phone","venue_repinned","venue_state","venue_zip","visibility","waitlist_count","yes_rsvp_count"
"3","1434359835000","<p>6-6:30 PM Keynote: ""Data Storage Futures""</p> <p>How is data storage evolving? Which new media can we expect soon?<br/>Will disks still be around in 10 years? Is there a limit to Moore's law?</p> <p>Dr. Axel Koester, Chief Technologist, IBM EMEA Storage Competence Center Mainz</p> <p>6:30-6:50 PM Real time video analytics with InfoSphere Streams, OpenCV and R (live demo) and real life experiences with streaming analytics</p> <p>Unstructured data are a fast growing area and a source for many innovative Big Data &amp; Analytics solutions. Often the first idea of unstructured data seems to be that it's probably text data, even though that is just a small part. A lot of that ""new data"" is sensor data and especially multimedia (audio, video). Even though this part is growing extremely fast, it is very rarely used in analytics today. And even less in a real time context.</p> <p>I will demonstrate what does it mean to work with this new data in real time on a live demo and explain important concepts &amp; implementation approaches. The demo shows a drill equipment as it is used to build tunnels and how to analyze the output on the conveyor belt visually with machine learning approaches. Beside this, I will talk about some recent projects in the area of real time analytics where streaming analytics is already used in a big data context.</p> <p>Stephan Reimann, Senior IT Specialist Information Management, IBM  München</p> <p>6:50 PM -7:15 PM DOCKER: Introduction &amp; Demo, Mirko Stocker, Hochschule Rapperswil, HSR</p> <p>7:15-7:40 PM Live coding session: And end to end Twitter Evolving topic dashboard using NodeRED, Node.js, Hadoop, BigSQL (Hive), PlayFramework/Scala/Cloudfoundry, JQuery, Romeo Kienzler, IBM</p> <p>7:40-8:00 PM Distributed Machine Learning: Classification and Regression on a Large Scale, Martin Jaggi, ETH Zurich</p> <p>8:00 - 8:20 PM Introduction to Bitcoin, Olaf Klein, IBM</p> ","7200000","1378937069000","10220112","open","47.380001068115234","8.539999961853027","Big Data Developers in Switzerland","Big-Data-Developers-Switzerland","Members","","223254662","https://www.meetup.com/Big-Data-Developers-Switzerland/events/223254662/","","Cloud & Data Science Connect 2015 - Docker, Spark, Bitcoin, Cloudfoundry & more","","","","past","1435766400000","1435779004000","7200000","Vulkanstrasse 106","","Zürich","ch","23881399","47.39302062988281","Switzerland","8.485879898071289","IBM Cloud Transformation Lab for Analytics and IoT","","False","","","public","0","29"
"14","1442587693000","<p>This is a joint event with <a href=""http://www.meetup.com/Big-Data-Developers-Switzerland/events/225445743/"">Big Data Developers Zurich</a>.</p> <p><b>--IMPORTANT!--</b></p> <p><b>Please register at this link until Thursday Oct 30, 23:59:<a href=""http://sessionregister.mybluemix.net""> sessionregister.mybluemix.net</a></b></p> <p><b>This is necessary so that we can print your entrance badges. </b></p> <p><b>Thank you!</b></p> <p><b>---</b></p> <p><br/>Program:</p> <p>5:30 PM Door openings and welcome apero</p> <p>6:00 PM Demo - Time (Dr. Kevin Mader, 4Quant + ETH Zurich)</p> <p>Real-time Analytics (Webcam demo)</p> <p>GraphX Finite Element Modeling Demo</p> <p>6:30 PM Realtime Advanced Analytics: Spark Streaming+Kafka, MLlib/GraphX, SQL/DataFrames (Chris Fregly, IBM Spark Technology Center San Francisco)</p> <p>7:00 PM Deep Dive: *Project Tungsten* Spark's Largest Performance Optimizations to Date (Chris Fregly, IBM Spark Technology Center San Francisco)</p> <p>7:30 PM Twitter Analytics Demo using ApacheSpark + Jupyter (IPython+IScala) + + IBM Watson + OpenStack Swift as a Service in the IBM Cloud Free tier with 50 GB of Storage (Romeo Kienzker, IBM Cloud Transformation Lab Zurich, EcoD DACH)</p> ","9000000","1378937069000","10220112","open","47.380001068115234","8.539999961853027","Big Data Developers in Switzerland","Big-Data-Developers-Switzerland","Members","","225445743","https://www.meetup.com/Big-Data-Developers-Switzerland/events/225445743/","","Apache Spark Advanced Meetup","","","","past","1446481800000","1446573732000","3600000","Vulkanstrasse 106","","Zürich","ch","24108254","47.39302062988281","Switzerland","8.485883712768555","IBM Cloud Transformation Lab","","False","","","public","0","75"
"0","1447242664000","<p>IBM Smart Big Data Days - Obtain Insight and Agility using IBM’s Big Data Platform</p> <p>


PLEASE ENROLL HERE because number of attendants is limited</p> <p><a href=""http://www-304.ibm.com/events/idr/idrevents/detail.action?meid=10980&amp;ieid=14508&amp;from=find"" class=""linkified"">http://www-304.ibm.com/events/idr/idrevents/detail.action?meid=10980&amp;ieid=14508&amp;from=find</a></p> <p><br/>Description</p> <p>BigData represents a new and fast growing era in data exploration and utilization. IBM Big Data addresses key customer enterprise data requirements and provides a robust platform for the four V's: Variety, Velocity, Volume and Veracity. Built on a foundation of open source components.<br/>In this workshop the audience will explore IBM’s Big Data platform, commencing with Hadoop and a selection of it’s related projects and progressing to data at rest using IBM InfoSphere BigInsights, data in motion with IBM Infosphere Streams and IBM Data Explorer. Content is delivered via presentations and hands-on lab exercises. Events highlights</p> <p>Discover and experience how to gain insight from your unstructured data and the agility provided by Hadoop and IBM’s Big Data platform. Prerequisites None Enroll</p> ","115200000","1378937069000","10220112","open","47.380001068115234","8.539999961853027","Big Data Developers in Switzerland","Big-Data-Developers-Switzerland","Members","","226697062","https://www.meetup.com/Big-Data-Developers-Switzerland/events/226697062/","","Obtain Insight and Agility using IBM’s Big Data Platform","","5","","past","1449000000000","1449116129000","3600000","Vulkanstrasse 106","","Zürich","ch","24108254","47.39302062988281","Switzerland","8.485883712768555","IBM Cloud Transformation Lab","","False","","","public","0","5"
"5","1449561387000","<p>Date: Wednesday, 9 December 2015, 14:00 – 16:00<br/>Place: Seminar room C159, Institute of cell biology, Baltzerstrasse 4, 3012 Bern<br/>Speaker: Romeo Kienzler, Chief Data Scientist - IBM Cloud Transformation Lab Zurich Abstract:</p> <p>Container based virtualization is the new hype coming from Silicon Valley 2015. The buzzword behind this is DOCKER. Although present for many years in cgroups, namespaces and LXC - container based virtualzation really took off as Docker Inc. brought this technology to the masses. Today, every 2nd IT startup is running on DOCKER. Enterprises and Academic institutions are slowly adapting as well. In this session we will learn what DOCKER really is, what Linux Kernel extensions are used and how you can use it in your environment. We will create a DOCKER image from scratch, add persistent storage to it and showcase a little cluster computing task using ApacheFlink and DOCKER-Compose. Finally I'll give you a short introduction to DOCKER on the cloud - currently offered by nearly every cloud service provider - and exemplified in the IBM Bluemix Platform Cloud.</p> <p>Note: If available please bring your own laptop to the seminar.</p> ","7200000","1378937069000","10220112","open","47.380001068115234","8.539999961853027","Big Data Developers in Switzerland","Big-Data-Developers-Switzerland","Members","","227288426","https://www.meetup.com/Big-Data-Developers-Switzerland/events/227288426/","","Introduction to Docker","","","","past","1449666000000","1449674488000","3600000","Baltzerstrasse 4","","Berne","ch","24247058","46.951908111572266","Switzerland","7.428583145141602","Institute of cell biology, Seminar room C159","","False","","","public","0","5"
"3","1453732183000","<p><b>--------------- </b></p> <p><b>IMPORTANT:</b></p> <p><b>Please register at <a href=""http://sttalks.mybluemix.net"">sttalks.mybluemix.net</a> for your badge until 8 February 2016, 23:59 - thank you!</b></p> <p><b>--------------- </b></p> <p><b><br/></b> <b> Trifork, Basho and IBM Softlayer invite you to this Strategy&amp;Tech Talk:  From Meters to Pacemakers - the Plumbing to turn IoT hype into reality. </b></p> <p><br/>This Evening we will present you with three sessions all dealing with how you can get the most out of IoT and your Big Data: </p> <p>The session with Basho Technologies:<br/>The Managing Director of Basho EMEA - Manu Marchal will give you his insight into the prospects and the opportunities and how Riak TS can solve your Big Data problems.</p> <p>The world is currently creating over 2.5 quintillion bits of data every day.  This data, generated by mobile devices, apps, sensors and wearable tech represents highly valuable information.  Making accurate, real-time decisions with raw data to unlock its economic potential is now becoming crucial for countless businesses. Many organizations are still struggling to find out how to leverage the promise of big data.</p> <p>In this session you will: </p> <p>explore the technological challenges of big datafind the right infrastructure for your big data workloadsdiscover how to overcome the common pitfalls when using Cloud and NoSQL databases </p> <p>Mining raw data can be gold to your business. Find out how you can exploit its value.</p> <p>



The session with IBM SoftLayer: <br/>John Easton, IBM Distinguished Engineer and Lead Cloud Advisor UKI and Nordics, will be the voice of IBM Cloud SoftLayer and his talk will cover: </p> <p>We find ourselves in a data-rich world;  having easy access to data from a multitude of different sources.  Only a few years ago, very few companies could do this.  Now everyone has the potential to exploit data from sources as varied as weather, sensor, social etc.  Organisations relying on traditional data processing techniques will be unable to keep up, let alone take advantage of the new opportunities this opens up.  A new approach is needed:  one based around cloud and cognitive techniques.  This session will use a variety of real client examples to show the art of the possible.  To demonstrate how organisations bring these different data sources together and apply innovative analytical approaches using cloud platforms optimised for these problems to disrupt industries and create new business value.</p> <p>John Easton will give you his insights on the following:  examples of IoT application in real world, from premature infants treatment, to energy and utilities industry (bridging the Weather Company story Manu from Basho will use), to transport  why and what type of compute and network infrastructure is critical for those type of workloads, showcasing the readiness and the uniqueness of IBM Cloud SoftLayer with single tenant environment and robust low latency network NodeRED from Bluemix, that provides a browser-based flow editor that makes it easy to wire together devices, APIs, and online services by using the wide range of nodes in the palette cognitive computing with Watson awe-inspiring videos presenting application of all the presented technologies in production  </p> <p>The session with IBM Innovation: <br/>IBM Innovation will be joining this talk with a session on “IoT Sensor outlier detection in the cloud using dashDB and R”</p> <p>Romeo Kienzler, Data Scientist at IBM InnovationCenter will explore how to create predictive models for real-time IoT data analysis: </p> <p><br/>'IoT mainly is seen as distributed data generation. In order to create valuable insights this data has to be stored for retrospective analysis to create predictive models for real-time analysis. In this talk we show how to stream mqtt data acquired through subscription to IoT sensors into a distributed relational database and how the IBM R accelerator is used to push down R code to SQL and stored procedures to react in real-time to changing sensor data'</p> ","","1378937069000","10220112","open","47.380001068115234","8.539999961853027","Big Data Developers in Switzerland","Big-Data-Developers-Switzerland","Members","","228345778","https://www.meetup.com/Big-Data-Developers-Switzerland/events/228345778/","","Strategy & Tech Talk - From meters to pacemakers - the Internet of Things","PT78H","","","past","1455210000000","1455224440000","3600000","Vulkanstrasse 106","","Zürich","ch","24108254","47.39302062988281","Switzerland","8.485883712768555","IBM Cloud Transformation Lab","","False","","","public","0","38"
"0","1464200129000","<p>Please join and RSVP here:<br/><a href=""http://www.meetup.com/spark-zurich/events/230920729/"" class=""linkified"">http://www.meetup.com/spark-zurich/events/230920729/</a></p> <p>Event Agenda</p> <p>18:30 - 19:00</p> <p>Arrival and socializing</p> <p>19:00 - 20:00</p> <p>Michal Okoniewski, Scientific IT Services, ETH Zürich</p> <p>""ADAM standard and other ways of scalable cloud-processing of genomic big data with Spark""</p> <p>Next generation sequencing (NGS) technology has become a serious computational challenge since its commercial introduction in 2008. Currently, thousands of machines worldwide produce daily billions of sequenced nucleotide base pairs of data. Due to continuous development of faster and economical sequencing technologies, processing the large amounts of data produced by high throughput sequencing technologies became the main challenge in bioinformatics. It can be solved by the new generation of software tools based on the paradigms and principles developed within the Hadoop ecosystem. This talk presents the overall perspective for data analysis software for genomics and prospects for the emerging applications with a particular emphasis on the ADAM standard.</p> <p>The presentation will include an introduction to analysing the genomic big data in a scalable form with ADAM. It will also include examples of using Spark, SparkR and Parquet that can be more generic in the data science.</p> ","","1378937069000","10220112","open","47.380001068115234","8.539999961853027","Big Data Developers in Switzerland","Big-Data-Developers-Switzerland","Members","","231396781","https://www.meetup.com/Big-Data-Developers-Switzerland/events/231396781/","","ADAM standard - processing of genomic big data with ApacheSpark","","","","past","1464625800000","1464638662000","7200000","Rämistrasse","","Zürich","ch","24568734","47.37266540527344","Switzerland","8.550455093383789","ETH Zurich / Zentrum / HG E 33.1","","False","","","public","0","21"
"0","1462052797000","<p><i><b>THIS MEETUP AND LIVE STREAMING IS US PACIFIC STANDARD TIME (PST). PLEASE CONVERT TO YOUR TIME ZONE.</b></i></p> <p>On June 6, 2016, leading minds in data and analytics from Tesla, Netflix, Silicon Valley Data Science, and IBM will come together to demonstrate how open data and analytics technologies such as R, Spark, Python and more are forming a vibrant ecosystem.  The community has a shared goal of working with all data to build unexpected insights and launch new business applications.</p> <p>The Apache Spark Maker Community Event will bring together data scientists, data engineers, data developers, and data designers June 6th @ 6pm at Galvanize, San Francisco. Here’s the plan:   </p> <p>- The Big Reveal – New sample Apache Spark apps and tools</p> <p>- Use Cases – Monsanto will share how they are using R and Spark to optimize their supply chain</p> <p>- Learning Session - Hear from experts working on Spark projects and building the Spark ecosystem of open data and analytics technologies</p> <p>- Networking Opportunity – Food, drinks and data, explore a Hall of Innovation showcasing Spark demos</p> <p>Join us. Learn more here: </p> <p><b><i><a href=""http://www.ibm.com/analytics/us/en/events/apache-spark/"">Apache Spark Maker Community Event</a></i></b> </p> <p>We realize you may not be able to attend in person, however, we are <b>live streaming</b> the event.  Register for the <b><a href=""https://www.eventbrite.com/e/livestream-apache-sparktm-maker-community-event-registration-24790223225?cm_mc_uid=39680333471514613509392&amp;cm_mc_sid_50200000=1461961944"">live stream</a></b> and we'll send you a calendar update and login link.</p> ","14400000","1378937069000","10220112","open","47.380001068115234","8.539999961853027","Big Data Developers in Switzerland","Big-Data-Developers-Switzerland","Members","","230773767","https://www.meetup.com/Big-Data-Developers-Switzerland/events/230773767/","","Apache Spark Maker Community Event","","","","past","1465227000000","1465244772000","7200000","44 Tehama Street","","San Francisco","us","24126294","37.78749465942383","USA","-122.39653015136719","Galvanize U","","False","CA","","public","0","23"
"0","1466057487000","<p>Data Science Connect 2016 - Bangalore - Live Stream</p> <p><a href=""http://www.youtube.com/c/RomeoKienzler/live"" class=""embedded"">http://www.youtube.com/c/RomeoKienzler/live</a></p> <p>Agenda: 2:30-3:00 PM - Swatcloud Market place for IoT, Big Data and Cloud - Siliconvalley4u<br/>3:00-3:30 PM - Welcome Note, Introduction to IBM Bluemix and IBM Watson IoT Platform (romeo)<br/>3:30-4:00 PM - Time Series Analysis on ApacheSpark (romeo)<br/>4:00-4:30 PM - OpenWhisk, an Open Source Cloud based event programming service (Rajesh)<br/>4:30-5:00 PM - Hands-on Exercise, send Accelerometer data from your Smartphone to the Cloud and Analyse movement patterns with ApacheSpark (romeo)</p> <p>Bio:</p> <p>1. Rajesh K Jeyapaul is a Cloud Solution Architect from IBM EcoSystem &amp; Developer (ECoD) organization , focusing on enabling partners and developers on IBM cloud solution especially on Bluemix , IoT , Mobility and Big Data.</p> <p>He started his carrier on Avionics real time simulation as a Research Fellow in India’s Defense organization. Further joining IBM , he has worked on various technologies involving java virtual machine, operating system , virtualization and cloud OS management.</p> <p>He has co-authored books on virtualization and cloud system management. He loves to spend time with his family and play violin during his leisure time</p> <p>2. Romeo Kienzler is a Chief Data Scientist at the IBM Watson IoT Division. In his role he is involved in international Data Mining and Data Science projects to ensure that clients get the maximum out of their data. He works as Associate Professor for Data Mining at a Swiss University and his current research focus is on Cloud Scale Data Mining using Open Source Technologies including R, ApacheSpark, SystemML, ApacheFlink and DeepLearning4J. He also contributes to various open source projects.</p> ","9000000","1378937069000","10220112","open","47.380001068115234","8.539999961853027","Big Data Developers in Switzerland","Big-Data-Developers-Switzerland","Members","","231932638","https://www.meetup.com/Big-Data-Developers-Switzerland/events/231932638/","","Data Science Connect 2016 - Bangalore - Live Stream","","","","past","1466425800000","1466436705000","7200000","","","","","","","","","","","","","","public","0","12"
"2","1465038684000","<p><b>IMPORTANT!</b></p> <p>Unfortunately we had to postpone this meetup to <b>June 27</b>! Please update your calendars accordingly.</p> <p><br/>As we have limited availability for this meetup, <a href=""http://discoverwatson.mybluemix.net"">registering for a badge</a> is obligatory! Without a registration we cannot guarantee your admission!</p> <p><br/>Registration is open until<b> June 24, 16:00. - FULLY BOOKED!<br/></b></p> <p>Registration link: <a href=""http://discoverwatson.mybluemix.net"">discoverwatson.mybluemix.net</a></p> <p>___________________________________________</p> <p><b>Presentation:</b></p> <p>The Internet of Things is driving the digital disruption into the physical world. This presentation gives an overview of IBM's strategy and current offerings to help clients to become more competitive in this area. IBM Watson IoT platform forms the base of the current portfolio, which is based on a globally scaled MQTT broker as a service in the IBM Cloud also offering a free tier for interested individuals and start-ups.</p> <p><b>Live Demo 1 :</b><br/>The Watson IoT platform in action. Connect a Texas Instruments Sensor Tag to the cloud and process data on your IPAD or communicate sensor values via Watson<br/>Test-to-Speech.</p> <p><b>Live Demo 2:</b><br/>Read accelerometer data from your mobile device and stream this data to via MQTT to the Watson IoT Platform. Learn how to classify this data into different movement patterns (standing/sitting, walking, running, dancing)</p> <p><br/><b>Speakers:</b></p> <p><b>Romeo Kienzler</b> is a Chief Data Scientist at the IBM Watson IoT Division. In his role he is involved in international Data Mining and Data Science projects to ensure that clients get the maximum out of their data. He works as Associate Professor for Data Mining at a Swiss University and his current research focus is on Cloud Scale Data Mining using Open Source Technologies including R, ApacheSpark, SystemML, ApacheFlink and DeepLearning4J. He also contributes to various open source projects.</p> <p><br/><b>Rainer Hochecker</b> started his career after his Software Engineering studies. Since 2000 he has worked as a consultant in software distribution and the Internet of Things at IBM.</p> <p>In his spare time he writes code for an open source project.</p> ","10800000","1378937069000","10220112","open","47.380001068115234","8.539999961853027","Big Data Developers in Switzerland","Big-Data-Developers-Switzerland","Members","","231642401","https://www.meetup.com/Big-Data-Developers-Switzerland/events/231642401/","","FULLY BOOKED - Discover the Internet of Things - Talk and Live Demos","PT75H","35","","past","1467043200000","1467178939000","7200000","Vulkanstrasse 106","","Zürich","ch","23881399","47.39302062988281","Switzerland","8.485879898071289","IBM Cloud Transformation Lab for Analytics and IoT","","False","","","public","0","31"
"0","1467359380000","<p>Spark Summit 2016: Trends &amp; Insights</p> <p>


Livestream of this meetup:</p> <p>

<a href=""http://www.meetup.com/spark-zurich/events/232021768/"" class=""linkified"">http://www.meetup.com/spark-zurich/events/232021768/</a></p> <p>

<a href=""http://www.youtube.com/c/RomeoKienzler/live"" class=""embedded"">http://www.youtube.com/c/RomeoKienzler/live</a></p> <p>

Event Agenda</p> <p>

18:30 - 19:00</p> <p>

Arrival and socializing</p> <p>

19:00 - 20:00</p> <p>

René Pfitzner, Data Scientist, Neue Zürcher Zeitung</p> <p>

""Spark Summit 2016: Trends &amp; Insights""</p> <p>

René attended the Spark Summit in SF (<a href=""https://spark-summit.org/2016/"" class=""linkified"">https://spark-summit.org/2016/</a>) and will tell us what he has learned.</p> <p>

This meetup takes place at Impact Hub Zürich (location: Viadukt at Viaduktstrasse 91, 8005 Zurich): The global community of entrepreneurial people prototyping the future of business. At Impact Hub, you can connect, collaborate, co-work and create great content in an inspiring environment.</p> ","","1378937069000","10220112","open","47.380001068115234","8.539999961853027","Big Data Developers in Switzerland","Big-Data-Developers-Switzerland","Members","","232298947","https://www.meetup.com/Big-Data-Developers-Switzerland/events/232298947/","","Spark Summit 2016: Trends & Insights","","","","past","1467651600000","1467665308000","7200000","Viaduktstrasse 93","","Zürich","ch","24636538","47.384925842285156","Switzerland","8.520928382873535"," Impact Hub Viadukt","","False","","","public","0","23"
"0","1468483159000","<p>BerlinTOA LiveStream: DeepLearning and Advanced Machine Learning on IoT</p> <p>Since the 150 available seats on Berlin seem to be booked out (<a href=""http://www.eventbrite.com/e/deeplearning-and-advanced-machine-learning-on-iot-tickets-26145758668"" class=""linkified"">http://www.eventbrite.com/e/deeplearning-and-advanced-machine-learning-on-iot-tickets-26145758668</a>) we decided to stream the talk, so if you are interested feel free to join via live stream:</p> <p><a href=""http://www.youtube.com/c/RomeoKienzler/live"" class=""embedded"">http://www.youtube.com/c/RomeoKienzler/live</a></p> <p>Abstract:<br/>Currently DeepLearning - large neural networks with advanced topologies - are taking over the machine learning ecosystem. In the case of times series they currently are superseding Hidden Markov models and other traditional algorithms. In this talk we will show how Deep Neural Networks can be used for anomaly detection on high dimensional network monitoring data. Do it yourself and read accelerometer data from your mobile device and stream this data to via MQTT to the Watson IoT Platform. Learn how to classify this data into different movement patterns (standing/sitting, walking, running, dancing).</p> ","7200000","1378937069000","10220112","open","47.380001068115234","8.539999961853027","Big Data Developers in Switzerland","Big-Data-Developers-Switzerland","Members","","232609253","https://www.meetup.com/Big-Data-Developers-Switzerland/events/232609253/","","BerlinTOA LiveStream: DeepLearning and Advanced Machine Learning on IoT","","","","past","1468591200000","1468599624000","7200000","","","","","","","","","","","","","","public","0","17"
