"comment_count","created","description","duration","group_created","group_id","group_join_mode","group_lat","group_lon","group_name","group_urlname","group_who","how_to_find_us","id","link","manual_attendance_count","name","rsvp_close_offset","rsvp_limit","rsvp_open_offset","status","time","updated","utc_offset","venue_address_1","venue_address_2","venue_city","venue_country","venue_id","venue_lat","venue_localized_country_name","venue_lon","venue_name","venue_phone","venue_repinned","venue_state","venue_zip","visibility","waitlist_count","yes_rsvp_count"
"0","1455807319000","<p><i><b>REGISTRATION WILL CLOSE MARCH 23RD FOR THIS EVENT.  IF YOU'VE NOT REGISTERED, PLEASE REGISTER NOW HERE:</b></i><b>&lt;a&gt;<br/>&lt;/a&gt;</b></p> <p><b>&lt;a&gt;ibm.co/1U4gCDk&lt;/a&gt;</b></p> <p><br/>Join us for a very exciting Internet of Things (IoT) Developer Day at the CloudOne Headquarters in Fishers, Indiana on March 24th.  <i>After the hand-on labs in the afternoon, join CloudOne and IBM for some networking and a ""tasting""!!</i></p> <p><br/><b>To reserve your seat, register here:   &lt;a&gt; ibm.co/1U4gCDk&lt;/a&gt;<a href=""http://ibm.co/1U4gCDk"">&lt;/a&gt;</b></p> <p><br/>CloudOne, a premier IBM Business Partner, and the IBM Big Data &amp; Analytics team are sponsoring the day which will include a keynote, interactive demos and Hands-on Labs in the afternoon.  <b><i>Please note: this is a customer only event.</i></b></p> <p>CloudOne helps the world’s best companies make their things for the Internet of Things. The company brings enterprise applications to the cloud, enabling global collaborative development, production and analysis of software and products in real time on individual, secure, private hybrid cloud environments. Trusted by leading brands, CloudOne’s scalable technology is supported by a team of experts and partners who share a passion for making it easier, faster and more economical to make things for the Internet of Things. For more information, visit &lt;a href=""http://www.oncloudone.com""&gt;<a href=""http://www.oncloudone.com"" class=""linkified"">http://www.oncloudone.com</a></a>.</p> <p><b>In order to reserve your seat at this event (space is limited), you must register at this URL:  <a href=""http://ibm.co/1U4gCDk"">ibm.co/1U4gCDk</a><br/></b></p> <p>The Internet of Things (IoT) is hot, but many are tired of the chatter and ready for action.  Today’s applications are expected to manage a variety of structured and unstructured data, accessed by massive networks of users, devices, and business locations, or even sensors, vehicles and Internet-enabled goods.</p> <p>In today’s continuously changing, always connected business environment, you must make the best possible decisions and put them into action immediately. Real-time actionable insight provides the robust big data and analytics capabilities that allow you to capture, analyze and act on all relevant data, including the stream of data generated by the myriad devices that make up the Internet of Things. Marketers, sales managers, financial analysts and other business users gain the insights they need to act in real time based on timely, trusted data.</p> <p>As you expand big data and analytics capabilities throughout your organization, you need to empower all of your business users to access and analyze data for faster insight. Taking delivery of software, solutions, infrastructure, platforms and services on the cloud can accelerate the value of big data and analytics capabilities, offering scalability with limited upfront investment.</p> <p>Join us to learn how IBM and CloudOne are helping clients rapidly deliver solutions to Capture, Analyze and Act on IoT data in Real-Time.  The Developer Day kicks off at 8:30am with food and beverages/registration. Bring your laptop because after the morning session, our subject matter experts will help you get hands-on with the technology. </p> <p><b>Agenda (subject to change)</b></p> <p>08:30-09:00 - Registration, Networking &amp; Breakfast<br/>09:00-10:00 - Keynote - IoT Solutions Overview<br/>10:00-12:00 - Capture, Analyze &amp; Act on IoT Data in Real-time<br/>- Internet of Things (IoT) Foundation Overview<br/>- Sphero Demo<br/>- Predictive Maintenance &amp; Quality Overview<br/>12:00-01:00 - Lunch &amp; Bluemix Overview/Demo<br/>01:00-04:00 - Hands-on Labs(bring your own laptop)</p> <p><br/>This event is FREE. Breakfast, Lunch and snacks will be provided.  </p> <p>You are invited to join CloudOne and IBM for a fun networking and refreshments time at CloudOne after the Hands-on Labs in the afternoon.</p> <p><br/><b>Seating is limited.  In order to reserve your seat, you must register at this URL:  <a href=""http://ibm.co/1U4gCDk"">ibm.co/1U4gCDk</a>&lt;a href=""http://ibm.co/1Lmx35Z""&gt;&lt;/a&gt; </b></p> <p><b>Thank you and we look forward to seeing you at the event</b></p> ","27000000","1395415218000","13471152","open","39.77000045776367","-86.11000061035156","Big Data Developers in Indianapolis","Big-Data-Developers-in-Indianapolis","Members","Zip 46038","228947237","https://www.meetup.com/Big-Data-Developers-in-Indianapolis/events/228947237/","","Big Data & Analytics for the Internet of Things (IoT)","","","","past","1458822600000","1458903640000","-14400000","8626 E. 116th Street, Suite 300","","Fishers","us","24375119","39.95687484741211","USA","-86.01683807373047","ClearObject Headquarters","","False","IN","","public","0","19"
"0","1461977246000","<p>On June 6, 2016, leading minds in data and analytics from Tesla, Netflix, Silicon Valley Data Science, and IBM will come together to demonstrate how open data and analytics technologies such as R, Spark, Python and more are forming a vibrant ecosystem.  The community has a shared goal of working with all data to build unexpected insights and launch new business applications.</p> <p>The Apache Spark Maker Community Event will bring together data scientists, data engineers, data developers, and data designers June 6th @ 6pm at Galvanize, San Francisco. Here’s the plan:   </p> <p>- The Big Reveal – New sample Apache Spark apps and tools</p> <p>- Use Cases – Monsanto will share how they are using R and Spark to optimize their supply chain</p> <p>- Learning Session - Hear from experts working on Spark projects and building the Spark ecosystem of open data and analytics technologies</p> <p>- Networking Opportunity – Food, drinks and data, explore a Hall of Innovation showcasing Spark demos</p> <p>Join us. Learn more here:  <b><i><a href=""http://www.ibm.com/analytics/us/en/events/apache-spark/"">Apache Spark Maker Community Event</a></i></b> </p> <p>Registration begins at 5:30 PM and the discussion starts at 6:30 PM; food and drinks will be served. You must register for this event. </p> <p>To get your ticket, and attend in person, click <b><a href=""https://www.eventbrite.com/e/apache-sparktm-maker-community-event-registration-24742595770?cm_mc_uid=39680333471514613509392&amp;cm_mc_sid_50200000=1461961944"">HERE</a></b>. </p> <p>Can't attend in person? We'll be live streaming this event on a computer screen near you! Register for the  <b><a href=""https://www.eventbrite.com/e/livestream-apache-sparktm-maker-community-event-registration-24790223225?cm_mc_uid=39680333471514613509392&amp;cm_mc_sid_50200000=1461961944"">live stream</a></b> and we'll send you a calendar update and login link.</p> ","14400000","1395415218000","13471152","open","39.77000045776367","-86.11000061035156","Big Data Developers in Indianapolis","Big-Data-Developers-in-Indianapolis","Members","","230756593","https://www.meetup.com/Big-Data-Developers-in-Indianapolis/events/230756593/","","Apache Spark Maker Community Event","","","","past","1465248600000","1465263857000","-14400000","44 Tehama Street","","San Francisco","us","24126294","37.78749465942383","USA","-122.39653015136719","Galvanize U","","False","CA","","public","0","1"
"0","1464876710000","<p><b>IBM’s Hands on Introduction to Apache Spark for Data Engineers, Data Scientist and Developers</b></p> <p>Please join us for a free IBM sponsored proof of technology for clients and practitioners on Apache Spark. This is a full day of education on Apache Spark with hands on exercises instructed in person by Apache Spark experts. The POT will provide a detailed overview of Apache Spark and Data Science methodology. The Lab will be performed using open source notebooks (Jupyter and/or Zeppelin) on publicly available datasets. Participants will use IBM’s fully managed Apache Spark Cloud platform available for educational purposes.</p> <p><br/><i><b>PLEASE NOTE - SEATS ARE LIMITED. IN ORDER TO CONFIRM YOUR SEAT, YOU MUST REGISTER HERE:</b></i></p> <p><b>&lt;a&gt;Apache Spark - June 21st&lt;/a&gt;</b></p> <p><br/><b>Who should go</b>:</p> <p><br/>Anyone interested in learning more about Apache Spark<b><br/></b></p> <p><b>Prerequisite</b>:<br/>A working knowledge of Coding (Preferred Python and/or Scala), understand distributed computing, Spark and SQL</p> <p><b>What to expect</b>:<br/>Expect to spend a full day of lecture and hands on exercises attacking real-world data challenges using Apache Spark. In 8 hours you will learn the basic essentials of Apache Spark and why it's important to your organization. This workshop will focus on data wrangling and machine learning.</p> <p><b>Full Day Agenda:</b><br/>8:30am - 9:00am - Breakfast, Socialize<br/>9:00am - 9:30 am - Apache Spark &amp; IBM<br/>9:30am - 10:30am - Apache Spark Overview<br/>10:30am - 11:30am - Lab 1, Hello Spark - Hands-on exercise<br/>11:30am - 12:00pm - Apache Spark SQL Overview<br/>12:00pm - 1:00pm - Lunch<br/>1:00pm - 2:00pm - Lab 2, Spark SQL - Hands-on exercise<br/>2:00pm - 3:00pm - Overview of Data Science &amp; Machine Learning w/Apache Spark<br/>3:00pm - 4:00pm - Lab 3, Machine Learning w/Apache Spark - Hands on exercise<br/>4:00pm - 4:30 pm - Wrap-up - Feedback from attendees</p> <p><b>Join us for an optional happy hour from 5:00pm – 6:30pm.</p> <p>Registration:</b></p> <p>Seats are limited, register today to reserve your spot!</p> <p><a href=""https://www.eventbrite.com/e/ibm-analytics-hands-on-apache-spark-workshop-tickets-25801043616""><a href=""https://www.eventbrite.com/e/ibm-analytics-hands-on-apache-spark-workshop-tickets-25801043616"" class=""linkified"">https://www.eventbrite.com/e/ibm-analytics-hands-on-apache-spark-workshop-tickets-25801043616</a></a></p> ","28800000","1395415218000","13471152","open","39.77000045776367","-86.11000061035156","Big Data Developers in Indianapolis","Big-Data-Developers-in-Indianapolis","Members","zip 46240 - 1st Floor Conference Room","231593888","https://www.meetup.com/Big-Data-Developers-in-Indianapolis/events/231593888/","","Intro to Apache Spark - Hands On","","","","past","1466512200000","1466543180000","-14400000","9100 Keystone Crossing, First Floor Conference Room","","Indianapolis","us","24582978","39.768402099609375","USA","-86.15806579589844","Keystone at the Crossing","","False","IN","","public","0","14"
"0","1464822586000","<p><b>THIS IS A GLOBAL ON-LINE HACKATHON THAT BEGINS MAY 23, 2016 AND <i>NOW ENDS AUGUST 23, 2016</i>.  SUBMISSIONS DUE AUGUST 23rd BY 5:00 PM EST. </b></p> <p><b>We’re extending the hackathon deadline to August 23</b> - that’s 20 additional days to build your Spark enterprise app. (View the revised competition calendar <b><a href=""http://apachespark.devpost.com/details/dates"">HERE</a></b><b>.  </b>We're giving you more time because....</p> <p>We’re adding <b>new enterprise data resources</b> to the site and we want to give you a chance to incorporate these into your projects, if you so choose.  Our awesome data co-sponsors <b><a href=""http://www.yelp.com/nyc"">Yelp</a></b> and <b><a href=""https://uncharted.software/"">Uncharted Software</a></b> have generously shared some of their enterprise data sets for you to use during the hackathon.</p> <p>Yelp’s data includes 2.2M reviews by 552K users for 77K businesses. The Uncharted data includes Bitcoin network transactions from processing the Bitcoin blockchain as of mid-2014 <i>and</i> Amazon product reviews from 1995 through 2003. For a fuller description and data access, visit our <b><a href=""http://apachespark.devpost.com/details/resources#datasets"">resources page</a></b>.</p> <p>Uncharted Software also has a couple cool Spark data visualization libraries you should check out: <b><a href=""http://unchartedsoftware.github.io/salt/"">Salt</a></b> and <b><a href=""http://unchartedsoftware.github.io/sparkpipe-core/"">SparkPipe.</a></b></p> <p>And, in case you’d like to weigh the effects of weather on business operations, we’re also offering access to the full suite of <b><a href=""http://apachespark.devpost.com/details/weather_data"">Weather Company APIs</a></b> for the duration of the hackathon.</p> <p>Finally, if you’re looking for a hosting solution for your Spark app, we’re now offering <b>extended Bluemix trials for all hackathon participants</b>. Using Bluemix services to build your project is <b><i>totally optional</i></b>, but might be a good way to get your app up and running — particularly with the IBM Analytics for Apache Spark service.</p> <p><b><a href=""http://apachespark.devpost.com/details/bluemix_promo"">You can request your extended Bluemix trial code here.</a> </b></p> <p>For all hackathon participants, trials will extend through November 1, 2016.</p> <p><i>Now go forth and optimize for the enterprise!</i></p> <p>---------------------</p> <p>Build an Apache Spark application to address a real business problem or core concern related to customer care, marketing, risk management or operations. Join IBM and Devpost for a global hackathon using <b><a href=""http://apachespark.devpost.com/?utm_source=facebook-partner&amp;utm_medium=wall-post&amp;utm_campaign=apachespark"">Apache Spark Makers Build</a></b>.  There are $100,000 in cash prizes.  Submissions can be sent in up to August 23rd.</p> <p><i>Participation Details: </i>To participate in the global virtual hackathon, you can <b><a href=""http://apachespark.devpost.com/?utm_source=facebook-partner&amp;utm_medium=wall-post&amp;utm_campaign=apachespark"">register here</a></b>.  Please review all registration guidelines.</p> <p>For the hack, you will apply Apache Spark's powerful analytics capabilities to enterprise and other relevant data so data scientists and software developers can build an analytics or mobile/web app that tackles a key business problem in marketing, customer case, operations or risk management.  The grand prize is $50,000, and the top three winners each get a meeting with the judge or<br/>Spark community expert of their choice; the judging panel includes data experts from Tesla, Netflix, and Silicon Valley Data Science.</p> <p>Go to <b><a href=""http://apachespark.devpost.com/?utm_source=facebook-partner&amp;utm_medium=wall-post&amp;utm_campaign=apachespark"">apachespark.devpost.com</a></b> for full details and registration.  Please review all registration rules.</p> <p><b> <i>Questions?</i></b></p> <p>We're here to help. If you have any questions about the hackathon, post on the <b><a href=""http://apachespark.devpost.com/forum_topics"">discussion forum </a></b>or email <b><i>support@devpost.com </i></b>and we'll respond as soon as we can.</p> ","","1395415218000","13471152","open","39.77000045776367","-86.11000061035156","Big Data Developers in Indianapolis","Big-Data-Developers-in-Indianapolis","Members","","231578323","https://www.meetup.com/Big-Data-Developers-in-Indianapolis/events/231578323/","","Show Us Your Apps - Apache Spark Maker Build Global Hackathon","","","","past","1471986000000","1471998691000","-14400000","Any Street","","Any City","us","24581652","36.77825927734375","USA","-119.41793060302734","Global Online Hackathon","","False","CA","","public","0","8"
"0","1472445080000","<p>On September 27, 2016, leading minds in data and analytics will come together and unveil the latest in cloud technology, enabling you to more efficiently put data to work. Experience how Spark, Hadoop, Python, and more are being used to bring together all types of data professionals –from data engineers, to data scientists, developers and business analysts –to work in new collaborative ways.</p> <p>The IBM DataFirst Launch Event will unite data and analytics leaders and practitioners from the open source community, startups, and enterprises. Check the <i><b><a href=""http://www.ibm.com/analytics/us/en/events/datafirst/index.html"">event site</a></b></i> for the latest lineup of guest speakers. The event takes place @ 6pm at the Hudson Mercantile Building, NYC.</p> <p>Here’s the plan:<br/>• The Big Reveal –Experience new ways to work for data engineers, data scientist, developers, and business analysts, both individually and collectively.</p> <p>•Hands-on sessions – With interactive experiences for each of these professions.</p> <p>•Use Cases –Community leaders and guest speakers will share their expertise and vision<br/>•Networking Opportunity – Food, drinks, data, collaborative demos, and a party on the rooftop</p> <p>Learn more here:<a href=""http://www.ibm.com/analytics/us/en/events/datafirst/index.html#"">  <i><b>DataFirst Launch Event</b></i></a></p> <p>Check-in and networking begins at 6:00 PM.  Food and drinks will be served. You must register for this event.</p> <p>To get your ticket, and attend in person, click <b><a href=""https://www.eventbrite.com/e/ibm-datafirst-launch-event-registration-26725283041"">HERE</a></b>.  </p> <p>Can't attend in person? We'll be live streaming this event.  Register for the <b><a href=""https://www.eventbrite.com/e/livestream-ibm-datafirst-launch-event-registration-26906650516"">LIVE STREAM </a></b>and we'll send you a calendar update and login link. </p> ","14400000","1395415218000","13471152","open","39.77000045776367","-86.11000061035156","Big Data Developers in Indianapolis","Big-Data-Developers-in-Indianapolis","Members","zip 10018","233702470","https://www.meetup.com/Big-Data-Developers-in-Indianapolis/events/233702470/","","DataFirst Launch Event – Experience new ways to put your data to work","","","","past","1475013600000","1475029771000","-14400000","500 West 36th Street","","New York","us","24745891","40.755863189697266","USA","-73.99864959716797","Hudson Mercantile Bldg","","False","NY","","public","0","3"
"0","1481831200000","<p>RSVP: <a href=""http://bit.ly/2gOcufe""><a href=""http://bit.ly/2gOcufe"" class=""linkified"">http://bit.ly/2gOcufe</a></a></p> <p>This webinar will cover an overview of Watson Data Platform capabilities and how to empower users across the organization to make the most out of their data. What if you can shorten the time it takes to create value out of your existing organizational data ? </p> <p>What if you can provision a common analytic engine with managed services that will enable you to embrace multiple cloud platforms ? IBM Watson Data Platform is the first cloud-based data and analytics platform to support cognitive businesses. It enables access, collaboration and paths to insights by connecting all users through trusted access to a variety of data, discovering new possibilities and opportunities with built-in intelligence, automation and machine learning and accelerating outcomes with rapid deployment of new data models and fast embedding of insights into processes, applications and services. </p> <p>Let us show you how Watson Data Platform can be the milestone of your organization analytics strategy and empower your organization into the new Cognitive analytics era.</p> <p><b>Speaker Bio: </b><br/>Gerardo Rodríguez Díaz – is an avid traveler, technologist enthusiast and Big data and Analytics cloud solution specialist focused on communications and computer systems integrations industries across North America. GRD areas of specialization are IT, Marketing and Business Intelligence having worked across European, North and South American markets.</p> ","3600000","1395415218000","13471152","open","39.77000045776367","-86.11000061035156","Big Data Developers in Indianapolis","Big-Data-Developers-in-Indianapolis","Members","Time is Eastern Standard Time","236263743","https://www.meetup.com/Big-Data-Developers-in-Indianapolis/events/236263743/","","Making Data Simple in the Cognitive Era","","","","past","1482253200000","1482258638000","-18000000","http://bit.ly/2gOcufe","","Indianapolis","us","24947642","0.0","USA","0.0","Live Webinar","","False","IN","","public","0","8"
"0","1485389113000","<p>The demand for machine learning is booming! </p> <p>Calling all IT executives, data scientists, Chief Data Officers, data architects and other data geeks.  Join us on <b>February 15th from 2:00-5:30 pm ET </b>via livestream  (replay available starting February 16th) , and discover how machine learning is fundamentally changing the way we work and live.  Hear about cognitive applications that anticipate behavior and learn from data without being explicitly programmed.</p> <p>You'll learn about the latest breakthrough developments on machine learning as well as Spark, data and analytics. Mike Gualtieri, Vice President and Principal Analyst, Forrester, will present his view on how to best leverage technologies such as big data, predictive analytics, Hadoop/Spark, machine learning, data science, and AI.  Rob Thomas, General Manager, IBM Analytics will host an agenda which will include guest speakers and cover the following topics:</p> <p>•  Machine Learning Overview</p> <p>•  Top Trends in Machine Learning &amp; Cognitive Applications</p> <p>•  Cognitive Analytics and Machine Learning for the Enterprise</p> <p>•  Live Product Demonstration &amp; Client Roundtable on Machine Learning</p> <p>•  Data Innovation with Hybrid Transaction/Analytical Processing</p> <p>•  Spark &amp; Machine Learning for Enterprise Systems</p> <p>For additional details and to REGISTER, please visit <i><b><a href=""http://www.ibm.com/analytics/us/en/events/machine-learning/"">MACHINE LEARNING.</a></b></i></p> <p>Register NOW and we'll send you a reminder!</p> ","12600000","1395415218000","13471152","open","39.77000045776367","-86.11000061035156","Big Data Developers in Indianapolis","Big-Data-Developers-in-Indianapolis","Members","Livestream is Eastern Standard Time (EST) - Adjust to your time zone","237202718","https://www.meetup.com/Big-Data-Developers-in-Indianapolis/events/237202718/","","Machine Learning Launch","","","","past","1487185200000","1487198954000","-18000000","http://ibm.co/MLevent","","Indianapolis","us","25012526","0.0","USA","0.0","LIVESTREAM","","False","IN","","public","0","17"
