"comment_count","created","description","duration","group_created","group_id","group_join_mode","group_lat","group_lon","group_name","group_urlname","group_who","how_to_find_us","id","link","manual_attendance_count","name","rsvp_close_offset","rsvp_limit","rsvp_open_offset","status","time","updated","utc_offset","venue_address_1","venue_address_2","venue_city","venue_country","venue_id","venue_lat","venue_localized_country_name","venue_lon","venue_name","venue_phone","venue_repinned","venue_state","venue_zip","visibility","waitlist_count","yes_rsvp_count"
"3","1463492085000","<p>IBM is looking for smart, talented and self-driven individuals.</p> <p>This session will provide perspective on the new <b>hiring </b>positions within <b>IBM</b>’s Analytics - <b>Open Source</b> team.</p> <p>We will explain the expectations, interview process and how these positions can benefit you to jumpstart your career in new lucrative direction.</p> <p>The target audience for this session are: recent M.S./Ph.D graduates, Data Scientists, Open Source Enthusiasts, Technical Sales Representatives etc.</p> <p>This session is <b>free </b>of charge. Optional: please bring your most recent resume and be ready to give a soft and hard copy.</p> <p><b>PLEASE NOTE</b>: This event has limited number of seating. Please do not RSVP if you're not planning to attend.</p> <p><br/><b>Agenda</b></p> <p><br/>5:30 - 6:00 pm Registration &amp; Introductions</p> <p><br/>6:00 - 6:15 pm Open positions at IBM</p> <p>6:15 - 6:30 pm Interview Expectations</p> <p>6:30 - 6:45 pm IBM Workplace Discovery</p> <p><br/>7:00 - 7:15 pm Questions/Next Steps</p> <p>UPDATE:<br/>Here are the directions to get to the IBM - TEC location.</p> <p>1) Take I-40 West and take the Davis Dr. Exit #280. Turn right at the ramp.</p> <p>3) Go 1.2 miles on Davis Drive to stoplight at Cornwallis Rd.</p> <p>4) Go straight and enter IBM property through the Main Gate Visitor Entrance.</p> <p>5) Inform security you are going to B002 Main Lobby.</p> <p>6) Follow signs to Executive Briefing Centers and park at B002 visitor lot.</p> ","5400000","1397076013000","13827012","open","35.77000045776367","-78.63999938964844","Big Data Developers in Raleigh","Big-Data-Developers-in-Raleigh","Members","Building 002 IBM RTP Main Campus","231188627","https://www.meetup.com/Big-Data-Developers-in-Raleigh/events/231188627/","","IBM is Hiring... looking for innovative Open Source (Big Data) Candidates","PT24H","50","","past","1464298200000","1464305318000","-14400000","3039 E Cornwallis Rd","","Durham","us","24552431","35.90505599975586","USA","-78.85645294189453","IBM RTP - Technical Exploration Center","","False","NC","","public","0","38"
"7","1461977505000","<p>On June 6, 2016, leading minds in data and analytics from Tesla, Netflix, Silicon Valley Data Science, and IBM will come together to demonstrate how open data and analytics technologies such as R, Spark, Python and more are forming a vibrant ecosystem.  The community has a shared goal of working with all data to build unexpected insights and launch new business applications.</p> <p>The Apache Spark Maker Community Event will bring together data scientists, data engineers, data developers, and data designers June 6th @ 6pm at Galvanize, San Francisco. Here’s the plan:   </p> <p>- The Big Reveal – New sample Apache Spark apps and tools</p> <p>- Use Cases – Monsanto will share how they are using R and Spark to optimize their supply chain</p> <p>- Learning Session - Hear from experts working on Spark projects and building the Spark ecosystem of open data and analytics technologies</p> <p>- Networking Opportunity – Food, drinks and data, explore a Hall of Innovation showcasing Spark demos</p> <p>Join us. Learn more here:  <b><i><a href=""http://www.ibm.com/analytics/us/en/events/apache-spark/"">Apache Spark Maker Community Event</a></i></b> </p> <p>Registration begins at 5:30 PM and the discussion starts at 6:30 PM; food and drinks will be served. You must register for this event. </p> <p>To get your ticket, and attend in person, click <b><a href=""https://www.eventbrite.com/e/apache-sparktm-maker-community-event-registration-24742595770?cm_mc_uid=39680333471514613509392&amp;cm_mc_sid_50200000=1461961944"">HERE</a></b>. </p> <p>Can't attend in person? We'll be live streaming this event on a computer screen near you! Register for the  <b><a href=""https://www.eventbrite.com/e/livestream-apache-sparktm-maker-community-event-registration-24790223225?cm_mc_uid=39680333471514613509392&amp;cm_mc_sid_50200000=1461961944"">live stream</a></b> and we'll send you a calendar update and login link.</p> ","14400000","1397076013000","13827012","open","35.77000045776367","-78.63999938964844","Big Data Developers in Raleigh","Big-Data-Developers-in-Raleigh","Members","","230756657","https://www.meetup.com/Big-Data-Developers-in-Raleigh/events/230756657/","","Apache Spark Maker Community Event","","","","past","1465248600000","1465263857000","-14400000","44 Tehama Street","","San Francisco","us","24126294","37.78749465942383","USA","-122.39653015136719","Galvanize U","","False","CA","","public","0","23"
"41","1465397218000","<p>Apache <b>Spark </b>is an <b>open source </b>big data processing framework built around speed, ease of use, and sophisticated analytics. First developed in 2009, Spark provides several advantages over other big data and MapReduce technologies. With Spark, Hadoop clusters can run up to 100 times faster in memory, and 10 times faster when running on disk. With the ability to write applications in Java, Scala or even Python, Spark is a flexible and powerful paradigm.</p> <p>With IBM's ""Open for Data"" cloud computing initiative, current and prospective users can provision an instance of Spark in the cloud in a matter of minutes without up-front infrastructure investment. The power of the cloud empowers users to scale up massively based on business needs. De-provisioning resources when those needs change is equally as agile, giving our users the best value for performance.</p> <p><br/>Please join us on <b>Tuesday</b>,<b> June 28</b>, 2016 at <b>12:00</b> noon as we discuss Spark both deployed as a service and on premise. After an introduction to Spark, we'll talk about how to decide if your project is well suited for processing in the cloud. Finally we'll perform a brief demonstration. Food and beverages will be provided. Seats are limited, so sign up today!</p> <p>Presenter: Andrew Levine</p> ","","1397076013000","13827012","open","35.77000045776367","-78.63999938964844","Big Data Developers in Raleigh","Big-Data-Developers-in-Raleigh","Members","","231744087","https://www.meetup.com/Big-Data-Developers-in-Raleigh/events/231744087/","","Introduction to Spark In-memory Computing","","","","past","1467129600000","1467339769000","-14400000","3039 E Cornwallis Rd","","Durham","us","24552431","35.90505599975586","USA","-78.85645294189453","IBM RTP - Technical Exploration Center","","False","NC","","public","0","72"
"0","1464823047000","<p><b>THIS IS A GLOBAL ON-LINE HACKATHON THAT BEGINS MAY 23, 2016 AND <i>NOW ENDS AUGUST 23, 2016</i>.  SUBMISSIONS DUE AUGUST 23rd BY 5:00 PM EST. </b></p> <p><b>We’re extending the hackathon deadline to August 23</b> - that’s 20 additional days to build your Spark enterprise app. (View the revised competition calendar <b><a href=""http://apachespark.devpost.com/details/dates"">HERE</a></b><b>.  </b>We're giving you more time because....</p> <p>We’re adding <b>new enterprise data resources</b> to the site and we want to give you a chance to incorporate these into your projects, if you so choose.  Our awesome data co-sponsors <b><a href=""http://www.yelp.com/nyc"">Yelp</a></b> and <b><a href=""https://uncharted.software/"">Uncharted Software</a></b> have generously shared some of their enterprise data sets for you to use during the hackathon.</p> <p>Yelp’s data includes 2.2M reviews by 552K users for 77K businesses. The Uncharted data includes Bitcoin network transactions from processing the Bitcoin blockchain as of mid-2014 <i>and</i> Amazon product reviews from 1995 through 2003. For a fuller description and data access, visit our <b><a href=""http://apachespark.devpost.com/details/resources#datasets"">resources page</a></b>.</p> <p>Uncharted Software also has a couple cool Spark data visualization libraries you should check out: <b><a href=""http://unchartedsoftware.github.io/salt/"">Salt</a></b> and <b><a href=""http://unchartedsoftware.github.io/sparkpipe-core/"">SparkPipe.</a></b></p> <p>And, in case you’d like to weigh the effects of weather on business operations, we’re also offering access to the full suite of <b><a href=""http://apachespark.devpost.com/details/weather_data"">Weather Company APIs</a></b> for the duration of the hackathon.</p> <p>Finally, if you’re looking for a hosting solution for your Spark app, we’re now offering <b>extended Bluemix trials for all hackathon participants</b>. Using Bluemix services to build your project is <b><i>totally optional</i></b>, but might be a good way to get your app up and running — particularly with the IBM Analytics for Apache Spark service.</p> <p><b><a href=""http://apachespark.devpost.com/details/bluemix_promo"">You can request your extended Bluemix trial code here.</a> </b> For all hackathon participants, trials will extend through November 1, 2016. <i>Now go forth and optimize for the enterprise!</i></p> <p>---------------------</p> <p>Build an Apache Spark application to address a real business problem or core concern related to customer care, marketing, risk management or operations. Join IBM and Devpost for a global hackathon using <b><a href=""http://apachespark.devpost.com/?utm_source=facebook-partner&amp;utm_medium=wall-post&amp;utm_campaign=apachespark"">Apache Spark Makers Build</a></b>.  There are $100,000 in cash prizes.  Submissions can be sent in up to August 23rd.</p> <p><i>Participation Details: </i>To participate in the global virtual hackathon, you can <b><a href=""http://apachespark.devpost.com/?utm_source=facebook-partner&amp;utm_medium=wall-post&amp;utm_campaign=apachespark"">register here</a></b>.  Please review all registration guidelines.</p> <p>For the hack, you will apply Apache Spark's powerful analytics capabilities to enterprise and other relevant data so data scientists and software developers can build an analytics or mobile/web app that tackles a key business problem in marketing, customer case, operations or risk management.  The grand prize is $50,000, and the top three winners each get a meeting with the judge or<br/>Spark community expert of their choice; the judging panel includes data experts from Tesla, Netflix, and Silicon Valley Data Science.</p> <p>Go to <b><a href=""http://apachespark.devpost.com/?utm_source=facebook-partner&amp;utm_medium=wall-post&amp;utm_campaign=apachespark"">apachespark.devpost.com</a></b> for full details and registration.  Please review all registration rules.</p> <p><b> <i>Questions?</i></b></p> <p>We're here to help. If you have any questions about the hackathon, post on the <b><a href=""http://apachespark.devpost.com/forum_topics"">discussion forum</a></b> or email <b><i>support@devpost.com</i></b> and we'll respond as soon as we can.</p> ","","1397076013000","13827012","open","35.77000045776367","-78.63999938964844","Big Data Developers in Raleigh","Big-Data-Developers-in-Raleigh","Members","","231578463","https://www.meetup.com/Big-Data-Developers-in-Raleigh/events/231578463/","","Show Us Your Apps - Apache Spark Maker Build Global Hackathon","","","","past","1471986000000","1471998691000","-14400000","Any Street","","Any City","us","24581652","36.77825927734375","USA","-119.41793060302734","Global Online Hackathon","","False","CA","","public","0","9"
"0","1472473690000","<p>On September 27, 2016, leading minds in data and analytics will come together and unveil the latest in cloud technology, enabling you to more efficiently put data to work. Experience how Spark, Hadoop, Python, and more are being used to bring together all types of data professionals –from data engineers, to data scientists, developers and business analysts –to work in new collaborative ways.</p> <p>The IBM DataFirst Launch Event will unite data and analytics leaders and practitioners from the open source community, startups, and enterprises. Check the <i><b><a href=""http://www.ibm.com/analytics/us/en/events/datafirst/index.html"">event site</a></b></i> for the latest lineup of guest speakers. The event takes place @ 6pm at the Hudson Mercantile Building, NYC.</p> <p>Here’s the plan:<br/>• The Big Reveal –Experience new ways to work for data engineers, data scientist, developers, and business analysts, both individually and collectively.</p> <p>•Hands-on sessions – With interactive experiences for each of these professions.</p> <p>•Use Cases –Community leaders and guest speakers will share their expertise and vision<br/>•Networking Opportunity – Food, drinks, data, collaborative demos, and a party on the rooftop</p> <p>Learn more here:<a href=""http://www.ibm.com/analytics/us/en/events/datafirst/index.html#"">  <i><b>DataFirst Launch Event</b></i></a></p> <p>Check-in and networking begins at 6:00 PM.  Food and drinks will be served. You must register for this event.</p> <p>To get your ticket, and attend in person, click <b><a href=""https://www.eventbrite.com/e/ibm-datafirst-launch-event-registration-26725283041"">HERE</a></b>.  </p> <p>Can't attend in person? We'll be live streaming this event.  Register for the <b><a href=""https://www.eventbrite.com/e/livestream-ibm-datafirst-launch-event-registration-26906650516"">LIVE STREAM </a></b>and we'll send you a calendar update and login link. </p> ","14400000","1397076013000","13827012","open","35.77000045776367","-78.63999938964844","Big Data Developers in Raleigh","Big-Data-Developers-in-Raleigh","Members","zip 10018","233707739","https://www.meetup.com/Big-Data-Developers-in-Raleigh/events/233707739/","","DataFirst Launch Event – Experience new ways to put your data to work","","","","past","1475013600000","1475029771000","-14400000","500 West 36th Street","","New York","us","24745891","40.755863189697266","USA","-73.99864959716797","Hudson Mercantile Bldg","","False","NY","","public","0","4"
"18","1479483346000","<p><b>A Detailed Look at IBM's Data Science Experience</b></p> <p><br/>IBM Data Science Experience (DSX) is a new integrated environment built for data scientists and data engineers to ingest and analyze data, build models, and create valuable insights.</p> <p><br/>Based on open source tools, such as Python, R, Scala, and Spark,  DSX allows users to collaborate on projects within their teams and the broader data science community. </p> <p><br/>Please note:  In order to ensure that security allows you access to the IBM facility, you must pre-register through this link: </p> <p><br/><b><a href=""https://www.eventbrite.com/e/data-science-experience-a-detailed-look-tickets-29618572949""><a href=""https://www.eventbrite.com/e/data-science-experience-a-detailed-look-tickets-29618572949"" class=""linkified"">https://www.eventbrite.com/e/data-science-experience-a-detailed-look-tickets-29618572949</a>""</a></b></p> <p><br/>Seating is limited and your name must appear on the attendee list for security gate access. Please respond to the RSVP questions with your information.</p> <p><br/><i><b>Agenda:</b></i></p> <p><br/>6:30pm - Networking and Refreshments</p> <p>7:00-8:00pm - Data Science Experience (DSX) Presentation</p> <p>Directions: <br/>- Take I-40 to Davis Dr.  Head north on Davis Dr.<br/>- Go to IBM Security gate, tell them your name.  They will direct you to Bldg 002.</p> ","5400000","1397076013000","13827012","open","35.77000045776367","-78.63999938964844","Big Data Developers in Raleigh","Big-Data-Developers-in-Raleigh","Members","Bldg. 002 - IBM Security gate - you will be directed to Bldg 002","235672873","https://www.meetup.com/Big-Data-Developers-in-Raleigh/events/235672873/","","Data Science Experience - a Detailed Look","","","","past","1480635000000","1480641706000","-18000000","3039 E Cornwallis Rd","","Durham","us","24552431","35.90505599975586","USA","-78.85645294189453","IBM RTP - Technical Exploration Center","","False","NC","","public","0","68"
"0","1481831664000","<p>RSVP: <a href=""http://bit.ly/2gOcufe""><a href=""http://bit.ly/2gOcufe"" class=""linkified"">http://bit.ly/2gOcufe</a></a></p> <p>This webinar will cover an overview of Watson Data Platform capabilities and how to empower users across the organization to make the most out of their data. What if you can shorten the time it takes to create value out of your existing organizational data ? </p> <p>What if you can provision a common analytic engine with managed services that will enable you to embrace multiple cloud platforms ? IBM Watson Data Platform is the first cloud-based data and analytics platform to support cognitive businesses. It enables access, collaboration and paths to insights by connecting all users through trusted access to a variety of data, discovering new possibilities and opportunities with built-in intelligence, automation and machine learning and accelerating outcomes with rapid deployment of new data models and fast embedding of insights into processes, applications and services. </p> <p>Let us show you how Watson Data Platform can be the milestone of your organization analytics strategy and empower your organization into the new Cognitive analytics era.</p> <p><b>Speaker Bio: </b><br/>Gerardo Rodríguez Díaz – is an avid traveler, technologist enthusiast and Big data and Analytics cloud solution specialist focused on communications and computer systems integrations industries across North America. GRD areas of specialization are IT, Marketing and Business Intelligence having worked across European, North and South American markets.</p> ","3600000","1397076013000","13827012","open","35.77000045776367","-78.63999938964844","Big Data Developers in Raleigh","Big-Data-Developers-in-Raleigh","Members","Time is Eastern Standard Time","236263928","https://www.meetup.com/Big-Data-Developers-in-Raleigh/events/236263928/","","Making Data Simple in the Cognitive Era","","","","past","1482253200000","1482258639000","-18000000","http://bit.ly/2gOcufe","","Raleigh","us","24947655","0.0","USA","0.0","Live Webinar","","False","NC","","public","0","36"
"3","1485390635000","<p>The demand for machine learning is booming! </p> <p>Calling all IT executives, data scientists, Chief Data Officers, data architects and other data geeks.  Join us on <b>February 15th from 2:00-5:30 pm ET </b>via livestream  (replay available starting February 16th) , and discover how machine learning is fundamentally changing the way we work and live.  Hear about cognitive applications that anticipate behavior and learn from data without being explicitly programmed.</p> <p>You'll learn about the latest breakthrough developments on machine learning as well as Spark, data and analytics. Mike Gualtieri, Vice President and Principal Analyst, Forrester, will present his view on how to best leverage technologies such as big data, predictive analytics, Hadoop/Spark, machine learning, data science, and AI.  Rob Thomas, General Manager, IBM Analytics will host an agenda which will include guest speakers and cover the following topics:</p> <p>•  Machine Learning Overview</p> <p>•  Top Trends in Machine Learning &amp; Cognitive Applications</p> <p>•  Cognitive Analytics and Machine Learning for the Enterprise</p> <p>•  Live Product Demonstration &amp; Client Roundtable on Machine Learning</p> <p>•  Data Innovation with Hybrid Transaction/Analytical Processing</p> <p>•  Spark &amp; Machine Learning for Enterprise Systems</p> <p>For additional details and to REGISTER, please visit <i><b><a href=""http://www.ibm.com/analytics/us/en/events/machine-learning/"">MACHINE LEARNING.</a></b></i></p> <p>Register NOW and we'll send you a reminder!</p> ","12600000","1397076013000","13827012","open","35.77000045776367","-78.63999938964844","Big Data Developers in Raleigh","Big-Data-Developers-in-Raleigh","Members","Livestream is Eastern Standard Time (EST) - Adjust to your time zone","237203280","https://www.meetup.com/Big-Data-Developers-in-Raleigh/events/237203280/","","Machine Learning Launch","","","","past","1487185200000","1487268115000","-18000000","http://ibm.co/MLevent","","Raleigh","us","25012579","0.0","USA","0.0","LIVESTREAM","","False","NC","","public","0","100"
