"comment_count","created","description","duration","group_created","group_id","group_join_mode","group_lat","group_lon","group_name","group_urlname","group_who","how_to_find_us","id","link","manual_attendance_count","name","rsvp_close_offset","rsvp_limit","rsvp_open_offset","status","time","updated","utc_offset","venue_address_1","venue_address_2","venue_city","venue_country","venue_id","venue_lat","venue_localized_country_name","venue_lon","venue_name","venue_phone","venue_repinned","venue_state","venue_zip","visibility","waitlist_count","yes_rsvp_count"
"0","1473872345000","<p>Webcast on Youtube: <a href=""http://www.youtube.com/c/RomeoKienzler/live"" class=""embedded"">http://www.youtube.com/c/RomeoKienzler/live</a></p> ","1800000","1378937069000","10220112","open","47.380001068115234","8.539999961853027","Big Data Developers in Switzerland","Big-Data-Developers-Switzerland","Members","","234123291","https://www.meetup.com/Big-Data-Developers-Switzerland/events/234123291/","","Webcast@SDS: CrashCourse on DeepLearning4J on top of Spark (Romeo Kienzler, IBM)","","","","past","1473945300000","1473947985000","7200000","","","","","","","","","","","","","","public","0","8"
"0","1474463476000","<p>Webcast MipTec Basel: Massive parallel GPU accelerated DeepLearning in the cloud</p> <p><a href=""http://www.youtube.com/c/RomeoKienzler/live"" class=""embedded"">http://www.youtube.com/c/RomeoKienzler/live</a></p> <p>DeepLearning (DL) is currently taking off in various AI (Artificial Intelligence) domains like Image Recognition, NLP (Natural Language Processing) and Speech Recognition. But it also already entered the Life Science domain. Recently researchers from the University of Toronto implemented a DL Network able to predict Alternative Splicing (AS) patterns in individual tissues and differences in splicing patterns across tissues using a model inferred from mouse RNA-Seq data whereas Atomwise, a Silicon Valley based startup evaluates 8.2 million compounds on a IBM Blue Gene/Q supercomputer. GPUs are the key accelerator on DL - that´s why ""In Silico Medicine"" - a startup founded in Baltimore is closely partnering with NVIDIA. DL is at the early stages of development but in this talk we want to motivate machine learning experts to apply these algorithms on their problems and actively contributing to this emerging topic in AI research by providing a Open Source based framework for running massive parallel DL computations on GPU clusters in the Cloud by running DeepLearning4J, ND4J and jcuBLAS on top of ApacheSpark. First, we will introduce the overall architecture, followed by a live demonstration of the system and we end with a call for action to use and contribute to the framework.</p> <p><a href=""http://www.youtube.com/c/RomeoKienzler/live"" class=""embedded"">http://www.youtube.com/c/RomeoKienzler/live</a></p> ","1800000","1378937069000","10220112","open","47.380001068115234","8.539999961853027","Big Data Developers in Switzerland","Big-Data-Developers-Switzerland","Members","","234293127","https://www.meetup.com/Big-Data-Developers-Switzerland/events/234293127/","","Webcast MipTec Basel: Massive parallel GPU accelerated DeepLearning in the cloud","","","","past","1474555500000","1474559248000","7200000","","","","","","","","","","","","","","public","0","10"
"0","1472501091000","<p>On September 27, 2016, leading minds in data and analytics will come together and unveil the latest in cloud technology, enabling you to more efficiently put data to work. Experience how Spark, Hadoop, Python, and more are being used to bring together all types of data professionals –from data engineers, to data scientists, developers and business analysts –to work in new collaborative ways.</p> <p>The IBM DataFirst Launch Event will unite data and analytics leaders and practitioners from the open source community, startups, and enterprises. Check the <i><b><a href=""http://www.ibm.com/analytics/us/en/events/datafirst/index.html"">event site</a></b></i> for the latest lineup of guest speakers. The event takes place @ 6pm at the Hudson Mercantile Building, NYC.</p> <p>Here’s the plan:<br/>• The Big Reveal –Experience new ways to work for data engineers, data scientist, developers, and business analysts, both individually and collectively.</p> <p>•Hands-on sessions – With interactive experiences for each of these professions.</p> <p>•Use Cases –Community leaders and guest speakers will share their expertise and vision<br/>•Networking Opportunity – Food, drinks, data, collaborative demos, and a party on the rooftop</p> <p>Learn more here:<a href=""http://www.ibm.com/analytics/us/en/events/datafirst/index.html#"">  <i><b>DataFirst Launch Event</b></i></a></p> <p>Check-in and networking begins at 6:00 PM.  Food and drinks will be served. You must register for this event.</p> <p>To get your ticket, and attend in person, click <b><a href=""https://www.eventbrite.com/e/ibm-datafirst-launch-event-registration-26725283041"">HERE</a></b>.  </p> <p>Can't attend in person? We'll be live streaming this event.  Register for the <b><a href=""https://www.eventbrite.com/e/livestream-ibm-datafirst-launch-event-registration-26906650516"">LIVE STREAM </a></b>and we'll send you a calendar update and login link. </p> ","14400000","1378937069000","10220112","open","47.380001068115234","8.539999961853027","Big Data Developers in Switzerland","Big-Data-Developers-Switzerland","Members","zip 10018","233719099","https://www.meetup.com/Big-Data-Developers-Switzerland/events/233719099/","","DataFirst Launch Event – Experience new ways to put your data to work","","","","past","1474992000000","1475009051000","7200000","500 West 36th Street","","New York","us","24745891","40.755863189697266","USA","-73.99864959716797","Hudson Mercantile Bldg","","False","NY","","public","0","8"
"0","1479310149000","<p>IBM values our community of clients and business partners. Each year, we support and build our community by working closely with IBM advocates and helping them to become </p> <p><b><a href=""http://www.ibm.com/developerworks/champion/"">IBM Champions</a></b></p> <p>IBM Champions are a select group of external advocates made up of clients, business partners and independent consultants who make exceptional contributions to the technical community by speaking at conferences, running or actively participating in user groups, evangelizing relevant technical topics via social media, and helping our clients make the most of IBM technology. </p> <p>We are looking for clients and business partners to join the program and are looking for applications in the areas of data science, data engineering, application development, and business analytics.</p> <p><b>Nominations are due by Monday, November 28, 2016</b></p> <p>The Champion program is open to candidates worldwide, and candidates may self-nominate or be nominated by someone else. IBM employees are not eligible for the program.  Some benefits of the IBM Champion program: <br/>- IBM Champions advocate IBM offerings in the community with competence and credibility (content, blogs, presentations, customer references, analyst/press, videos/podcasts, etc.)<br/>- IBM Champions share knowledge with and provide support to the IBM user community (books, articles, blogs, forums, presentations, education, beta programs and customer advisory councils etc.)<br/>- IBM Champions support IBM as brand ambassadors who build awareness, share product knowledge, and provide product feedback as users and beta testers</p> <p>Read this  <b><a href=""https://www.ibm.com/developerworks/community/blogs/ibmchampion/entry/Nominate_an_IBM_Champion_Nominations_OPEN?lang=en"">blog post</a> </b> for full IBM Champion program criteria, guidelines and the <b>&lt;a&gt;nomination form&lt;/a&gt;</b>.</p> <p>To learn more about the IBM Champion program from current Champions and Worldwide IBM Champion coordinator Libby Ingrassia, listen to this <a href=""https://ibm2.webex.com/ec3100/eventcenter/recording/recordAction.do?theAction=poprecord&amp;siteurl=ibm2&amp;entappname=url3100&amp;internalRecordTicket=4832534b00000002ed04dabb7c4dfbe255318214758c39900441e206be2ecb71765e9832f1af34b8&amp;renewticket=0&amp;isurlact=true&amp;format=short&amp;rnd=3315557804&amp;RCID=3855f080a3a7e1133bcd207eefd89727&amp;rID=52765987&amp;needFilter=false&amp;recordID=52765987&amp;apiname=lsr.php&amp;AT=pb&amp;actappname=ec3100&amp;&amp;SP=EC&amp;entactname=%2FnbrRecordingURL.do&amp;actname=%2Feventcenter%2Fframe%2Fg.do""><b>webcast</b></a>. Be sure to share the blog and webcast with clients and colleagues who would make great IBM Champions.</p> ","","1378937069000","10220112","open","47.380001068115234","8.539999961853027","Big Data Developers in Switzerland","Big-Data-Developers-Switzerland","Members","","235622285","https://www.meetup.com/Big-Data-Developers-Switzerland/events/235622285/","","IBM Champions - Call for Nominations","","","","past","1480442400000","1480454521000","3600000","Any Street","","Any City","us","24904123","32.16562271118164","USA","-82.90007781982422","On-Line Only","","False","GA","","public","0","5"
"0","1481707184000","<p>Again I'd like to invite you to a group event of one of our peers:</p> <p>


<a href=""https://www.meetup.com/swiss-big-data/events/236020110/""><a href=""https://www.meetup.com/swiss-big-data/events/236020110/"" class=""linkified"">https://www.meetup.com/swiss-big-data/events/236020110/</a></a></p> <p>


Agenda</p> <p>18:00 Welcome &amp; Intro</p> <p>18:10<br/>Title: <b>Data Science and Data Products at Neue Zürcher Zeitung</b></p> <p>Abstract:<br/>With 236 years of age, Neue Zürcher Zeitung (NZZ) is one of the oldest still published newspapers in the world. However, despite its age, NZZ is far from being old-fashioned. Especially when it comes to data-driven decision making and data-driven innovation, NZZ has been investing a lot within the last three years. For wrangling large amounts of data we have been using Apache Spark for almost a year now – and do not regret this choice. It had not only given us flexibility with ad-hoc analytics, but also drives our data-products (in production). In this talk I will share some of our use cases as well as insights we gained over the last year with Apache Spark. I will especially talk about how we calculate article recommendations and showcase some new exciting data products which are currently in active development. </p> <p>Bio: <br/>René Pfitzner is the Lead Data Scientist at NZZ, Switzerland’s newspaper of records. He is interested in media innovation, especially algorithmic approaches for news media. Before joining NZZ he has been a research assistant at ETH Zurich, where his research broadly evolved around the topics “network theory” and “information networks”.</p> <p>18:50 tba</p> <p>19:30 Networking</p> ","","1378937069000","10220112","open","47.380001068115234","8.539999961853027","Big Data Developers in Switzerland","Big-Data-Developers-Switzerland","Members","","236232887","https://www.meetup.com/Big-Data-Developers-Switzerland/events/236232887/","","19th Swiss Big Data User Group Meeting","","","","past","1485190800000","1485203021000","3600000","Rämistrasse 101","","Zürich","ch","24945777","47.37653732299805","Switzerland","8.54809284210205"," ETH Zurich, Room HG D 3.2 ","","False","","","public","0","53"
"0","1485038574000","<p>IMPORTANT =&gt; We need to print badges, therefore please also Please register on this link as well as we have to print entry badges to the IBM location for you:</p> <p><a href=""https://www.eventbrite.com/e/ibm-watson-iot-meetup-tickets-31385879009"" class=""linkified"">https://www.eventbrite.com/e/ibm-watson-iot-meetup-tickets-31385879009</a></p> <p>17:30 - 18:00 Door Openings, Seat Finding, Sitting</p> <p>18:00 - 18:30 Introduction to the IBM Watson IoT Platfrom (IBM)</p> <p>18:30 - 19:00 Cognitive IoT Demo using DeepLearning with Theano and Lasagne (IBM)</p> <p>19:00 - 19:30 Remote and constant measurement of vital signs on animals (Piavita)</p> <p>19:30 - 20:30 Networking Apero</p> ","9900000","1378937069000","10220112","open","47.380001068115234","8.539999961853027","Big Data Developers in Switzerland","Big-Data-Developers-Switzerland","Members","","237100012","https://www.meetup.com/Big-Data-Developers-Switzerland/events/237100012/","","IBM Watson IoT Meetup","","","","past","1486485900000","1486504930000","3600000","Vulkanstrasse 106","","Zürich","ch","23881399","47.39302062988281","Switzerland","8.485879898071289","IBM Cloud Transformation Lab for Analytics and IoT","","False","","","public","0","47"
"1","1485388483000","<p>The demand for machine learning is booming! </p> <p>Calling all IT executives, data scientists, Chief Data Officers, data architects and other data geeks.  Join us on <b>February 15th from 2:00-5:30 pm ET </b>via livestream  (replay available starting February 16th) , and discover how machine learning is fundamentally changing the way we work and live.  Hear about cognitive applications that anticipate behavior and learn from data without being explicitly programmed.</p> <p>You'll learn about the latest breakthrough developments on machine learning as well as Spark, data and analytics. Mike Gualtieri, Vice President and Principal Analyst, Forrester, will present his view on how to best leverage technologies such as big data, predictive analytics, Hadoop/Spark, machine learning, data science, and AI.  Rob Thomas, General Manager, IBM Analytics will host an agenda which will include guest speakers and cover the following topics:</p> <p>•  Machine Learning Overview</p> <p>•  Top Trends in Machine Learning &amp; Cognitive Applications</p> <p>•  Cognitive Analytics and Machine Learning for the Enterprise</p> <p>•  Live Product Demonstration &amp; Client Roundtable on Machine Learning</p> <p>•  Data Innovation with Hybrid Transaction/Analytical Processing</p> <p>•  Spark &amp; Machine Learning for Enterprise Systems</p> <p>For additional details and to REGISTER, please visit <i><b><a href=""http://www.ibm.com/analytics/us/en/events/machine-learning/"">MACHINE LEARNING.</a></b></i></p> <p>Register NOW and we'll send you a reminder!</p> ","12600000","1378937069000","10220112","open","47.380001068115234","8.539999961853027","Big Data Developers in Switzerland","Big-Data-Developers-Switzerland","Members","Livestream is Eastern Standard Time (EST) - Adjust to your time zone","237202472","https://www.meetup.com/Big-Data-Developers-Switzerland/events/237202472/","","Machine Learning Launch","","","","past","1487163600000","1487178032000","3600000","http://ibm.co/MLevent","","Bern","ch","25012509","0.0","Switzerland","0.0","LIVESTREAM","","False","","","public","0","56"
"9","1493207187000","<p>IMPORTANT =&gt; We need to print badges, therefore please also Please register on this link as well as we have to print entry badges to the IBM location for you:</p> <p><a href=""https://www.eventbrite.com/e/data-scientists-get-the-experience-tickets-34069304206""><a href=""https://www.eventbrite.com/e/data-scientists-get-the-experience-tickets-34069304206"" class=""linkified"">https://www.eventbrite.com/e/data-scientists-get-the-experience-tickets-34069304206</a></a></p> <p><br/><b>Data Scientists - get the eXperience</b><br/><i>Master the art of data science</i></p> <p>Solve your toughest data challenges with the best tools and the latest expertise in a social environment built by data scientists.<br/>Join us for an evening of exciting talks from IBM Data Science experts, followed by enough time for food, drinks and networking.</p> <p>We look forward to seeing you there! Agenda Meet up Data Science Experience</p> <p>17:30              Arrival &amp; get together with food and drinks</p> <p>18:00             Welcome &amp; Keynote<br/>                        - Berni Schiefer, IBM Fellow, IBM Spark Technology Center, San Francisco</p> <p><br/>18:15  19:00  Introduction &amp; Demo - IBM Data Science Experience<br/>                       - Lea Lorenz, IBM Technical Sales Specialist for Data Science<br/>                       - Dominic Bertschi, IBM Client Technical Professional,<br/>                          Masterstudent Business Analytics ZAHW<br/>                          (Zürcher Hochschulen für angewandte Wissenschaften)</p> <p>19:00  19:45  Deep learning, Machine Learning<br/>                         - Tim Hasenfuss, Global Customer Insight Specialist &amp; Data Scientist</p> <p><br/>19:45    21:00  Drinks, Food and Networking with optional hands-on session<br/>                          Get your hands on the DSX and test the experience <br/>                           .... while having a drink :) <br/>                        <b>   Please bring your own laptop to test the experience! </b></p> <p>



Location: IBM Client Center, Lab, Vulkanstrasse 106 , 8010 Zurich, Switzerland (<a href=""https://www.ibm.com/ibm/clientcenter/zurich/""><a href=""https://www.ibm.com/ibm/clientcenter/zurich/"" class=""linkified"">https://www.ibm.com/ibm/clientcenter/zurich/</a></a>)</p> ","11700000","1378937069000","10220112","open","47.380001068115234","8.539999961853027","Big Data Developers in Switzerland","Big-Data-Developers-Switzerland","Members","https://www.ibm.com/ibm/clientcenter/zurich/pdf/IBM-Anfahrtsplan_deutsch.pdf)","239506276","https://www.meetup.com/Big-Data-Developers-Switzerland/events/239506276/","","Data Scientists - get the eXperience","","120","","past","1494517500000","1494759857000","7200000","Vulkanstrasse 106","","Zürich","ch","15964522","47.39302062988281","Switzerland","8.485883712768555","IBM Innovation Center Zurich,8010 Zurich","","False","","","public","0","54"
