"comment_count","created","description","duration","group_created","group_id","group_join_mode","group_lat","group_lon","group_name","group_urlname","group_who","how_to_find_us","id","link","manual_attendance_count","name","rsvp_close_offset","rsvp_limit","rsvp_open_offset","status","time","updated","utc_offset","venue_address_1","venue_address_2","venue_city","venue_country","venue_id","venue_lat","venue_localized_country_name","venue_lon","venue_name","venue_phone","venue_repinned","venue_state","venue_zip","visibility","waitlist_count","yes_rsvp_count"
"2","1396384286000","<p><b>TIME IS RUNNING OUT - REGISTER TODAY FOR THE BIG DATA AND ANALYTICS DEVELOPER DAY ON APRIL 30TH.  LINK PROVIDED BELOW.<br/></b></p> <p>


Join us and participate in an exclusive Big Data and Analytics Developer Day hosted by <b>Ironside Group</b> and IBM Big Data team. </p> <p><br/><b>YOU MUST REGISTER AT THIS LINK TO GET YOUR CONFIRMED SEAT AT THIS EVENT: </b>  <b><a href=""http://bit.ly/1dNZIpR""><a href=""http://bit.ly/1dNZIpR"" class=""linkified"">http://bit.ly/1dNZIpR</a></a></b></p> <p><br/>Ironside Group is a Premier IBM Business Partner working in the business analytics and predictive ananlytics space.  More information about Ironside Group can be found here: <b><a href=""http://www.ironsidegroup.com/""><a href=""http://www.ironsidegroup.com/"" class=""linkified"">http://www.ironsidegroup.com/</a></a><br/></b></p> <p>Open source Apache Hadoop is a great framework for distributed processing of large data sets. But there’s a difference between ""playing"" with big data versus solving real problems. The reality is that Hadoop alone might not be enough. Experience IBM’s <b>enterprise-class Hadoop</b> product, <b>InfoSphere BigInsights</b>, which enhances open source Hadoop with required enterprise capabilities including: analytics, visualization, security, standard SQL, enterprise HBase, developer/admin tools, Big Data Exploration and more. The morning session will include interactive <a href=""http://www-01.ibm.com/software/data/bigdata/use-cases.html""><b>Big</b> <b>Data use case</b></a> discussions, an overview of what is big data, live demonstrations of key Big Data and Analytic components.</p> <p><a href=""http://www.youtube.com/watch?v=B27SpLOOhWw&amp;feature=player_embedded"" class=""embedded"">http://www.youtube.com/watch?v=B27SpLOOhWw&amp;feature=player_embedded</a></p> <p>In the afternoon, get hands-on with Big Data using <b><a href=""http://www-01.ibm.com/software/data/infosphere/biginsights/quick-start/"">InfoSphere BigInsights Quick Start Edition</a></b>, with guidance from development experts. This is a unique opportunity to develop skills and learn about exciting technologies and techniques that you can immediately take back to your organization.</p> <p><br/>This event is FREE. Breakfast, Lunch and snacks will be provided.</p> <p><b>Agenda</b> (subject to change)</p> <p>9:00 am to 9:30 am - Breakfast &amp; Registration</p> <p>9:30 am to 10:15 am - Welcome and Keynote - Big Data Overview - Predictive Asset Optimization</p> <p>10:15 am to 11:15 am - Adding Value to your Organization Beyond Hadoop: An Enterprise View of Big Data</p> <p>11:15 am to 12:00 pm - Analytics for Everyone: Addressing the Analytic needs of the Enterprise</p> <p><br/>12:00 pm to 1:00 pm - Lunch</p> <p>1:00 pm to 5:00 pm - BigInsights Quick Start Edition Hands-on Lab (please bring your own laptop if you plan to participate)  </p> <p>5:00 PM Close Thank You for Attending</p> <p><br/>Labs will use BigInsights Quickstart VM. Here is a video on how to setup the BigInsights Quickstart VM. To learn more before hand and get hands on go to Big Data University.</p> <p><br/>Seating is limited, please adjust your RSVP accordingly.</p> <p><br/>To guarantee your seat, you must register here: <b><a href=""http://bit.ly/1dNZIpR""><a href=""http://bit.ly/1dNZIpR"" class=""linkified"">http://bit.ly/1dNZIpR</a></a></b><br/>Registration is required. You may let others know that you are going to this event by clicking on the YES RSVP button on this Meetup page—however— your seat can not be guaranteed until you officially register AT THIS LINK: <b><a href=""http://bit.ly/1dNZIpR""><a href=""http://bit.ly/1dNZIpR"" class=""linkified"">http://bit.ly/1dNZIpR</a></a></b></p> <p>Thanks and we look forward to seeing you soon!</p> ","28800000","1395415218000","13471152","open","39.77000045776367","-86.11000061035156","Big Data Developers in Indianapolis","Big-Data-Developers-in-Indianapolis","Members","","174753092","https://www.meetup.com/Big-Data-Developers-in-Indianapolis/events/174753092/","","Big Data & Analytics Developer Day","","","","past","1398862800000","1398892918000","-14400000","123 W. Louisiana Street","","Indianapolis","us","19296132","39.76245880126953","USA","-86.16098022460938","Crowne Plaza Hotel","317-631-2221","False","IN","46225","public","0","19"
"0","1415649199000","<p>CALLING ALL DEVELOPERS .... JOIN THE BIG DATA FOR SOCIAL GOOD CHALLENGE</p> <p>Big data exists in just about everything we use and do. It comes from phones, cars, roads, power lines, waterways, food crates, and innumerable other items you’d never think of as computers. This data speaks volumes about our collective behavior and society – so let’s use it to do something incredible! IBM invites developers and data enthusiasts to take a deep dive into real world civic issues using big data and the IBM Bluemix <a href=""https://ace.ng.bluemix.net/"">Analytics for Hadoop service</a>. Analyze one of our curated datasets or bring your own (provided it meets these requirements)! Use Hadoop and your data to create a clickable and interactive data visualization to highlight insights that you’ve found.</p> <p>Ready to get started? $40,000 in prizes will be awarded....</p> <p>Register here:<a href=""http://ibmhadoop.challengepost.com/""><a href=""http://ibmhadoop.challengepost.com/"" class=""linkified"">http://ibmhadoop.challengepost.com/</a></a></p> <p>What to Create: Participants must create a working, clickable, and interactive data visualization utilizing the <a href=""http://www.ibm.com/developerworks/library/ba-analytics-for-hadoop1/index.html"">Analytics for Hadoop service</a> on IBM Bluemix.</p> <p>Data Requirements: Your data visualization must analyze one or more datasets included in the curated list of datasets on the Data page OR meet the data size, content, and licensing requirements described on the <a href=""http://ibmhadoop.challengepost.com/details/data"">Data page</a>. The total size of the Datasets analyzed must be between 500MB - 7GB in size.</p> <p>Check out the requirements then go get your IBM Bluemix extended promo code and check out the <a href=""http://ibmhadoop.challengepost.com/details/data"">datasets</a>!</p> ","","1395415218000","13471152","open","39.77000045776367","-86.11000061035156","Big Data Developers in Indianapolis","Big-Data-Developers-in-Indianapolis","Members","","218600075","https://www.meetup.com/Big-Data-Developers-in-Indianapolis/events/218600075/","","Big Data for Social Good Challenge","","","","past","1415649600000","1415661776000","-18000000","Web only","","Global","us","23442562","33.86000061035156","USA","-84.4000015258789","Big Data for Social Good Challenge","","False","GA","","public","0","1"
"0","1415750460000","<p><i><b>THE BIG DATA FOR SOCIAL GOOD CHALLENGE BEGINS NOVEMBER 10, 2014 AND CONTINUES TO MARCH 3, 2015. </b></i></p> <p><b>CALLING ALL DEVELOPERS .... JOIN THE BIG DATA FOR SOCIAL GOOD CHALLENGE</b></p> <p>Big data exists in just about everything we use and do. It comes from phones, cars, roads, power lines, waterways, food crates, and innumerable other items you’d never think of as computers. This data speaks volumes about our collective behavior and society – so let’s use it to do something incredible! IBM invites developers and data enthusiasts to take a deep dive into real world civic issues using big data and the IBM Bluemix <a href=""https://ace.ng.bluemix.net/"">Analytics for Hadoop service</a>. Analyze one of our curated datasets or bring your own (provided it meets these requirements)! Use Hadoop and your data to create a clickable and interactive data visualization to highlight insights that you’ve found.</p> <p>Ready to get started? $40,000 in prizes will be awarded....</p> <p>Register here:<a href=""http://ibmhadoop.challengepost.com/""><a href=""http://ibmhadoop.challengepost.com/"" class=""linkified"">http://ibmhadoop.challengepost.com/</a></a></p> <p>What to Create: Participants must create a working, clickable, and interactive data visualization utilizing the <a href=""http://www.ibm.com/developerworks/library/ba-analytics-for-hadoop1/index.html"">Analytics for Hadoop service</a> on IBM Bluemix.</p> <p>Data Requirements: Your data visualization must analyze one or more datasets included in the curated list of datasets on the Data page OR meet the data size, content, and licensing requirements described on the <a href=""http://ibmhadoop.challengepost.com/details/data"">Data page</a>. The total size of the Datasets analyzed must be between 500MB - 7GB in size.</p> <p>Check out the requirements then go get your IBM Bluemix extended promo code and check out the <a href=""http://ibmhadoop.challengepost.com/details/data"">datasets</a>!</p> ","","1395415218000","13471152","open","39.77000045776367","-86.11000061035156","Big Data Developers in Indianapolis","Big-Data-Developers-in-Indianapolis","Members","","218626392","https://www.meetup.com/Big-Data-Developers-in-Indianapolis/events/218626392/","","Big Data for Social Good Challenge (See Details for Start/End)","","","","past","1425441600000","1425453335000","-18000000","Web only","","Global","us","23442562","33.86000061035156","USA","-84.4000015258789","Big Data for Social Good Challenge","","False","GA","","public","0","9"
"0","1434254748000","<p><i><b>THIS IS A WEB CONFERENCE ONLY.  TIME OF WEB CONFERENCE LOCALLY IS BASED ON LIVE-STREAM START - PACIFIC DAYLIGHT TIME. DETAILS TO CONNECT TO LIVE-STREAM ARE INDICATED BELOW.  </b></i></p> <p>Apache Spark is an open source processing engine built around speed, ease of use, and analytics. If you have large amounts of data that requires low latency processing that a typical Map Reduce program cannot provide, Spark is the alternative.</p> <p>Spark performs at speeds up to 100 times faster than Map Reduce for iterative algorithms or interactive data mining. Spark provides in-memory cluster computing for lightning fast speed and supports Java, Scala, and Python APIs for ease of development. Spark allows data scientists to build models quickly and supports iterative jobs on distributed datasets. This means more people can apply deep intelligence into applications to make everything smarter, including the Internet of Things (IoT), machine learning, web, mobile, social, business process and more. </p> <p>Do you believe in the value of Spark, in the speed, efficiency and flexibility of this in-memory compute engine? IBM does.  Emphatically.That's why we're committed to do everything we can to accelerate the adoption of Spark for enterprise analytics, where Spark promises seemingly unlimited value.</p> <p>On June 15, 2015, IBM will host a Spark Community event in San Francisco, California: IBM | Spark - The Start of Something Big in Data and Design. There will be a live demo showcase, refreshments, and a Town Hall discussion featuring some of the most trail-blazing data scientists in today's Spark Community, including:<br/>  Edd Dumbill, VP Strategy, Silicon Valley Data Science<br/>•  Mike Tamir, Chief Science Officer &amp; VP of Data Science &amp; Education at Galvanize<br/>•   Fernando Perez, Staff Scientist at Lawrence Berkeley National Laboratory &amp; Founding Investigator of the Berkeley Institute for Data Science<br/>•   Haoyuan Li, CEO and Founder of Tachyon Nexus<br/>•   Shankar Venkataraman, Distinguished Engineer &amp; CTO, IBM Analytics Platform at IBM<br/>•   Paco Nathan, Director, Community Evangelism, Databricks</p> <p>Spark Community members will also deliver 5-minute lightning talks to describe exciting projects they're working on.</p> <p>We will provide a livestream presentation of what these Spark leaders have to say.</p> <p><b>Live Streaming Link:</b></p> <p><b>To get additional details about Spark you can sign up now for a reminder at:</b></p> <p><b><a href=""http://www.ibm.com/analytics/us/en/technology/spark/""><a href=""http://www.ibm.com/analytics/us/en/technology/spark/"" class=""linkified"">http://www.ibm.com/analytics/us/en/technology/spark/</a></a></b></p> <p><b>Scroll down to ""Can't attend in Person""?  Sign up for a reminder and add it to your calendar.</b></p> <p>Additional information on Spark:</p> <p>Link to Spark Fundamentals Course in Big Data University</p> <p><a href=""http://bigdatauniversity.com/bdu-wp/bdu-course/spark-fundamentals/""><a href=""http://bigdatauniversity.com/bdu-wp/bdu-course/spark-fundamentals/"" class=""linkified"">http://bigdatauniversity.com/bdu-wp/bdu-course/spark-fundamentals/</a></a></p> <p>Link to Spark Technology Information</p> <p><a href=""http://www.ibm.com/analytics/us/en/technology/spark/""><a href=""http://www.ibm.com/analytics/us/en/technology/spark/"" class=""linkified"">http://www.ibm.com/analytics/us/en/technology/spark/</a></a></p> <p>Happy Sparking.</p> ","6300000","1395415218000","13471152","open","39.77000045776367","-86.11000061035156","Big Data Developers in Indianapolis","Big-Data-Developers-in-Indianapolis","Members","","223231343","https://www.meetup.com/Big-Data-Developers-in-Indianapolis/events/223231343/","","IBM | Spark - The start of something big in data & design (Web Conference Only)","","","","past","1434420000000","1434428599000","-14400000","","","","","","","","","","","","","","public","0","8"
"0","1437600734000","<p><b>REGISTRATION FOR THIS EVENT IS NOW CLOSED. PLEASE REGISTER ON-SITE. QUESTIONS: CALL NANCY BERLIN 770-454-9730.</b></p> <p><br/><b><a href=""http://ibm.co/1g6m20N""><a href=""http://ibm.co/1g6m20N"" class=""linkified"">http://ibm.co/1g6m20N</a></a></b></p> <p><br/>Do you have trouble getting access to the data that you'd like to use for business intelligence or predictive analytics?  Are you spending all your time aggregating and modeling data for performance versus asking insightful questions?  Do you need permission to execute what-if and ad-hoc analysis? </p> <p>Hundreds of organizations like yours are able to stop burdening IT by making their Analytics process Simpler, Faster and Smarter with IBM.  Join us to experience IBM’s enterprise-class Analytics platform which enables highly performant self-service capabilities including business intelligence, predictive analytics and data warehouse appliances.</p> <p><br/>Join us on<b> Thursday, August 27th</b> to learn how IBM and Perficient (a premier IBM Business Partner) are helping businesses gain visibility and insight with exceptional performance to accelerate their businesses and drive better outcomes.  <b>This is a client-only event. </b></p> <p><i><b>Register here to confirm your seat at this event:</b></i>  <b><a href=""http://ibm.co/1g6m20N""><a href=""http://ibm.co/1g6m20N"" class=""linkified"">http://ibm.co/1g6m20N</a></a></b><b><a href=""http://ibm.co/1P2E4uH"">&lt;/a&gt;</b></p> <p>Perficient is a Premier IBM Business Partner working in the business analytics and predictive ananlytics space.  More information about Perficient can be found here: <b>&lt;a href=""http://www.perficient.com""&gt;www.perficient.com</a></b></p> <p><b>Agenda </b>(subject to change)</p> <p>8:30am: Registration Check-in/Networking /Breakfast</p> <p>9:00am: Keynote - Introduction &amp; Industry Case Studies</p> <p>9:30 am: Enabling Blazing Fast Answers to Insightful Questions</p> <p>10:00am: Enabling Smarter Predictive Analytics</p> <p>11:05am:  Making Adhoc Business Intelligence Simple</p> <p>12:00pm: Lunch &amp; Introduction to Perficient Services Offerings</p> <p>12:45pm: Summary &amp; Adjourn</p> <p><br/><b><i>Don't forget to register here:</i> </b> <b><a href=""http://ibm.co/1g6m20N""><a href=""http://ibm.co/1g6m20N"" class=""linkified"">http://ibm.co/1g6m20N</a></a></b><b>&lt;a href=""http://ibm.co/1P2E4uH""&gt;&lt;/a&gt;</b></p> <p>We look forward to seeing you at the event!</p> ","16200000","1395415218000","13471152","open","39.77000045776367","-86.11000061035156","Big Data Developers in Indianapolis","Big-Data-Developers-in-Indianapolis","Members","","224104274","https://www.meetup.com/Big-Data-Developers-in-Indianapolis/events/224104274/","","Accelerate your Business with Smarter Analytics","","","","past","1440678600000","1440696924000","-14400000","8650 Keystone Crossing","","Indianapolis","us","23981150","39.91315460205078","USA","-86.109619140625","Seasons 52 Restaurant","","False","IN","46240","public","0","14"
"1","1441938700000","<p>REGISTER FOR THIS EVENT NOW - SEE LINK BELOW.  REGISTRATION WILL CLOSE ON SUNDAY, 10/18.</p> <p><b>In order to confirm your seat at this event (space is limited), you must register at this URL: <a href=""http://ibm.co/1Lmx35Z"">ibm.co/1Lmx35Z</a></b></p> <p><br/>Join us for a very exciting Internet of Things (IoT) Developer Day at the Kentucky Speedway on Tuesday, October 20th at 8:30 am in Sparta, Kentucky.</p> <p><br/>This Developer Day will be co-sponsored by CloudOne, a premier IBM Business Partner,  and the IBM Big Data &amp; Analytics team.  <b><i>Please note that this is a customer event only.</i></b></p> <p>CloudOne helps the world’s best companies make their things for the Internet of Things. The company brings enterprise applications to the cloud, enabling global collaborative development, production and analysis of software and products in real time on individual, secure, private hybrid cloud environments. Trusted by leading brands, CloudOne’s scalable technology is supported by a team of experts and partners who share a passion for making it easier, faster and more economical to make things for the Internet of Things. For more information, visit <a href=""http://www.oncloudone.com""><a href=""http://www.oncloudone.com"" class=""linkified"">http://www.oncloudone.com</a></a>.</p> <p><br/><b>In order to confirm your seat at this event (space is limited), you must register at this URL: <a href=""http://ibm.co/1Lmx35Z"">ibm.co/1Lmx35Z</a></b></p> <p><i><b>SPECIAL NOTE:  The first 30 customers to enroll through the registration link and be confirmed in this event will receive a free Pace Car ride during the afternoon of the event.  </b></i><i><b>(click <a href=""http://www.kentuckyspeedway.com/handler.cfm/template,video/cat_id,48166?med_id=1542431"">Pace Car</a> to get an idea of what it will be like)</b></i></p> <p> The Internet of Things (IoT) is hot, but many are tired of the chatter and ready for action.  Today’s applications are expected to manage a variety of structured and unstructured data, accessed by massive networks of users, devices, and business locations, or even sensors, vehicles and Internet-enabled goods.</p> <p>In today’s continuously changing, always connected business environment, you must make the best possible decisions and put them into action immediately. Real-time actionable insight provides the robust big data and analytics capabilities that allow you to capture, analyze and act on all relevant data, including the stream of data generated by the myriad devices that make up the Internet of Things. Marketers, sales managers, financial analysts and other business users gain the insights they need to act in real time based on timely, trusted data.</p> <p>As you expand big data and analytics capabilities throughout your organization, you need to empower all of your business users to access and analyze data for faster insight. Taking delivery of software, solutions, infrastructure, platforms and services on the cloud can accelerate the value of big data and analytics capabilities, offering scalability with limited upfront investment.</p> <p>Join us to learn about how IBM and CloudOne are helping clients rapidly deliver solutions to Capture, Analyze and Act on IoT data in Real-Time.  The Developer Day kicks off at 8:30am with food and beverages/registration. Bring your laptop because after the morning session, our subject matter experts will help you get hands-on with the technology. </p> <p><b>Agenda (subject to change)</b></p> <p>08:30-09:00 - Registration, Networking &amp; Breakfast<br/>09:00-10:00 - Keynote - IoT Solutions Overview<br/>10:00-12:00 - Capture, Analyze &amp; Act on IoT Data in Real-time<br/>- Internet of Things (IoT) Foundation Overview<br/>- Predictive Maintenance &amp; Quality Overview<br/>- Data Platform for the Internet of Things (IoT)<br/>12:00-01:00 - Lunch &amp; Bluemix Overview/Demo<br/>01:00-04:00 - Hands-on Labs</p> <p>The event will be held at the Kentucky Speedway.  The first 30 people who enroll through the registration link and are confirmed, will receive a free PACE CAR ride on the track.  This event is FREE. Breakfast, Lunch and snacks will be provided. </p> <p><b>Seating is limited.  In order to confirm your seat, you must register at this URL: <a href=""http://ibm.co/1Lmx35Z"">ibm.co/1Lmx35Z</a> </b></p> <p><b> Thank you and we look forward to seeing you at the event</b></p> ","27000000","1395415218000","13471152","open","39.77000045776367","-86.11000061035156","Big Data Developers in Indianapolis","Big-Data-Developers-in-Indianapolis","Members","","225274335","https://www.meetup.com/Big-Data-Developers-in-Indianapolis/events/225274335/","","Big Data & Analytics for the Internet of Things (IoT)","","","","past","1445344200000","1445389662000","-14400000","1 Speedway Drive","","Sparta","us","24083298","38.70556640625","USA","-84.92398071289062","Kentucky Speedway","","False","KY","41086","public","0","7"
