"comment_count","created","description","duration","group_created","group_id","group_join_mode","group_lat","group_lon","group_name","group_urlname","group_who","how_to_find_us","id","link","manual_attendance_count","name","rsvp_close_offset","rsvp_limit","rsvp_open_offset","status","time","updated","utc_offset","venue_address_1","venue_address_2","venue_city","venue_country","venue_id","venue_lat","venue_localized_country_name","venue_lon","venue_name","venue_phone","venue_repinned","venue_state","venue_zip","visibility","waitlist_count","yes_rsvp_count"
"0","1464824709000","<p><b>THIS IS A GLOBAL ON-LINE HACKATHON THAT BEGINS MAY 23, 2016 AND <i>NOW ENDS AUGUST 23, 2016</i>.  SUBMISSIONS DUE AUGUST 23rd BY 5:00 PM EST. </b></p> <p><b>We’re extending the hackathon deadline to August 23</b> - that’s 20 additional days to build your Spark enterprise app. (View the revised competition calendar <b><a href=""http://apachespark.devpost.com/details/dates"">HERE</a></b><b>.  </b>We're giving you more time because....</p> <p>We’re adding <b>new enterprise data resources</b> to the site and we want to give you a chance to incorporate these into your projects, if you so choose.  Our awesome data co-sponsors <b><a href=""http://www.yelp.com/nyc"">Yelp</a></b> and <b><a href=""https://uncharted.software/"">Uncharted Software</a></b> have generously shared some of their enterprise data sets for you to use during the hackathon.</p> <p>Yelp’s data includes 2.2M reviews by 552K users for 77K businesses. The Uncharted data includes Bitcoin network transactions from processing the Bitcoin blockchain as of mid-2014 <i>and</i> Amazon product reviews from 1995 through 2003. For a fuller description and data access, visit our <b><a href=""http://apachespark.devpost.com/details/resources#datasets"">resources page</a></b>.</p> <p>Uncharted Software also has a couple cool Spark data visualization libraries you should check out: <b><a href=""http://unchartedsoftware.github.io/salt/"">Salt</a></b> and <b><a href=""http://unchartedsoftware.github.io/sparkpipe-core/"">SparkPipe.</a></b></p> <p>And, in case you’d like to weigh the effects of weather on business operations, we’re also offering access to the full suite of <b><a href=""http://apachespark.devpost.com/details/weather_data"">Weather Company APIs</a></b> for the duration of the hackathon.</p> <p>Finally, if you’re looking for a hosting solution for your Spark app, we’re now offering <b>extended Bluemix trials for all hackathon participants</b>. Using Bluemix services to build your project is <b><i>totally optional</i></b>, but might be a good way to get your app up and running — particularly with the IBM Analytics for Apache Spark service.</p> <p><b><a href=""http://apachespark.devpost.com/details/bluemix_promo"">You can request your extended Bluemix trial code here.</a> </b> For all hackathon participants, trials will extend through November 1, 2016. <i>Now go forth and optimize for the enterprise!</i></p> <p>---------------------</p> <p>Build an Apache Spark application to address a real business problem or core concern related to customer care, marketing, risk management or operations. Join IBM and Devpost for a global hackathon using <b><a href=""http://apachespark.devpost.com/?utm_source=facebook-partner&amp;utm_medium=wall-post&amp;utm_campaign=apachespark"">Apache Spark Makers Build</a></b>.  There are $100,000 in cash prizes.  Submissions can be sent in up to August 23rd.</p> <p><i>Participation Details: </i>To participate in the global virtual hackathon, you can <b><a href=""http://apachespark.devpost.com/?utm_source=facebook-partner&amp;utm_medium=wall-post&amp;utm_campaign=apachespark"">register here</a></b>.  Please review all registration guidelines.</p> <p>For the hack, you will apply Apache Spark's powerful analytics capabilities to enterprise and other relevant data so data scientists and software developers can build an analytics or mobile/web app that tackles a key business problem in marketing, customer case, operations or risk management.  The grand prize is $50,000, and the top three winners each get a meeting with the judge or<br/>Spark community expert of their choice; the judging panel includes data experts from Tesla, Netflix, and Silicon Valley Data Science.</p> <p>Go to <b><a href=""http://apachespark.devpost.com/?utm_source=facebook-partner&amp;utm_medium=wall-post&amp;utm_campaign=apachespark"">apachespark.devpost.com</a></b> for full details and registration.  Please review all registration rules.</p> <p><b> <i>Questions?</i></b></p> <p>We're here to help. If you have any questions about the hackathon, post on the <b><a href=""http://apachespark.devpost.com/forum_topics"">discussion forum</a></b> or email <b><i>support@devpost.com</i></b> and we'll respond as soon as we can.</p> ","","1351264537000","5571042","open","40.45000076293945","-79.98999786376953","Big Data Developers in Pittsburgh","Big-Data-Developers-in-Pittsburgh","Data science enthusiasts","","231579298","https://www.meetup.com/Big-Data-Developers-in-Pittsburgh/events/231579298/","","Show Us Your Apps - Apache Spark Maker Build Global Hackathon","","","","past","1471986000000","1471998691000","-14400000","Any Street","","Any City","us","24581652","36.77825927734375","USA","-119.41793060302734","Global Online Hackathon","","False","CA","","public","0","2"
"0","1472500489000","<p>On September 27, 2016, leading minds in data and analytics will come together and unveil the latest in cloud technology, enabling you to more efficiently put data to work. Experience how Spark, Hadoop, Python, and more are being used to bring together all types of data professionals –from data engineers, to data scientists, developers and business analysts –to work in new collaborative ways.</p> <p>The IBM DataFirst Launch Event will unite data and analytics leaders and practitioners from the open source community, startups, and enterprises. Check the <i><b><a href=""http://www.ibm.com/analytics/us/en/events/datafirst/index.html"">event site</a></b></i> for the latest lineup of guest speakers. The event takes place @ 6pm at the Hudson Mercantile Building, NYC.</p> <p>Here’s the plan:<br/>• The Big Reveal –Experience new ways to work for data engineers, data scientist, developers, and business analysts, both individually and collectively.</p> <p>•Hands-on sessions – With interactive experiences for each of these professions.</p> <p>•Use Cases –Community leaders and guest speakers will share their expertise and vision<br/>•Networking Opportunity – Food, drinks, data, collaborative demos, and a party on the rooftop</p> <p>Learn more here:<a href=""http://www.ibm.com/analytics/us/en/events/datafirst/index.html#"">  <i><b>DataFirst Launch Event</b></i></a></p> <p>Check-in and networking begins at 6:00 PM.  Food and drinks will be served. You must register for this event.</p> <p>To get your ticket, and attend in person, click <b><a href=""https://www.eventbrite.com/e/ibm-datafirst-launch-event-registration-26725283041"">HERE</a></b>.  </p> <p>Can't attend in person? We'll be live streaming this event.  Register for the <b><a href=""https://www.eventbrite.com/e/livestream-ibm-datafirst-launch-event-registration-26906650516"">LIVE STREAM </a></b>and we'll send you a calendar update and login link. </p> ","14400000","1351264537000","5571042","open","40.45000076293945","-79.98999786376953","Big Data Developers in Pittsburgh","Big-Data-Developers-in-Pittsburgh","Data science enthusiasts","zip 10018","233718778","https://www.meetup.com/Big-Data-Developers-in-Pittsburgh/events/233718778/","","DataFirst Launch Event – Experience new ways to put your data to work","","","","past","1475013600000","1475029772000","-14400000","500 West 36th Street","","New York","us","24745891","40.755863189697266","USA","-73.99864959716797","Hudson Mercantile Bldg","","False","NY","","public","0","6"
"0","1481833423000","<p>RSVP: <a href=""http://bit.ly/2gOcufe""><a href=""http://bit.ly/2gOcufe"" class=""linkified"">http://bit.ly/2gOcufe</a></a></p> <p>This webinar will cover an overview of Watson Data Platform capabilities and how to empower users across the organization to make the most out of their data. What if you can shorten the time it takes to create value out of your existing organizational data ? </p> <p>What if you can provision a common analytic engine with managed services that will enable you to embrace multiple cloud platforms ? IBM Watson Data Platform is the first cloud-based data and analytics platform to support cognitive businesses. It enables access, collaboration and paths to insights by connecting all users through trusted access to a variety of data, discovering new possibilities and opportunities with built-in intelligence, automation and machine learning and accelerating outcomes with rapid deployment of new data models and fast embedding of insights into processes, applications and services. </p> <p>Let us show you how Watson Data Platform can be the milestone of your organization analytics strategy and empower your organization into the new Cognitive analytics era.</p> <p><b>Speaker Bio: </b><br/>Gerardo Rodríguez Díaz – is an avid traveler, technologist enthusiast and Big data and Analytics cloud solution specialist focused on communications and computer systems integrations industries across North America. GRD areas of specialization are IT, Marketing and Business Intelligence having worked across European, North and South American markets.</p> ","3600000","1351264537000","5571042","open","40.45000076293945","-79.98999786376953","Big Data Developers in Pittsburgh","Big-Data-Developers-in-Pittsburgh","Data science enthusiasts","Time is Eastern Standard Time","236264662","https://www.meetup.com/Big-Data-Developers-in-Pittsburgh/events/236264662/","","Making Data Simple in the Cognitive Era","","","","past","1482253200000","1482258639000","-18000000","http://bit.ly/2gOcufe","","Pittsburgh","us","24947697","0.0","USA","0.0","Live Webinar","","False","PA","","public","0","10"
"5","1485430604000","<p>The demand for machine learning is booming! </p> <p>Calling all IT executives, data scientists, Chief Data Officers, data architects and other data geeks.  Join us on <b>February 15th from 2:00-5:30 pm ET </b>via livestream  (replay available starting February 16th) , and discover how machine learning is fundamentally changing the way we work and live.  Hear about cognitive applications that anticipate behavior and learn from data without being explicitly programmed.</p> <p>You'll learn about the latest breakthrough developments on machine learning as well as Spark, data and analytics. Mike Gualtieri, Vice President and Principal Analyst, Forrester, will present his view on how to best leverage technologies such as big data, predictive analytics, Hadoop/Spark, machine learning, data science, and AI.  Rob Thomas, General Manager, IBM Analytics will host an agenda which will include guest speakers and cover the following topics:</p> <p>•  Machine Learning Overview</p> <p>•  Top Trends in Machine Learning &amp; Cognitive Applications</p> <p>•  Cognitive Analytics and Machine Learning for the Enterprise</p> <p>•  Live Product Demonstration &amp; Client Roundtable on Machine Learning</p> <p>•  Data Innovation with Hybrid Transaction/Analytical Processing</p> <p>•  Spark &amp; Machine Learning for Enterprise Systems</p> <p>For additional details and to REGISTER, please visit <i><b><a href=""http://www.ibm.com/analytics/us/en/events/machine-learning/"">MACHINE LEARNING.</a></b></i></p> <p>Register NOW and we'll send you a reminder!</p> ","12600000","1351264537000","5571042","open","40.45000076293945","-79.98999786376953","Big Data Developers in Pittsburgh","Big-Data-Developers-in-Pittsburgh","Data science enthusiasts","Livestream is Eastern Standard Time (EST) - Adjust to your time zone","237213640","https://www.meetup.com/Big-Data-Developers-in-Pittsburgh/events/237213640/","","Machine Learning Launch","","","","past","1487185200000","1487198955000","-18000000","http://ibm.co/MLevent","","Pittsburgh","us","25013241","0.0","USA","0.0","LIVESTREAM","","False","PA","","public","0","24"
"8","1487544851000","<p>IBM is offering a free hands-on lab for clients and practitioners on Apache Spark. This is a full day of education on Spark with hands on exercises instructed in person by Spark experts. The lab will provide a detail overview of Apache Spark. The exercises will be performed on Jupyter notebooks with publicly available datasets. Participants will use IBM’s fully managed free Cloud platform available for educational purposes.</p> <p>To confirm your seat, please register here:<i><b>  <a href=""http://bit.ly/2lxcK3F""><br/></a></b></i></p> <p><i><b><a href=""https://www.eventbrite.com/e/pittsburgh-pa-introduction-to-apache-spark-for-data-engineers-data-scientists-and-developers-tickets-32161092694"">                       Apache Spark Hands-On</a></b></i></p> <p><br/><i><b>Who should go: </b></i><br/>Anyone interested in learning more about Apache Spark</p> <p><i><b>Prerequisite: </b></i><br/>A working knowledge of Coding (Preferred Python and/or Scala), understand distributed computing, Spark and SQL.</p> <p><i><b>What to expect: </b></i><br/>A full day of lecture and hands on exercises attacking real-world data challenges using Apache Spark. In 8 hours you will learn the essentials of Apache Spark and why it's important to your organization. This workshop will focus on data wrangling and machine learning.</p> <p>Please sign up for a free Bluemix (<b><a href=""http://datascience.ibm.com"">www.bluemix.net</a></b>) and DSX (<b><a href=""http://datascience.ibm.com""><a href=""http://datascience.ibm.com"" class=""linkified"">http://datascience.ibm.com</a></a></b>) account ahead of time.</p> <p>****** You must bring your own laptop *****</p> <p>Lunch and breakfast will be served</p> <p><i><b>Full Day Agenda:</b></i></p> <p><i><b><br/></b></i></p> <p>- Breakfast, Socialize<br/>- Kickoff, Apache Spark Overview<br/>- Lab 1, Hello Spark - Hand on exercise<br/>- Apache Spark SQL Overview<br/>- Lab 2, Spark SQL - Hands on exercises<br/>- LUNCH<br/>- Overview of Data Science &amp; Machine Learning w/ Apache Spark<br/>- Lab 3, Machine Learning w/ Spark – Hands on exercises<br/>- SparkR, Spark Streaming demonstrations<br/>- Wrap up – Feedback from attendees</p> <p>You must register to confirm your seat:   <b><a href=""http://bit.ly/2lxcK3F""><br/></a></b></p> <p><b><a href=""https://www.eventbrite.com/e/pittsburgh-pa-introduction-to-apache-spark-for-data-engineers-data-scientists-and-developers-tickets-32161092694"">                              <i> Apache Spark Hands-On</i></a><br/></b></p> ","27000000","1351264537000","5571042","open","40.45000076293945","-79.98999786376953","Big Data Developers in Pittsburgh","Big-Data-Developers-in-Pittsburgh","Data science enthusiasts","zip 15222","237835686","https://www.meetup.com/Big-Data-Developers-in-Pittsburgh/events/237835686/","","Introduction to Apache Spark with Hands-on Lab","","","","past","1489581000000","1489617925000","-14400000","945 Penn Avenue ","","Pittsburgh","us","25061290","40.44436264038086","USA","-79.99650573730469","Courtyard Pittsburgh Downtown","","False","PA","","public","0","20"
