"comment_count","created","description","duration","group_created","group_id","group_join_mode","group_lat","group_lon","group_name","group_urlname","group_who","how_to_find_us","id","link","manual_attendance_count","name","rsvp_close_offset","rsvp_limit","rsvp_open_offset","status","time","updated","utc_offset","venue_address_1","venue_address_2","venue_city","venue_country","venue_id","venue_lat","venue_localized_country_name","venue_lon","venue_name","venue_phone","venue_repinned","venue_state","venue_zip","visibility","waitlist_count","yes_rsvp_count"
"15","1456833510000","<p><b>Comparison of various streaming technologies</b></p> <p>This meetup will take us through the various streaming technologies such as Storm, Flink, Infosphere Streams and Spark Streaming.<b><br/></b></p> <p><b> Agenda</b></p> <p>• Characteristics of streaming technologies</p> <p>• Introduction to Apache Storm, Trident and Flink</p> <p>• Examples of Code and API</p> <p>• Deep-dive of Spark Streaming</p> <p>• Comparison of Spark Streaming with other streaming technologies</p> <p>• Benchmark of Spark Streaming (with code walkthrough)</p> <p>We will supplement theory concepts with sufficient examples </p> <p><b> ________________________________________________</b></p> <p><b>Spark Technology Center, IBM India - We are hiring!</b></p> <p>Looking for developers with strong focus on Spark.</p> <p>Contributions to Apache Spark would be a huge plus. to identify opportunities</p> <p>_______________________________________________</p> <p>We are also hiring <b>Hadoop committers</b> (Hadoop, Ambari, Hive, HBase committers) for our Hadoop team!</p> <p>



Please send resumes to <b>pavanpai@in.ibm.com</b></p> ","7200000","1363882301000","7722222","open","12.970000267028809","77.55999755859375","Bangalore Spark Enthusiasts","Bangalore-Spark-Enthusiasts","Spark Enthusiasts","Our campus is on the Inner Ring Road connecting Domlur with Koramangala","229252514","https://www.meetup.com/Bangalore-Spark-Enthusiasts/events/229252514/","","Comparison of various streaming technologies","","","","past","1457757000000","1458011086000","19800000","IBM India Private Limited, Embassy Golf Links,"," Off Indira Nagar-Koramangala Intermediate Ring Road","Bangalore","in","14083242","12.953020095825195","India","77.64331817626953","IBM India Pvt Ltd - A Block ","","False","","","public","0","222"
"24","1457937220000","<p>Hi Spark Enthusiasts,</p> <p>We have finalized our agenda for the meetup on Saturday, April 16th. Data Scientist <a href=""https://www.linkedin.com/in/saeedaghabozorgi"">Saeed Aghabozorgi</a> from IBM's Toronto Lab will talk about Data Science as it relates to Spark and show some demos.</p> <p>



<b>Agenda:</b></p> <p>• Data Science and Spark</p> <p>• Intro to Big Data University</p> <p>• Data Scientist Workbench</p> <p>• Spark programming with Python</p> <p>• Spark streaming demo</p> <p>


Please spread the word and encourage your friends and colleagues to signup for this meetup.</p> <p><br/>Cheers,</p> <p><b>Spark Technology Center</b></p> ","7200000","1363882301000","7722222","open","12.970000267028809","77.55999755859375","Bangalore Spark Enthusiasts","Bangalore-Spark-Enthusiasts","Spark Enthusiasts","","229573145","https://www.meetup.com/Bangalore-Spark-Enthusiasts/events/229573145/","330","Data Science with Spark","","","","past","1460781000000","1461661124000","19800000","IBM India Private Limited, Embassy Golf Links,"," Off Indira Nagar-Koramangala Intermediate Ring Road","Bangalore","in","14083242","12.953020095825195","India","77.64331817626953","IBM India Pvt Ltd - A Block ","","False","","","public","0","331"
"11","1462353045000","<p>Hi Spark Enthusiasts,</p> <p><b>Pallavi Priyadarshini</b> and <b>Praveen Devarao</b> both from the Spark Technology Center at IBM Software Lab will walk you through on how to develop high speed connectors for Spark. Our agenda for the meetup on Saturday, May 14th -</p> <p><br/><b>Agenda:</b></p> <p>• Connectors - background, motivation and use cases</p> <p>• How to build your own connector - code walk through</p> <p>This session will introduce you to Spark connectors and take you through the out-of-the-box connectors available in Spark and others available as Spark packages. This session will brief you on the background of why customized connectors are needed followed by a developer session on writing your own Spark connectors that covers how Spark recognizes the extensions and how you can write your own Spark extension, illustrating with IBM use cases. At the end of the session you should be able to learn when and why customized connectors are needed and be able to write one for your use case, if not available already.</p> <p><b>Venue: </b>IBM's Embassy Golf Links Campus ( <b>Block A Cafeteria</b>)<br/>Please spread the word and encourage your friends and colleagues to signup for this meetup.</p> <p><br/>Cheers,</p> <p><b>Spark Technology Center</b></p> ","7200000","1363882301000","7722222","open","12.970000267028809","77.55999755859375","Bangalore Spark Enthusiasts","Bangalore-Spark-Enthusiasts","Spark Enthusiasts","Spark, Big Data, Insights, Data Sources, Ingestion, Connectors","230864866","https://www.meetup.com/Bangalore-Spark-Enthusiasts/events/230864866/","","High speed connectors for Spark","","","","past","1463200200000","1464157456000","19800000","IBM India Private Limited, Embassy Golf Links,"," Off Indira Nagar-Koramangala Intermediate Ring Road","Bangalore","in","14083242","12.953020095825195","India","77.64331817626953","IBM India Pvt Ltd - A Block ","","False","","","public","0","163"
"0","1462128303000","<p><i><b>THIS MEETUP AND LIVE STREAMING IS US PACIFIC STANDARD TIME (PST). PLEASE CONVERT TO YOUR TIME ZONE.</b></i></p> <p>On June 6, 2016, leading minds in data and analytics from Tesla, Netflix, Silicon Valley Data Science, and IBM will come together to demonstrate how open data and analytics technologies such as R, Spark, Python and more are forming a vibrant ecosystem.  The community has a shared goal of working with all data to build unexpected insights and launch new business applications.</p> <p>The Apache Spark Maker Community Event will bring together data scientists, data engineers, data developers, and data designers June 6th @ 6pm at Galvanize, San Francisco. Here’s the plan:   </p> <p>- The Big Reveal – New sample Apache Spark apps and tools</p> <p>- Use Cases – Monsanto will share how they are using R and Spark to optimize their supply chain</p> <p>- Learning Session - Hear from experts working on Spark projects and building the Spark ecosystem of open data and analytics technologies</p> <p>- Networking Opportunity – Food, drinks and data, explore a Hall of Innovation showcasing Spark demos</p> <p>Join us. Learn more here: </p> <p><b><i><a href=""http://www.ibm.com/analytics/us/en/events/apache-spark/"">Apache Spark Maker Community Event</a></i></b> </p> <p>We realize you may not be able to attend in person, however, we are <b>live streaming</b> the event.  Register for the <b><a href=""https://www.eventbrite.com/e/livestream-apache-sparktm-maker-community-event-registration-24790223225?cm_mc_uid=39680333471514613509392&amp;cm_mc_sid_50200000=1461961944"">live stream</a></b> and we'll send you a calendar update and login link.</p> ","14400000","1363882301000","7722222","open","12.970000267028809","77.55999755859375","Bangalore Spark Enthusiasts","Bangalore-Spark-Enthusiasts","Spark Enthusiasts","","230792925","https://www.meetup.com/Bangalore-Spark-Enthusiasts/events/230792925/","","Apache Spark Maker Community Event","","","","past","1465214400000","1465229901000","19800000","44 Tehama Street","","San Francisco","us","24126294","37.78749465942383","USA","-122.39653015136719","Galvanize U","","False","CA","","public","0","60"
"24","1465208202000","<p>Hi Spark Enthusiasts,</p> <p>I am pleased to announce that we are hosting a joint meetup on Spark 2.0 with another meetup group <a href=""http://www.meetup.com/Bangalore-Apache-Spark-Meetup/events/231798403/"">Bangalore Apache Spark Meetup</a> led by Madhukara Phatak.</p> <p><br/>The next version of Apache Spark will expand on the data processing platform’s real-time data analysis capabilities, offering users the ability to perform interactive queries against live data.</p> <p><br/><b>Venue: </b>IBM's Embassy Golf Links Campus, <b>Block A Cafeteria</b>, Bangalore</p> <p><b>Date and Time: </b>July 2nd, 2016 10 am-2:30 pm</p> <p><b>Agenda:</b></p> <p><i><b>Evolution of Spark</b>: 10 am - 11:30 am (Madhukar)</i></p> <p><i><b>Break:</b> 11:30 am to 11:45 am<br/></i></p> <p><i><b>Spark 2.0 SQL</b>: 11:45 am - 12:45 pm (Madhukar)</i></p> <p>• <i>Unifying Dataframes and Dataset</i></p> <p>• <i>SQL Enhancements - SparkSession, Catalog, DDLAPI, Windows, Views</i></p> <p><i><b>Break:</b> 12:45 pm - 1 pm<br/></i></p> <p><i><b>Spark 2.0</b>: 1 pm - 1:45 pm (Mario)<br/></i></p> <p>• <i>Structured Streaming and Catalyst optimization</i></p> <p><br/>Please spread the word and encourage your friends and colleagues to signup for this meetup.</p> <p>



Cheers,</p> <p><b>Spark Technology Center</b></p> ","16200000","1363882301000","7722222","open","12.970000267028809","77.55999755859375","Bangalore Spark Enthusiasts","Bangalore-Spark-Enthusiasts","Spark Enthusiasts","","231684993","https://www.meetup.com/Bangalore-Spark-Enthusiasts/events/231684993/","","Introduction to Spark 2.0","","","","past","1467433800000","1467462198000","19800000","IBM India Private Limited, Embassy Golf Links,"," Off Indira Nagar-Koramangala Intermediate Ring Road","Bangalore","in","14083242","12.953020095825195","India","77.64331817626953","IBM India Pvt Ltd - A Block ","","False","","","public","0","254"
"0","1464835470000","<p><b>THIS IS A GLOBAL ON-LINE HACKATHON THAT BEGINS MAY 23, 2016 AND <i>NOW ENDS AUGUST 23, 2016</i>.  SUBMISSIONS DUE AUGUST 23rd BY 5:00 PM EST. </b></p> <p><b>We’re extending the hackathon deadline to August 23</b> - that’s 20 additional days to build your Spark enterprise app. (View the revised competition calendar <b><a href=""http://apachespark.devpost.com/details/dates"">HERE</a></b><b>.  </b>We're giving you more time because....</p> <p>We’re adding <b>new enterprise data resources</b> to the site and we want to give you a chance to incorporate these into your projects, if you so choose.  Our awesome data co-sponsors <b><a href=""http://www.yelp.com/nyc"">Yelp</a></b> and <b><a href=""https://uncharted.software/"">Uncharted Software</a></b> have generously shared some of their enterprise data sets for you to use during the hackathon.</p> <p>Yelp’s data includes 2.2M reviews by 552K users for 77K businesses. The Uncharted data includes Bitcoin network transactions from processing the Bitcoin blockchain as of mid-2014 <i>and</i> Amazon product reviews from 1995 through 2003. For a fuller description and data access, visit our <b><a href=""http://apachespark.devpost.com/details/resources#datasets"">resources page</a></b>.</p> <p>Uncharted Software also has a couple cool Spark data visualization libraries you should check out: <b><a href=""http://unchartedsoftware.github.io/salt/"">Salt</a></b> and <b><a href=""http://unchartedsoftware.github.io/sparkpipe-core/"">SparkPipe.</a></b></p> <p>And, in case you’d like to weigh the effects of weather on business operations, we’re also offering access to the full suite of <b><a href=""http://apachespark.devpost.com/details/weather_data"">Weather Company APIs</a></b> for the duration of the hackathon.</p> <p>Finally, if you’re looking for a hosting solution for your Spark app, we’re now offering <b>extended Bluemix trials for all hackathon participants</b>. Using Bluemix services to build your project is <b><i>totally optional</i></b>, but might be a good way to get your app up and running — particularly with the IBM Analytics for Apache Spark service.</p> <p><b><a href=""http://apachespark.devpost.com/details/bluemix_promo"">You can request your extended Bluemix trial code here.</a> </b></p> <p>For all hackathon participants, trials will extend through November 1, 2016.</p> <p><i>Now go forth and optimize for the enterprise!</i></p> <p>---------------------</p> <p>Build an Apache Spark application to address a real business problem or core concern related to customer care, marketing, risk management or operations. Join IBM and Devpost for a global hackathon using <b><a href=""http://apachespark.devpost.com/?utm_source=facebook-partner&amp;utm_medium=wall-post&amp;utm_campaign=apachespark"">Apache Spark Makers Build</a></b>.  There are $100,000 in cash prizes.  Submissions can be sent in up to August 23rd.</p> <p><i>Participation Details: </i>To participate in the global virtual hackathon, you can <b><a href=""http://apachespark.devpost.com/?utm_source=facebook-partner&amp;utm_medium=wall-post&amp;utm_campaign=apachespark"">register here</a></b>.  Please review all registration guidelines.</p> <p>For the hack, you will apply Apache Spark's powerful analytics capabilities to enterprise and other relevant data so data scientists and software developers can build an analytics or mobile/web app that tackles a key business problem in marketing, customer case, operations or risk management.  The grand prize is $50,000, and the top three winners each get a meeting with the judge or<br/>Spark community expert of their choice; the judging panel includes data experts from Tesla, Netflix, and Silicon Valley Data Science.</p> <p>Go to <b><a href=""http://apachespark.devpost.com/?utm_source=facebook-partner&amp;utm_medium=wall-post&amp;utm_campaign=apachespark"">apachespark.devpost.com</a></b> for full details and registration.  Please review all registration rules.</p> <p><b> <i>Questions?</i></b></p> <p>We're here to help. If you have any questions about the hackathon, post on the</p> <p><b><a href=""http://apachespark.devpost.com/forum_topics"">discussion forum</a></b></p> <p>or email</p> <p><b><i>support@devpost.com</i></b></p> <p>and we'll respond as soon as we can.</p> ","","1363882301000","7722222","open","12.970000267028809","77.55999755859375","Bangalore Spark Enthusiasts","Bangalore-Spark-Enthusiasts","Spark Enthusiasts","","231584450","https://www.meetup.com/Bangalore-Spark-Enthusiasts/events/231584450/","","Show Us Your Apps - Apache Spark Maker Build Global Hackathon","","","","past","1471951800000","1471964075000","19800000","Any Street","","Any City","us","24581652","36.77825927734375","USA","-119.41793060302734","Global Online Hackathon","","False","CA","","public","0","40"
"10","1471947590000","<p>In this talk, you will learn the fundamentals of Spark machine learning and how to leverage its power to gain new insights from your data. We will also show the sample code and common use cases of Spark machine learning.</p> <p><br/>Agenda -</p> <p>What is Machine Learning?</p> <p>Spark and Machine learning</p> <p>Understanding Spark ML pipelines</p> <p>Sample app using the Spark Machine Learning library.</p> <p>


Speakers -</p> <p>Praveen Devarao  <a href=""http://www.linkedin.com/in/praveen-devarao"">www.linkedin.com/in/praveen-devarao</a></p> <p>Mario Briggs <a href=""https://in.linkedin.com/in/mariobriggs""><a href=""https://in.linkedin.com/in/mariobriggs"" class=""linkified"">https://in.linkedin.com/in/mariobriggs</a></a></p> ","7200000","1363882301000","7722222","open","12.970000267028809","77.55999755859375","Bangalore Spark Enthusiasts","Bangalore-Spark-Enthusiasts","Spark Enthusiasts","","233556025","https://www.meetup.com/Bangalore-Spark-Enthusiasts/events/233556025/","","Apache Spark Machine Learning","","","","past","1473481800000","1473490021000","19800000","IBM India Private Limited, Embassy Golf Links,"," Off Indira Nagar-Koramangala Intermediate Ring Road","Bangalore","in","14083242","12.953020095825195","India","77.64331817626953","IBM India Pvt Ltd - A Block ","","False","","","public","0","219"
"1","1472419993000","<p>On September 27, 2016, leading minds in data and analytics will come together and unveil the latest in cloud technology, enabling you to more efficiently put data to work. Experience how Spark, Hadoop, Python, and more are being used to bring together all types of data professionals –from data engineers, to data scientists, developers and business analysts –to work in new collaborative ways.</p> <p>The IBM DataFirst Launch Event will unite data and analytics leaders and practitioners from the open source community, startups, and enterprises. Check the <i><b><a href=""http://www.ibm.com/analytics/us/en/events/datafirst/index.html"">event site</a></b></i> for the latest lineup of guest speakers. The event takes place @ 6pm at the Hudson Mercantile Building, NYC.</p> <p>Here’s the plan:<br/>• The Big Reveal –Experience new ways to work for data engineers, data scientist, developers, and business analysts, both individually and collectively.</p> <p>•Hands-on sessions – With interactive experiences for each of these professions.</p> <p>•Use Cases –Community leaders and guest speakers will share their expertise and vision<br/>•Networking Opportunity – Food, drinks, data, collaborative demos, and a party on the rooftop</p> <p>Learn more here:<a href=""http://www.ibm.com/analytics/us/en/events/datafirst/index.html#"">  <i><b>DataFirst Launch Event</b></i></a></p> <p>Check-in and networking begins at 6:00 PM.  Food and drinks will be served. You must register for this event.</p> <p>To get your ticket, and attend in person, click <b><a href=""https://www.eventbrite.com/e/ibm-datafirst-launch-event-registration-26725283041"">HERE</a></b>.  </p> <p>Can't attend in person? We'll be live streaming this event.  Register for the<br/><b><a href=""https://www.eventbrite.com/e/livestream-ibm-datafirst-launch-event-registration-26906650516"">LIVE STREAM</a></b> and we'll send you a calendar update and login link.  <i><b><br/></b></i></p> ","14400000","1363882301000","7722222","open","12.970000267028809","77.55999755859375","Bangalore Spark Enthusiasts","Bangalore-Spark-Enthusiasts","Spark Enthusiasts","zip 10018","233694589","https://www.meetup.com/Bangalore-Spark-Enthusiasts/events/233694589/","","DataFirst Launch Event – Experience new ways to put your data to work","","","","past","1474979400000","1474994858000","19800000","500 West 36th Street","","New York","us","24745891","40.755863189697266","USA","-73.99864959716797","Hudson Mercantile Bldg","","False","NY","","public","0","30"
"1","1478160902000","<p>&lt;&lt;&lt;&lt;&lt;IMPORTANT&gt;&gt;&gt;&gt;&gt;&gt;&gt;&gt;&gt;&lt;&lt;&lt;&lt;&lt;IMPORTANT&gt;&gt;&gt;&gt;&gt;&gt;&gt;&gt;&gt;&lt;&lt;&lt;&lt;&lt;IMPORTANT&gt;&gt;&gt;&gt;&gt;&gt;&gt;&gt;&gt;&lt;&lt;&lt;&lt;&lt;IMPORTANT&gt;&gt;&gt;&gt;&gt;&gt;&gt;&gt;&gt;&lt;&lt;&lt;&lt;&lt;IMPORTANT&gt;&gt;&gt;&gt;&gt;&gt;&gt;&gt;&gt;　</p> <p>Please register for a free ticket here, otherwise you will have trouble to enter the IBM premises 　</p> <p><a href=""https://www.eventbrite.com/e/cognitive-iot-workshop-on-cloud-apachespark-deeplearning-more-tickets-29100736085""><a href=""https://www.eventbrite.com/e/cognitive-iot-workshop-on-cloud-apachespark-deeplearning-more-tickets-29100736085"" class=""linkified"">https://www.eventbrite.com/e/cognitive-iot-workshop-on-cloud-apachespark-deeplearning-more-tickets-29100736085</a></a></p> <p>&lt;&lt;&lt;&lt;&lt;IMPORTANT&gt;&gt;&gt;&gt;&gt;&gt;&gt;&gt;&gt;&lt;&lt;&lt;&lt;&lt;IMPORTANT&gt;&gt;&gt;&gt;&gt;&gt;&gt;&gt;&gt;&lt;&lt;&lt;&lt;&lt;IMPORTANT&gt;&gt;&gt;&gt;&gt;&gt;&gt;&gt;&gt;&lt;&lt;&lt;&lt;&lt;IMPORTANT&gt;&gt;&gt;&gt;&gt;&gt;&gt;&gt;&gt;&lt;&lt;&lt;&lt;&lt;IMPORTANT&gt;&gt;&gt;&gt;&gt;&gt;&gt;&gt;&gt;　</p> <p>Agenda:　</p> <p>6:30 - 7:00 PM Welcome, Snacks　</p> <p>7:00 - 7:30 PM IoT, MQTT, Message Brokers and the IBM Watson IoT Platform　</p> <p>7:30 - 8:00 PM Node-RED, the open source data flow Editor IBM donated to the JavaScript foundation　</p> <p>8:00 - 8:30 PM ApacheSpark and Exploratory Data Analysis using PySpark, Python, Jupyter and MatPlotLib　</p> <p>8:30 - 9:00 PM Massive Parallel DeepLearning for anomaly detection on IoT sensor data using Theano and DeepLearning4J on ApacheSpark　</p> <p>9 PM - open end : Networking, Dinner Box　</p> <p>&lt;&lt;&lt;&lt;&lt;IMPORTANT&gt;&gt;&gt;&gt;&gt;&gt;&gt;&gt;&gt;&lt;&lt;&lt;&lt;&lt;IMPORTANT&gt;&gt;&gt;&gt;&gt;&gt;&gt;&gt;&gt;&lt;&lt;&lt;&lt;&lt;IMPORTANT&gt;&gt;&gt;&gt;&gt;&gt;&gt;&gt;&gt;&lt;&lt;&lt;&lt;&lt;IMPORTANT&gt;&gt;&gt;&gt;&gt;&gt;&gt;&gt;&gt;&lt;&lt;&lt;&lt;&lt;IMPORTANT&gt;&gt;&gt;&gt;&gt;&gt;&gt;&gt;&gt;　</p> <p>Please register for a free ticket here, otherwise you will have trouble to enter the IBM premises 　</p> <p><a href=""https://www.eventbrite.com/e/cognitive-iot-workshop-on-cloud-apachespark-deeplearning-more-tickets-29100736085""><a href=""https://www.eventbrite.com/e/cognitive-iot-workshop-on-cloud-apachespark-deeplearning-more-tickets-29100736085"" class=""linkified"">https://www.eventbrite.com/e/cognitive-iot-workshop-on-cloud-apachespark-deeplearning-more-tickets-29100736085</a></a></p> ","10800000","1363882301000","7722222","open","12.970000267028809","77.55999755859375","Bangalore Spark Enthusiasts","Bangalore-Spark-Enthusiasts","Spark Enthusiasts","","235319570","https://www.meetup.com/Bangalore-Spark-Enthusiasts/events/235319570/","","Cognitive IoT Workshop on Cloud, ApacheSpark, DeepLearning & more","","","","past","1478611800000","1483074486000","19800000","IBM India Private Limited, Embassy Golf Links,"," Off Indira Nagar-Koramangala Intermediate Ring Road","Bangalore","in","14083242","12.953020095825195","India","77.64331817626953","IBM India Pvt Ltd - A Block ","","False","","","public","0","88"
"0","1479308151000","<p>IBM values our community of clients and business partners. Each year, we support and build our community by working closely with IBM advocates and helping them to become </p> <p><b><a href=""http://www.ibm.com/developerworks/champion/"">IBM Champions</a></b></p> <p>IBM Champions are a select group of external advocates made up of clients, business partners and independent consultants who make exceptional contributions to the technical community by speaking at conferences, running or actively participating in user groups, evangelizing relevant technical topics via social media, and helping our clients make the most of IBM technology. </p> <p>We are looking for clients and business partners to join the program and are looking for applications in the areas of data science, data engineering, application development, and business analytics.</p> <p><b>Nominations are due by Monday, November 28, 2016</b></p> <p>The Champion program is open to candidates worldwide, and candidates may self-nominate or be nominated by someone else. IBM employees are not eligible for the program.  Some benefits of the IBM Champion program: <br/>- IBM Champions advocate IBM offerings in the community with competence and credibility (content, blogs, presentations, customer references, analyst/press, videos/podcasts, etc.)<br/>- IBM Champions share knowledge with and provide support to the IBM user community (books, articles, blogs, forums, presentations, education, beta programs and customer advisory councils etc.)<br/>- IBM Champions support IBM as brand ambassadors who build awareness, share product knowledge, and provide product feedback as users and beta testers</p> <p>Read this  <b><a href=""https://www.ibm.com/developerworks/community/blogs/ibmchampion/entry/Nominate_an_IBM_Champion_Nominations_OPEN?lang=en"">blog post</a> </b> for full IBM Champion program criteria, guidelines and the <b>&lt;a&gt;nomination form&lt;/a&gt;</b>.</p> <p>To learn more about the IBM Champion program from current Champions and Worldwide IBM Champion coordinator Libby Ingrassia, listen to this <a href=""https://ibm2.webex.com/ec3100/eventcenter/recording/recordAction.do?theAction=poprecord&amp;siteurl=ibm2&amp;entappname=url3100&amp;internalRecordTicket=4832534b00000002ed04dabb7c4dfbe255318214758c39900441e206be2ecb71765e9832f1af34b8&amp;renewticket=0&amp;isurlact=true&amp;format=short&amp;rnd=3315557804&amp;RCID=3855f080a3a7e1133bcd207eefd89727&amp;rID=52765987&amp;needFilter=false&amp;recordID=52765987&amp;apiname=lsr.php&amp;AT=pb&amp;actappname=ec3100&amp;&amp;SP=EC&amp;entactname=%2FnbrRecordingURL.do&amp;actname=%2Feventcenter%2Fframe%2Fg.do""><b>webcast</b></a>. Be sure to share the blog and webcast with clients and colleagues who would make great IBM Champions.</p> ","","1363882301000","7722222","open","12.970000267028809","77.55999755859375","Bangalore Spark Enthusiasts","Bangalore-Spark-Enthusiasts","Spark Enthusiasts","","235621646","https://www.meetup.com/Bangalore-Spark-Enthusiasts/events/235621646/","","IBM Champions - Call for Nominations","","","","past","1480426200000","1480438850000","19800000","Any Street","","Any City","us","24904123","32.16562271118164","USA","-82.90007781982422","On-Line Only","","False","GA","","public","0","33"
