"comment_count","created","description","duration","group_created","group_id","group_join_mode","group_lat","group_lon","group_name","group_urlname","group_who","how_to_find_us","id","link","manual_attendance_count","name","rsvp_close_offset","rsvp_limit","rsvp_open_offset","status","time","updated","utc_offset","venue_address_1","venue_address_2","venue_city","venue_country","venue_id","venue_lat","venue_localized_country_name","venue_lon","venue_name","venue_phone","venue_repinned","venue_state","venue_zip","visibility","waitlist_count","yes_rsvp_count"
"3","1375393788000","<p>Reminder:  If you have not already registered, register today!  Space is limited.  You must register through the URL below.  See you there!</p> <p> </p> <p>Register Today For the IBM Big Data Developer Day- <a href=""http://ibm.co/152iodP"">&lt;/a&gt;<b>&lt;a href=""http://ibm.co/1ecjtSi""&gt;<a href=""http://ibm.co/1ecjtSi"" class=""linkified"">http://ibm.co/1ecjtSi</a></a></b></p> <p><b>Note -Clicking the YES attending button does not confirm your registration for this event - only registration at the above URL will.</b></p> <p>Experience IBM’s enterprise-class big data platform that allows you to address the full spectrum of big data business challenges. The morning will include interactive discussions and live demonstrations of big data at rest and big data in motion, then get hands on with Hadoop scripting and text analytics with guidance from development experts. </p> <p>Registration is required.  This event is limited to only 50 seats. You may let others know that you are going to this event by clicking on the YES RSVP button on this Meetup page—however— your seat can not be guaranteed until you officially register at the link above.</p> <p>Thanks and we look forward to seeing you soon!</p> ","28800000","1368600910000","8493752","open","39.9900016784668","-83.04000091552734","Big Data Developers in Columbus","Big-Data-Developers-in-Columbus","Developers","IBM - location provided at registration","132606372","https://www.meetup.com/Big-Data-Developers-in-Columbus/events/132606372/","","REMINDER: Big Data Developer Day - Hands On Lab.","","50","","past","1379595600000","1379651254000","-14400000","Provided once you register","","Columbus","us","14884222","39.96117401123047","USA","-82.99879455566406","IBM","","False","OH","","public","0","34"
"0","1383576819000","<p><b>THIS IS A WEB CONFERENCE ONLY - TIME INDICATED IS LOCAL START TIME. SEE BELOW FOR DETAILS.</b></p> <p>IBM <a href=""http://www-03.ibm.com/software/products/us/en/infosphere-streams/""><b>InfoSphere Streams V3.2</b></a> (referred to as Streams) delivers a highly scalable, agile software infrastructure to <b><a href=""http://www-01.ibm.com/software/data/infosphere/stream-computing/"">perform in-motion analytics</a></b> on a wide variety of relational and non-relational data types that enter the enterprise at unprecedented volumes and speed, and from thousands of real-time sources. Streams V3.2 includes new features and functions designed to instantly analyze and fuse massive volumes of data and integrates with existing infrastructures. It delivers new capabilities to improve usability, support enterprise readiness, and streamline enterprise integration.</p> <p><b>WHAT:</b></p> <p>The following new features and functions, which will be covered during the Streams Developer Conference:</p> <p><i>Usability:</i><br/>• Remote Development with Streams Studio for Windows and Linux<br/>• User Defined Parallelism<br/>• Java Streams development simplification</p> <p><i>Enterprise readiness:</i><br/>• Operational Decision Management adapter for business rules<br/>• Access to application data using Representational State Transfer (REST)</p> <p><i>Enterprise integration:</i><br/>• MQTT adapters<br/>• Hadoop Big SQL support<br/>• HP Vertica Analytic Database support</p> <p><b>Who should attend:</b></p> <p>The event assumes you are familiar with Streams. If you are not, please either try the <b><a href=""http://bigdatauniversity.com/bdu-wp/bdu-course/stream-computing-i/"">Big Data University Streams course</a></b> or review some of the <b><a href=""http://www.youtube.com/user/ibmbigdata/search?query=streams"">Streams videos on YouTube</a></b>.</p> <p><b>WHEN:</b></p> <p><b><a href=""https://www.webdialogs.com/join/?schedid=2058889"">Webcast</a></b> on Thursday <b>November 14, 2013</b> from <b>10:00AM to 6:00PM U.S. Eastern Standard Time.</b></p> <p><b>WHERE:</b></p> <p>The webcast will be recorded and posted to Big Data University (BDU) at the following <b><a href=""https://bigdatauniversity.com/courses/auth/openid/login.php"">Big Data University course ID</a>.</b></p> <p><i><b>NOTE: There will be no physical location for this meetup and it will all be online.</b></i></p> <p>To get more info, download presentations, get detailed agenda and to register for the event check out the <b><a href=""http://bigdatauniversity.com/bdu-wp/bdu-course/ibm-infosphere-streams-3-2-developers-conference/"">BDU Streams Developers Virtual Conference landing page</a></b>.</p> <p>The detailed agenda will be posted at the BDU class/event page after Oct 31.</p> <p>Please join us on the live LotusLive meeting <b><a href=""https://www.webdialogs.com/join/?schedid=2058889"">webcast</a></b>. The conference ID is 2058889. Audio in listen only mode will be available on the webcast.</p> <p>To ask questions during Q&amp;A periods, please use the following conference information:</p> <p>USA Toll-Free: 1-888-426-6840</p> <p>USA Caller Paid: 1-215-861-6239</p> <p>For Other Countries call in numbers use this <b><a href=""https://www.teleconference.att.com/servlet/glbAccess?process=1&amp;accessCode=7821035&amp;accessNumber=2158616239"">link</a></b>.</p> <p>Participant Code: 7821035</p> <p>We look forward to sharing details about these new capabilities.</p> ","28800000","1368600910000","8493752","open","39.9900016784668","-83.04000091552734","Big Data Developers in Columbus","Big-Data-Developers-in-Columbus","Developers","","149080862","https://www.meetup.com/Big-Data-Developers-in-Columbus/events/149080862/","","Streams 3.2 Developers Virtual Conference","","","","past","1384441200000","1384470284000","-18000000","See Description for Details","BDU University","San Jose","us","16729132","37.38999938964844","USA","-121.9000015258789","WEB CONFERENCE ONLY","","False","CA","95101","public","0","5"
"0","1415647656000","<p>CALLING ALL DEVELOPERS .... JOIN THE BIG DATA FOR SOCIAL GOOD CHALLENGE</p> <p>Big data exists in just about everything we use and do. It comes from phones, cars, roads, power lines, waterways, food crates, and innumerable other items you’d never think of as computers. This data speaks volumes about our collective behavior and society – so let’s use it to do something incredible! IBM invites developers and data enthusiasts to take a deep dive into real world civic issues using big data and the IBM Bluemix <a href=""https://ace.ng.bluemix.net/"">Analytics for Hadoop service</a>. Analyze one of our curated datasets or bring your own (provided it meets these requirements)! Use Hadoop and your data to create a clickable and interactive data visualization to highlight insights that you’ve found.</p> <p>Ready to get started? $40,000 in prizes will be awarded....</p> <p>Register here:<a href=""http://ibmhadoop.challengepost.com/""><a href=""http://ibmhadoop.challengepost.com/"" class=""linkified"">http://ibmhadoop.challengepost.com/</a></a></p> <p>What to Create: Participants must create a working, clickable, and interactive data visualization utilizing the <a href=""http://www.ibm.com/developerworks/library/ba-analytics-for-hadoop1/index.html"">Analytics for Hadoop service</a> on IBM Bluemix.</p> <p>Data Requirements: Your data visualization must analyze one or more datasets included in the curated list of datasets on the Data page OR meet the data size, content, and licensing requirements described on the <a href=""http://ibmhadoop.challengepost.com/details/data"">Data page</a>. The total size of the Datasets analyzed must be between 500MB - 7GB in size.</p> <p>Check out the requirements then go get your IBM Bluemix extended promo code and check out the <a href=""http://ibmhadoop.challengepost.com/details/data"">datasets</a>!</p> ","","1368600910000","8493752","open","39.9900016784668","-83.04000091552734","Big Data Developers in Columbus","Big-Data-Developers-in-Columbus","Developers","","218599477","https://www.meetup.com/Big-Data-Developers-in-Columbus/events/218599477/","","Big Data for Social Good Challenge","","","","past","1415649600000","1415661776000","-18000000","Web only","","Global","us","23442562","33.86000061035156","USA","-84.4000015258789","Big Data for Social Good Challenge","","False","GA","","public","0","1"
"1","1415749964000","<p><i><b>THE BIG DATA FOR SOCIAL GOOD CHALLENGE BEGINS NOVEMBER 10, 2014 AND CONTINUES TO MARCH 3, 2015. </b></i></p> <p><b>CALLING ALL DEVELOPERS .... JOIN THE BIG DATA FOR SOCIAL GOOD CHALLENGE</b></p> <p>Big data exists in just about everything we use and do. It comes from phones, cars, roads, power lines, waterways, food crates, and innumerable other items you’d never think of as computers. This data speaks volumes about our collective behavior and society – so let’s use it to do something incredible! IBM invites developers and data enthusiasts to take a deep dive into real world civic issues using big data and the IBM Bluemix <a href=""https://ace.ng.bluemix.net/"">Analytics for Hadoop service</a>. Analyze one of our curated datasets or bring your own (provided it meets these requirements)! Use Hadoop and your data to create a clickable and interactive data visualization to highlight insights that you’ve found.</p> <p>Ready to get started? $40,000 in prizes will be awarded....</p> <p>Register here:<a href=""http://ibmhadoop.challengepost.com/""><a href=""http://ibmhadoop.challengepost.com/"" class=""linkified"">http://ibmhadoop.challengepost.com/</a></a></p> <p>What to Create: Participants must create a working, clickable, and interactive data visualization utilizing the <a href=""http://www.ibm.com/developerworks/library/ba-analytics-for-hadoop1/index.html"">Analytics for Hadoop service</a> on IBM Bluemix.</p> <p>Data Requirements: Your data visualization must analyze one or more datasets included in the curated list of datasets on the Data page OR meet the data size, content, and licensing requirements described on the <a href=""http://ibmhadoop.challengepost.com/details/data"">Data page</a>. The total size of the Datasets analyzed must be between 500MB - 7GB in size.</p> <p>Check out the requirements then go get your IBM Bluemix extended promo code and check out the <a href=""http://ibmhadoop.challengepost.com/details/data"">datasets</a>!</p> ","","1368600910000","8493752","open","39.9900016784668","-83.04000091552734","Big Data Developers in Columbus","Big-Data-Developers-in-Columbus","Developers","","218626233","https://www.meetup.com/Big-Data-Developers-in-Columbus/events/218626233/","","Big Data for Social Good Challenge (See Details for Start/End)","","","","past","1425441600000","1425453335000","-18000000","Web only","","Global","us","23442562","33.86000061035156","USA","-84.4000015258789","Big Data for Social Good Challenge","","False","GA","","public","0","8"
"6","1434247924000","<p><i><b>THIS IS A WEB CONFERENCE ONLY.  TIME OF WEB CONFERENCE LOCALLY IS BASED ON LIVE-STREAM START - PACIFIC DAYLIGHT TIME. DETAILS TO CONNECT TO LIVE-STREAM ARE INDICATED BELOW.  </b></i></p> <p>Apache Spark is an open source processing engine built around speed, ease of use, and analytics. If you have large amounts of data that requires low latency processing that a typical Map Reduce program cannot provide, Spark is the alternative.</p> <p>Spark performs at speeds up to 100 times faster than Map Reduce for iterative algorithms or interactive data mining. Spark provides in-memory cluster computing for lightning fast speed and supports Java, Scala, and Python APIs for ease of development. Spark allows data scientists to build models quickly and supports iterative jobs on distributed datasets. This means more people can apply deep intelligence into applications to make everything smarter, including the Internet of Things (IoT), machine learning, web, mobile, social, business process and more. </p> <p>Do you believe in the value of Spark, in the speed, efficiency and flexibility of this in-memory compute engine? IBM does.  Emphatically.That's why we're committed to do everything we can to accelerate the adoption of Spark for enterprise analytics, where Spark promises seemingly unlimited value.</p> <p>On June 15, 2015, IBM will host a Spark Community event in San Francisco, California: IBM | Spark - The Start of Something Big in Data and Design. There will be a live demo showcase, refreshments, and a Town Hall discussion featuring some of the most trail-blazing data scientists in today's Spark Community, including:</p> <p>•  Edd Dumbill, VP Strategy, Silicon Valley Data Science<br/>•  Mike Tamir, Chief Science Officer &amp; VP of Data Science &amp; Education at Galvanize<br/>•   Fernando Perez, Staff Scientist at Lawrence Berkeley National Laboratory &amp; Founding Investigator of the Berkeley Institute for Data Science<br/>•   Haoyuan Li, CEO and Founder of Tachyon Nexus<br/>•   Shankar Venkataraman, Distinguished Engineer &amp; CTO, IBM Analytics Platform at IBM<br/>•   Paco Nathan, Director, Community Evangelism, Databricks</p> <p>Spark Community members will also deliver 5-minute lightning talks to describe exciting projects they're working on.</p> <p>We will provide a livestream presentation of what these Spark leaders have to say.</p> <p><b>Live Streaming Link:</b></p> <p><b>To get additional details about Spark you can sign up now for a reminder at:</b></p> <p><b><a href=""http://www.ibm.com/analytics/us/en/technology/spark/""><a href=""http://www.ibm.com/analytics/us/en/technology/spark/"" class=""linkified"">http://www.ibm.com/analytics/us/en/technology/spark/</a></a></b></p> <p><b>Scroll down to ""Can't attend in Person""?  Sign up for a reminder and add it to your calendar.</b></p> <p>Additional information on Spark:</p> <p>Link to Spark Fundamentals Course in Big Data University</p> <p><a href=""http://bigdatauniversity.com/bdu-wp/bdu-course/spark-fundamentals/""><a href=""http://bigdatauniversity.com/bdu-wp/bdu-course/spark-fundamentals/"" class=""linkified"">http://bigdatauniversity.com/bdu-wp/bdu-course/spark-fundamentals/</a></a></p> <p>Link to Spark Technology Information</p> <p><a href=""http://www.ibm.com/analytics/us/en/technology/spark/""><a href=""http://www.ibm.com/analytics/us/en/technology/spark/"" class=""linkified"">http://www.ibm.com/analytics/us/en/technology/spark/</a></a></p> <p>Happy Sparking.</p> ","92700000","1368600910000","8493752","open","39.9900016784668","-83.04000091552734","Big Data Developers in Columbus","Big-Data-Developers-in-Columbus","Developers","","223230024","https://www.meetup.com/Big-Data-Developers-in-Columbus/events/223230024/","","IBM | Spark - The start of something big in data & design (Web Conference Only))","","","","past","1434420000000","1434513724000","-14400000","","","","","","","","","","","","","","public","0","20"
"0","1430176378000","<p><b>REGISTRATION IS CLOSED FOR THIS EVENT. IF YOU ARE PLANNING ON ATTENDING, PLEASE REGISTER ON SITE.<br/></b></p> <p><b><a href=""http://ibm.co/1P2E4uH""><a href=""http://ibm.co/1P2E4uH"" class=""linkified"">http://ibm.co/1P2E4uH</a></a></b></p> <p><b>IF YOU ARE LOOKING TO MAKE YOUR ANALYTICS PROCESS SIMPLER, FASTER AND SMARTER, THIS IS THE EVENT FOR YOU.  Breakfast and Lunch provided.<br/></b></p> <p>Do you have trouble getting access to the data that you'd like to use for business intelligence or predictive analytics?  Are you spending all your time aggregating and modeling data for performance versus asking insightful questions?  Do you need permission to execute what-if and ad-hoc analysis? </p> <p>Hundreds of organizations like yours are able to stop burdening IT by making their Analytics process Simpler, Faster and Smarter with IBM.  Join us to experience IBM’s enterprise-class Analytics platform which enables highly performant self-service capabilities including business intelligence, predictive analytics and data warehouse appliances.</p> <p><br/>Join us on <b>Thursday, July 30th</b> to learn how IBM and Ironside (a premier IBM Business Partner) are helping businesses gain visibility and insight with exceptional performance to accelerate their businesses and drive better outcomes.  <b>This is a client-only event. </b></p> <p><br/><i><b>Register here to confirm your seat at this event:</b></i>   <b><a href=""http://ibm.co/1P2E4uH""><a href=""http://ibm.co/1P2E4uH"" class=""linkified"">http://ibm.co/1P2E4uH</a></a></b></p> <p><br/>Ironside is a Premier IBM Business Partner working in the business analytics and predictive ananlytics space.  More information about Ironside can be found here: <b><a href=""http://www.ironsidegroup.com/""><a href=""http://www.ironsidegroup.com/"" class=""linkified"">http://www.ironsidegroup.com/</a></a> </b></p> <p><br/><b>Agenda </b>(subject to change)</p> <p>8:30am: Registration Check-in/Networking /Breakfast</p> <p>9:00am: Keynote - Introduction &amp; Industry Case Studies</p> <p>9:30 am: Enabling Blazing Fast Answers to Insightful Questions</p> <p>10:00am: Enabling Smarter Predictive Analytics</p> <p>11:05am:  Making Adhoc Business Intelligence Simple</p> <p>12:00pm: Lunch &amp; Introduction to Ironside Services Offerings</p> <p>12:45pm: Summary &amp; Adjourn</p> <p><br/><b><i>Don't forget to register here:</i> </b> <b><a href=""http://ibm.co/1P2E4uH""><a href=""http://ibm.co/1P2E4uH"" class=""linkified"">http://ibm.co/1P2E4uH</a></a></b></p> <p><br/>We look forward to seeing you at the event!</p> <p>IBM Analytics Team &amp; Ironside</p> ","16200000","1368600910000","8493752","open","39.9900016784668","-83.04000091552734","Big Data Developers in Columbus","Big-Data-Developers-in-Columbus","Developers","","222144061","https://www.meetup.com/Big-Data-Developers-in-Columbus/events/222144061/","","Accelerate your Business with Smarter Analytics","","","","past","1438259400000","1438279102000","-14400000","6060 Britton Parkway","Building 1","Dublin","us","23925062","40.07588195800781","USA","-83.13926696777344","IBM","","False","OH","43016","public","0","39"
"0","1462025370000","<p>On June 6, 2016, leading minds in data and analytics from Tesla, Netflix, Silicon Valley Data Science, and IBM will come together to demonstrate how open data and analytics technologies such as R, Spark, Python and more are forming a vibrant ecosystem.  The community has a shared goal of working with all data to build unexpected insights and launch new business applications.</p> <p>The Apache Spark Maker Community Event will bring together data scientists, data engineers, data developers, and data designers June 6th @ 6pm at Galvanize, San Francisco. Here’s the plan:   </p> <p>- The Big Reveal – New sample Apache Spark apps and tools</p> <p>- Use Cases – Monsanto will share how they are using R and Spark to optimize their supply chain</p> <p>- Learning Session - Hear from experts working on Spark projects and building the Spark ecosystem of open data and analytics technologies</p> <p>- Networking Opportunity – Food, drinks and data, explore a Hall of Innovation showcasing Spark demos</p> <p>Join us. Learn more here:  <b><i><a href=""http://www.ibm.com/analytics/us/en/events/apache-spark/"">Apache Spark Maker Community Event</a></i></b> </p> <p>Registration begins at 5:30 PM and the discussion starts at 6:30 PM; food and drinks will be served. You must register for this event. </p> <p>To get your ticket, and attend in person, click <b><a href=""https://www.eventbrite.com/e/apache-sparktm-maker-community-event-registration-24742595770?cm_mc_uid=39680333471514613509392&amp;cm_mc_sid_50200000=1461961944"">HERE</a></b>. </p> <p>Can't attend in person? We'll be live streaming this event on a computer screen near you! Register for the  <b><a href=""https://www.eventbrite.com/e/livestream-apache-sparktm-maker-community-event-registration-24790223225?cm_mc_uid=39680333471514613509392&amp;cm_mc_sid_50200000=1461961944"">live stream</a></b> and we'll send you a calendar update and login link.</p> ","14400000","1368600910000","8493752","open","39.9900016784668","-83.04000091552734","Big Data Developers in Columbus","Big-Data-Developers-in-Columbus","Developers","","230766101","https://www.meetup.com/Big-Data-Developers-in-Columbus/events/230766101/","","Apache Spark Maker Community Event","","","","past","1465248600000","1465263858000","-14400000","44 Tehama Street","","San Francisco","us","24126294","37.78749465942383","USA","-122.39653015136719","Galvanize U","","False","CA","","public","0","7"
"0","1464824000000","<p><b>THIS IS A GLOBAL ON-LINE HACKATHON THAT BEGINS MAY 23, 2016 AND <i>NOW ENDS AUGUST 23, 2016</i>.  SUBMISSIONS DUE AUGUST 23rd BY 5:00 PM EST. </b></p> <p><b>We’re extending the hackathon deadline to August 23</b> - that’s 20 additional days to build your Spark enterprise app. (View the revised competition calendar <b><a href=""http://apachespark.devpost.com/details/dates"">HERE</a></b><b>.  </b>We're giving you more time because....</p> <p>We’re adding <b>new enterprise data resources</b> to the site and we want to give you a chance to incorporate these into your projects, if you so choose.  Our awesome data co-sponsors <b><a href=""http://www.yelp.com/nyc"">Yelp</a></b> and <b><a href=""https://uncharted.software/"">Uncharted Software</a></b> have generously shared some of their enterprise data sets for you to use during the hackathon.</p> <p>Yelp’s data includes 2.2M reviews by 552K users for 77K businesses. The Uncharted data includes Bitcoin network transactions from processing the Bitcoin blockchain as of mid-2014 <i>and</i> Amazon product reviews from 1995 through 2003. For a fuller description and data access, visit our <b><a href=""http://apachespark.devpost.com/details/resources#datasets"">resources page</a></b>.</p> <p>Uncharted Software also has a couple cool Spark data visualization libraries you should check out: <b><a href=""http://unchartedsoftware.github.io/salt/"">Salt</a></b> and <b><a href=""http://unchartedsoftware.github.io/sparkpipe-core/"">SparkPipe.</a></b></p> <p>And, in case you’d like to weigh the effects of weather on business operations, we’re also offering access to the full suite of <b><a href=""http://apachespark.devpost.com/details/weather_data"">Weather Company APIs</a></b> for the duration of the hackathon.</p> <p>Finally, if you’re looking for a hosting solution for your Spark app, we’re now offering <b>extended Bluemix trials for all hackathon participants</b>. Using Bluemix services to build your project is <b><i>totally optional</i></b>, but might be a good way to get your app up and running — particularly with the IBM Analytics for Apache Spark service.</p> <p><b><a href=""http://apachespark.devpost.com/details/bluemix_promo"">You can request your extended Bluemix trial code here.</a> </b> For all hackathon participants, trials will extend through November 1, 2016. <i>Now go forth and optimize for the enterprise!</i></p> <p>---------------------</p> <p>Build an Apache Spark application to address a real business problem or core concern related to customer care, marketing, risk management or operations. Join IBM and Devpost for a global hackathon using <b><a href=""http://apachespark.devpost.com/?utm_source=facebook-partner&amp;utm_medium=wall-post&amp;utm_campaign=apachespark"">Apache Spark Makers Build</a></b>.  There are $100,000 in cash prizes.  Submissions can be sent in up to August 23rd.</p> <p><i>Participation Details: </i>To participate in the global virtual hackathon, you can <b><a href=""http://apachespark.devpost.com/?utm_source=facebook-partner&amp;utm_medium=wall-post&amp;utm_campaign=apachespark"">register here</a></b>.  Please review all registration guidelines.</p> <p>For the hack, you will apply Apache Spark's powerful analytics capabilities to enterprise and other relevant data so data scientists and software developers can build an analytics or mobile/web app that tackles a key business problem in marketing, customer case, operations or risk management.  The grand prize is $50,000, and the top three winners each get a meeting with the judge or<br/>Spark community expert of their choice; the judging panel includes data experts from Tesla, Netflix, and Silicon Valley Data Science.</p> <p>Go to <b><a href=""http://apachespark.devpost.com/?utm_source=facebook-partner&amp;utm_medium=wall-post&amp;utm_campaign=apachespark"">apachespark.devpost.com</a></b> for full details and registration.  Please review all registration rules.</p> <p><b> <i>Questions?</i></b></p> <p>We're here to help. If you have any questions about the hackathon, post on the <b><a href=""http://apachespark.devpost.com/forum_topics"">discussion forum</a></b> or email <b><i>support@devpost.com</i></b> and we'll respond as soon as we can.</p> ","","1368600910000","8493752","open","39.9900016784668","-83.04000091552734","Big Data Developers in Columbus","Big-Data-Developers-in-Columbus","Developers","","231579080","https://www.meetup.com/Big-Data-Developers-in-Columbus/events/231579080/","","Show Us Your Apps - Apache Spark Maker Build Global Hackathon","","","","past","1471986000000","1471998691000","-14400000","Any Street","","Any City","us","24581652","36.77825927734375","USA","-119.41793060302734","Global Online Hackathon","","False","CA","","public","0","10"
