"comment_count","created","description","duration","group_created","group_id","group_join_mode","group_lat","group_lon","group_name","group_urlname","group_who","how_to_find_us","id","link","manual_attendance_count","name","rsvp_close_offset","rsvp_limit","rsvp_open_offset","status","time","updated","utc_offset","venue_address_1","venue_address_2","venue_city","venue_country","venue_id","venue_lat","venue_localized_country_name","venue_lon","venue_name","venue_phone","venue_repinned","venue_state","venue_zip","visibility","waitlist_count","yes_rsvp_count"
"1","1422365659000","<p><i><b>THE BIG DATA FOR SOCIAL GOOD CHALLENGE BEGINS NOVEMBER 10, 2014 AND CONTINUES TO MARCH 3, 2015. </b></i></p> <p>

<b>CALLING ALL DEVELOPERS .... JOIN THE BIG DATA FOR SOCIAL GOOD CHALLENGE</b></p> <p>

Big data exists in just about everything we use and do. It comes from phones, cars, roads, power lines, waterways, food crates, and innumerable other items you’d never think of as computers. This data speaks volumes about our collective behavior and society – so let’s use it to do something incredible! IBM invites developers and data enthusiasts to take a deep dive into real world civic issues using big data and the IBM <a href=""https://console.ng.bluemix.net/"">Bluemix Analytics for Hadoop</a> service. Analyze one of our curated datasets or bring your own (provided it meets these requirements)! Use Hadoop and your data to create a clickable and interactive data visualization to highlight insights that you’ve found.</p> <p>

Ready to get started? $40,000 in prizes will be awarded....</p> <p>

Register here:<a href=""http://ibmhadoop.challengepost.com/""><a href=""http://ibmhadoop.challengepost.com/"" class=""linkified"">http://ibmhadoop.challengepost.com/</a></a>&lt;a href=""http://ibmhadoop.challengepost.com/""&gt;&lt;/a&gt;</p> <p>

What to Create: Participants must create a working, clickable, and interactive data visualization utilizing the <a href=""http://www.ibm.com/developerworks/library/ba-analytics-for-hadoop1/index.html"">Analytics for Hadoop service</a>&lt;a href=""http://www.ibm.com/developerworks/library/ba-analytics-for-hadoop1/index.html""&gt;&lt;/a&gt; on IBM Bluemix.</p> <p>

Data Requirements: Your data visualization must analyze one or more datasets included in the curated list of datasets on the Data page OR meet the data size, content, and licensing requirements described on the <a href=""http://ibmhadoop.challengepost.com/details/data"">Data page</a>. The total size of the Datasets analyzed must be between 500MB - 7GB in size.</p> <p>

Check out the requirements then go get your IBM Bluemix extended promo code and check out the <a href=""http://ibmhadoop.challengepost.com/details/data"">datasets</a>!</p> ","","1422362501000","18384617","open","45.5","-73.56999969482422","Big Data Developers in Montreal","Big-Data-Developers-in-Montreal","Members","","220112775","https://www.meetup.com/Big-Data-Developers-in-Montreal/events/220112775/","","Big Data for Social Good Challenge (See Details for Start/End)","","","","past","1425441600000","1425453335000","-18000000","Web only","","Global","hr","23524542","45.444305419921875","Croatia","15.734503746032715","Big Data for Social Good Challenge","","False","","","public","0","30"
"15","1425413320000","<p>- Français:</p> <p>Nous sommes ravis d'annoncer le lancement de la communauté ""Big Data Developer"" à Montréal. Nous espérons vous rencontrer tous pour notre évènement inaugural à Montréal. Ce groupe s'addresse aux développeurs, statisticiens et à tous les enthousiastes et les praticiens du Big Data. Nos meetups offrent une opportunité d`apprendre les dernières nouveautés dans le domaine des technologies Big Data et, pour certaines sessions d`avoir une expérience pratique sur les solutions Big Data et les outils associés. Pour la premier évènement qui va démarrer cette communauté, la session va être consacrée aux concepts clés de Hadoop (HDFS, MapReduce, YARN, Spark...), ainsi qu'une revue rapide du riche écosystème des projets Apache Open Source autour de Hadoop (HBase, Hive, Pig, Sqoop, Flume...). Cette session d`introduction sera suivie d'une session plus courte consacrée à l`exploitation du langage R sur Hadoop avec BigR, un composant de la distribution Hadoop d'IBM BigInsights. Cette première session sur Hadoop est très accessible s'addresse principalement à une audience familière avec la problématique de l'analyse de données en entreprise,<br/>d'intelligence d'affaires et des sciences de données et qui souhaite raffermir leurs connaissances de base sur Hadoop au délà des ""buzz words"", et sera particulièrement bénéfique à ceux qui font leur premier saut sur Hadoop.</p> <p>- English:</p> <p>We are thrilled to announce the launch of the Big Data Developer Meetup community in Montreal! We hope to see everyone out to the inaugural event in Montreal.<br/>This group is geared towards developers, data scientists and ALL Big Data enthusiasts and practitioners. Our meetups provide an opportunity to learn about the latest in Big Data technologies and get hands on experience on Big Data solution and tools. This being the first session to kick of the community, this session will focus to key concepts of Hadoop (HDFS, MapReduce, YARN, Spark...), as well as a quick overview of the rich ecosystem of Hadoop Apache Open Source projects around Hadoop (HBase, Hive, Pig, Sqoop, Flume...). This introductory session will be followed by a shorter session on using the langage R on Hadoop with BigR, a component of IBM Hadoop distribution BigInsights.</p> <p>This first session on Hadoop is very accessible and is targeted primarily to an audience familiar with the problematic of enterprise analytics, business intelligence, and data science, who want to enrich their Hadoop knowledge beyond buzz words. The session will be particularly beneficial to those doing their first dive into Hadoop.</p> ","7200000","1422362501000","18384617","open","45.5","-73.56999969482422","Big Data Developers in Montreal","Big-Data-Developers-in-Montreal","Members","","220899958","https://www.meetup.com/Big-Data-Developers-in-Montreal/events/220899958/","","Big Data Developers Montreal Kick-off","","80","","past","1427407200000","1427508954000","-14400000","1360 Rene Levesque Ouest, 11ème étage, Salle 11-553,","","Montréal","ca","23675812","45.72574996948242","Canada","-73.46022033691406","IBM Montreal Office","","False","QC","","public","0","78"
"14","1431022928000","<p>- Français:</p> <p><br/>Après la vue d'ensemble sur Hadoop précédente, nous planifions une session dédiée à Apache Spark. Spark, qui est une plate-forme de traitement distribué de données, brille par sa performance, sa facilité d'utilisation, ainsi qu'un ensemble d'outils de plus haut niveau pour faciliter son usage. Grâce à son intégration sur Hadoop, Apache Spark s'impose de facto comme une alternative attractive par rapport à Map Reduce.</p> <p>Cette présentation sera dédiée à Spark, avec une revue de son architecture, ses composants, son fonctionnement ainsi que son intégration sur Hadoop. Une démonstration sera faite en fin de session à partir d`un Lab. Nous essayerons dans la mesure du possible de partager les instructions du Lab à l`avance pour ceux qui souhaitent le faire durant la session.</p> <p>Cette session est de niveau introductive sur Spark. Elle sera bénéfique à l`ensemble des participants qui ont assisté à la première session de ce Meetup sur Hadoop, et aussi ceux familiers avec Hadoop, ou en général familiers avec la problématique de traitement de données massives  à des fins analytiques (R, bases de données MPP).</p> <p>Le matériel sera en Anglais. La présentation sera faite en Français. L`interaction avec le présentateur et les discussions peuvent être faites en Anglais ou Français selon votre préférence.</p> <p><br/>- English:</p> <p>

After the initial Hadoop overview, we are planning a session on Apache Spark. Spark, as an engine for large scale data processing, is shining by its speed, its ease of use, and a set of higher level tools to facilitate its use. With its integration on Hadoop, Apache Spark is seen as the de facto alternative to Map Reduce.</p> <p>This presentation will focus on Spark, with a review of its architecture, its components, its operation, as well as its integration on Hadoop. A demo will be done at the end of the session based on a Lab. We will try our best to share the instructions for the Lab in advance for those who are willing to do it during the session.</p> <p>This session is of an introductory level on Spark. It will be beneficial to the audience who attended the first session on Hadoop, as well as those familiar with Hadoop, or generally familiar with the problematic of big data processing for analytics purpose (R, MPP databases).</p> <p>The material will be in English. The presentation will be in French. Interaction with the speaker, and discussions can be held in either English or French according to your preference.</p> ","5400000","1422362501000","18384617","open","45.5","-73.56999969482422","Big Data Developers in Montreal","Big-Data-Developers-in-Montreal","Members","","222376502","https://www.meetup.com/Big-Data-Developers-in-Montreal/events/222376502/","","Apache Spark","","90","","past","1431640800000","1432745186000","-14400000","1360 Rene Levesque Ouest, 11ème étage, Salle 11-553,","","Montréal","ca","23675812","45.72574996948242","Canada","-73.46022033691406","IBM Montreal Office","","False","QC","","public","0","73"
"1","1434255512000","<p><i><b>THIS IS A WEB CONFERENCE ONLY.  TIME OF WEB CONFERENCE LOCALLY IS BASED ON LIVE-STREAM START - PACIFIC DAYLIGHT TIME. DETAILS TO CONNECT TO LIVE-STREAM ARE INDICATED BELOW.  </b></i></p> <p>Apache Spark is an open source processing engine built around speed, ease of use, and analytics. If you have large amounts of data that requires low latency processing that a typical Map Reduce program cannot provide, Spark is the alternative.</p> <p>Spark performs at speeds up to 100 times faster than Map Reduce for iterative algorithms or interactive data mining. Spark provides in-memory cluster computing for lightning fast speed and supports Java, Scala, and Python APIs for ease of development. Spark allows data scientists to build models quickly and supports iterative jobs on distributed datasets. This means more people can apply deep intelligence into applications to make everything smarter, including the Internet of Things (IoT), machine learning, web, mobile, social, business process and more. </p> <p>Do you believe in the value of Spark, in the speed, efficiency and flexibility of this in-memory compute engine? IBM does.  Emphatically.That's why we're committed to do everything we can to accelerate the adoption of Spark for enterprise analytics, where Spark promises seemingly unlimited value.</p> <p>On June 15, 2015, IBM will host a Spark Community event in San Francisco, California: IBM | Spark - The Start of Something Big in Data and Design. There will be a live demo showcase, refreshments, and a Town Hall discussion featuring some of the most trail-blazing data scientists in today's Spark Community, including:<br/>  Edd Dumbill, VP Strategy, Silicon Valley Data Science<br/>•  Mike Tamir, Chief Science Officer &amp; VP of Data Science &amp; Education at Galvanize<br/>•   Fernando Perez, Staff Scientist at Lawrence Berkeley National Laboratory &amp; Founding Investigator of the Berkeley Institute for Data Science<br/>•   Haoyuan Li, CEO and Founder of Tachyon Nexus<br/>•   Shankar Venkataraman, Distinguished Engineer &amp; CTO, IBM Analytics Platform at IBM<br/>•   Paco Nathan, Director, Community Evangelism, Databricks</p> <p>Spark Community members will also deliver 5-minute lightning talks to describe exciting projects they're working on.</p> <p>We will provide a livestream presentation of what these Spark leaders have to say.</p> <p><b>Live Streaming Link:</b></p> <p><b>To get additional details about Spark you can sign up now for a reminder at:</b></p> <p><b><a href=""http://www.ibm.com/analytics/us/en/technology/spark/""><a href=""http://www.ibm.com/analytics/us/en/technology/spark/"" class=""linkified"">http://www.ibm.com/analytics/us/en/technology/spark/</a></a></b></p> <p><b>Scroll down to ""Can't attend in Person""?  Sign up for a reminder and add it to your calendar.</b></p> <p>Additional information on Spark:</p> <p>Link to Spark Fundamentals Course in Big Data University</p> <p><a href=""http://bigdatauniversity.com/bdu-wp/bdu-course/spark-fundamentals/""><a href=""http://bigdatauniversity.com/bdu-wp/bdu-course/spark-fundamentals/"" class=""linkified"">http://bigdatauniversity.com/bdu-wp/bdu-course/spark-fundamentals/</a></a></p> <p>Link to Spark Technology Information</p> <p><a href=""http://www.ibm.com/analytics/us/en/technology/spark/""><a href=""http://www.ibm.com/analytics/us/en/technology/spark/"" class=""linkified"">http://www.ibm.com/analytics/us/en/technology/spark/</a></a></p> <p>Happy Sparking.</p> ","6300000","1422362501000","18384617","open","45.5","-73.56999969482422","Big Data Developers in Montreal","Big-Data-Developers-in-Montreal","Members","","223231440","https://www.meetup.com/Big-Data-Developers-in-Montreal/events/223231440/","","IBM | Spark - The start of something big in data & design (Web Conference Only)","","","","past","1434420000000","1434457384000","-14400000","","","","","","","","","","","","","","public","0","23"
"18","1444774674000","<p>- Français:</p> <p>Pour le premier évènement de cet automne, ce Meetup sera consacré aux concepts clés de Hadoop (HDFS, MapReduce, YARN, Spark...), ainsi qu`une revue rapide de l`écosystème riche des projets Apache Open Source autour de Hadoop (Pig, HBase, Flume...).</p> <p>Cette session introductive sur Hadoop sera suivie d`une autre session consacrée au sujet de SQL sur Hadoop. Un premier volet sera un survol de Hive, projet Apache Open source top-level, qui offre une interface SQL pour des requêtes de type data warehouse sur Hadoop. Ce survol sera suivi d`une discussion sur BigSQL, qui est le moteur SQL sur Hadoop d`IBM, faisant partie de IBM BigInsights, la distribution Hadoop d`IBM.</p> <p>Cette session sur Hadoop très accessible s`addresse principalement à une audience familière avec la problématique de l`analyse de données en entreprise, d'intelligence d'affaires et des sciences de données et qui souhaite raffermir leurs connaissances de base sur Hadoop au délà des ""buzz words"", et sera particulièrement bénéfique à ceux qui font leur premier saut sur Hadoop, et ceux qui souhaitent en savoir plus sur l`utilisation de SQL sur Hadoop.</p> <p>Le matériel sera en Anglais. La session sera conduite en Français. Les discussions et questions peuvent être faites en Français ou Anglais selon votre préférence.</p> <p>Nous espérons vous voir nombreux lors de cette session du 5 Novembre !</p> <p><br/>- English:</p> <p>For the first event of the fall, this Meetup will focus on key concepts of Hadoop (HDFS, MapReduce, YARN, Spark...), as well as a quick overview of the rich ecosystem of Hadoop Apache Open Source projects around Hadoop (Pig, HBase, Flume...).</p> <p>This introductory session will be followed by another session on the topic of SQL on Hadoop. In the first part, an overview of Hive, Apache</p> <p>Open Source top ket project, which offers a SQL interface for data warehouse workloads on Hadoop. This overview will be followed by a discussion on BigSQL, which is IBM's SQL on Hadoop engine, offered with IBM BigInsights, IBM`s Hadoop distribution.</p> <p>This session on Hadoop is very accessible and is targeted primarily to an audience familiar with the problematic of enterprise analytics, business intelligence, and data science, who want to enrich their Hadoop knowledge beyond buzz words. The session will be particularly beneficial to those doing their first dive into Hadoop, and those who want to find out more about how to use SQL on Hadoop.</p> <p>The material will be in English. The session will be done in French. Discussions and Question/Answers can be held either in French or English according to your preference.</p> <p>Hoping to see you all on November 5th!</p> <p><b>Agenda: </b></p> <p><b>- 17:45-18:00: Networking &amp; Pizza<br/></b></p> <p><b>- 18:00-19:00: Hadoop 101: Open source Hadoop Overview</b></p> <p><b>- 19h00-20:00: SQL on Hadoop: Apache Hive &amp; IBM BigSQL </b></p> ","8100000","1422362501000","18384617","open","45.5","-73.56999969482422","Big Data Developers in Montreal","Big-Data-Developers-in-Montreal","Members","","226039711","https://www.meetup.com/Big-Data-Developers-in-Montreal/events/226039711/","","SQL on Hadoop","","116","","past","1446763500000","1447111836000","-18000000","1360 Rene Levesque Ouest, 11ème étage, Salle 11-553,","","Montréal","ca","23675812","45.72574996948242","Canada","-73.46022033691406","IBM Montreal Office","","False","QC","","public","0","111"
"0","1462026228000","<p>On June 6, 2016, leading minds in data and analytics from Tesla, Netflix, Silicon Valley Data Science, and IBM will come together to demonstrate how open data and analytics technologies such as R, Spark, Python and more are forming a vibrant ecosystem.  The community has a shared goal of working with all data to build unexpected insights and launch new business applications.</p> <p>The Apache Spark Maker Community Event will bring together data scientists, data engineers, data developers, and data designers June 6th @ 6pm at Galvanize, San Francisco. Here’s the plan:   </p> <p>- The Big Reveal – New sample Apache Spark apps and tools</p> <p>- Use Cases – Monsanto will share how they are using R and Spark to optimize their supply chain</p> <p>- Learning Session - Hear from experts working on Spark projects and building the Spark ecosystem of open data and analytics technologies</p> <p>- Networking Opportunity – Food, drinks and data, explore a Hall of Innovation showcasing Spark demos</p> <p>Join us. Learn more here:  <b><i><a href=""http://www.ibm.com/analytics/us/en/events/apache-spark/"">Apache Spark Maker Community Event</a></i></b> </p> <p>Registration begins at 5:30 PM and the discussion starts at 6:30 PM; food and drinks will be served. You must register for this event. </p> <p>To get your ticket, and attend in person, click <b><a href=""https://www.eventbrite.com/e/apache-sparktm-maker-community-event-registration-24742595770?cm_mc_uid=39680333471514613509392&amp;cm_mc_sid_50200000=1461961944"">HERE</a></b>. </p> <p>Can't attend in person? We'll be live streaming this event on a computer screen near you! Register for the  <b><a href=""https://www.eventbrite.com/e/livestream-apache-sparktm-maker-community-event-registration-24790223225?cm_mc_uid=39680333471514613509392&amp;cm_mc_sid_50200000=1461961944"">live stream</a></b> and we'll send you a calendar update and login link.</p> ","14400000","1422362501000","18384617","open","45.5","-73.56999969482422","Big Data Developers in Montreal","Big-Data-Developers-in-Montreal","Members","","230766316","https://www.meetup.com/Big-Data-Developers-in-Montreal/events/230766316/","","Apache Spark Maker Community Event","","","","past","1465248600000","1465263858000","-14400000","44 Tehama Street","","San Francisco","us","24126294","37.78749465942383","USA","-122.39653015136719","Galvanize U","","False","CA","","public","0","13"
"5","1464825049000","<p><b>THIS IS A GLOBAL ON-LINE HACKATHON THAT BEGINS MAY 23, 2016 AND <i>NOW ENDS AUGUST 23, 2016</i>.  SUBMISSIONS DUE AUGUST 23rd BY 5:00 PM EST. </b></p> <p><b>We’re extending the hackathon deadline to August 23</b> - that’s 20 additional days to build your Spark enterprise app. (View the revised competition calendar <b><a href=""http://apachespark.devpost.com/details/dates"">HERE</a></b><b>.  </b>We're giving you more time because....</p> <p>We’re adding <b>new enterprise data resources</b> to the site and we want to give you a chance to incorporate these into your projects, if you so choose.  Our awesome data co-sponsors <b><a href=""http://www.yelp.com/nyc"">Yelp</a></b> and <b><a href=""https://uncharted.software/"">Uncharted Software</a></b> have generously shared some of their enterprise data sets for you to use during the hackathon.</p> <p>Yelp’s data includes 2.2M reviews by 552K users for 77K businesses. The Uncharted data includes Bitcoin network transactions from processing the Bitcoin blockchain as of mid-2014 <i>and</i> Amazon product reviews from 1995 through 2003. For a fuller description and data access, visit our <b><a href=""http://apachespark.devpost.com/details/resources#datasets"">resources page</a></b>.</p> <p>Uncharted Software also has a couple cool Spark data visualization libraries you should check out: <b><a href=""http://unchartedsoftware.github.io/salt/"">Salt</a></b> and <b><a href=""http://unchartedsoftware.github.io/sparkpipe-core/"">SparkPipe.</a></b></p> <p>And, in case you’d like to weigh the effects of weather on business operations, we’re also offering access to the full suite of <b><a href=""http://apachespark.devpost.com/details/weather_data"">Weather Company APIs</a></b> for the duration of the hackathon.</p> <p>Finally, if you’re looking for a hosting solution for your Spark app, we’re now offering <b>extended Bluemix trials for all hackathon participants</b>. Using Bluemix services to build your project is <b><i>totally optional</i></b>, but might be a good way to get your app up and running — particularly with the IBM Analytics for Apache Spark service.</p> <p><b><a href=""http://apachespark.devpost.com/details/bluemix_promo"">You can request your extended Bluemix trial code here.</a> </b> For all hackathon participants, trials will extend through November 1, 2016. <i>Now go forth and optimize for the enterprise!</i></p> <p>---------------------</p> <p>Build an Apache Spark application to address a real business problem or core concern related to customer care, marketing, risk management or operations. Join IBM and Devpost for a global hackathon using <b><a href=""http://apachespark.devpost.com/?utm_source=facebook-partner&amp;utm_medium=wall-post&amp;utm_campaign=apachespark"">Apache Spark Makers Build</a></b>.  There are $100,000 in cash prizes.  Submissions can be sent in up to August 23rd.</p> <p><i>Participation Details: </i>To participate in the global virtual hackathon, you can <b><a href=""http://apachespark.devpost.com/?utm_source=facebook-partner&amp;utm_medium=wall-post&amp;utm_campaign=apachespark"">register here</a></b>.  Please review all registration guidelines.</p> <p>For the hack, you will apply Apache Spark's powerful analytics capabilities to enterprise and other relevant data so data scientists and software developers can build an analytics or mobile/web app that tackles a key business problem in marketing, customer case, operations or risk management.  The grand prize is $50,000, and the top three winners each get a meeting with the judge or<br/>Spark community expert of their choice; the judging panel includes data experts from Tesla, Netflix, and Silicon Valley Data Science.</p> <p>Go to <b><a href=""http://apachespark.devpost.com/?utm_source=facebook-partner&amp;utm_medium=wall-post&amp;utm_campaign=apachespark"">apachespark.devpost.com</a></b> for full details and registration.  Please review all registration rules.</p> <p><b> <i>Questions?</i></b></p> <p>We're here to help. If you have any questions about the hackathon, post on the <b><a href=""http://apachespark.devpost.com/forum_topics"">discussion forum</a></b> or email <b><i>support@devpost.com</i></b> and we'll respond as soon as we can.</p> ","","1422362501000","18384617","open","45.5","-73.56999969482422","Big Data Developers in Montreal","Big-Data-Developers-in-Montreal","Members","","231579603","https://www.meetup.com/Big-Data-Developers-in-Montreal/events/231579603/","","Show Us Your Apps - Apache Spark Maker Build Global Hackathon","","","","past","1471986000000","1471998692000","-14400000","Any Street","","Any City","us","24581652","36.77825927734375","USA","-119.41793060302734","Global Online Hackathon","","False","CA","","public","0","15"
