"comment_count","created","description","duration","group_created","group_id","group_join_mode","group_lat","group_lon","group_name","group_urlname","group_who","how_to_find_us","id","link","manual_attendance_count","name","rsvp_close_offset","rsvp_limit","rsvp_open_offset","status","time","updated","utc_offset","venue_address_1","venue_address_2","venue_city","venue_country","venue_id","venue_lat","venue_localized_country_name","venue_lon","venue_name","venue_phone","venue_repinned","venue_state","venue_zip","visibility","waitlist_count","yes_rsvp_count"
"1","1458942339000","<p>Join Evolving Solutions and IBM for a Big Data &amp; Apache Spark Developer Day on April 28th at the Minneapolis Marriott Southwest.  This is a customer event only.</p> <p><br/>The Developer Day will introduce the open source processing engine, Apache Spark, highlighting not only it's awesome power but how it fits within the larger data landscape. You will learn why Spark was developed to crunch through Big Data, what MapReduce is, and why Spark can beat the pants off of it in terms of performance and ease of use. You will learn how non-programmers can get started with Spark (warning: there is no escaping code, but you can do it, we promise), with a hands on lab exploring Spark and the Spark Machine Learning library. </p> <p>Specifically, the lab will introduce the data science methodology cycle through the implementation of one specific analytic approach: text classification.  Through concrete examples, you will use Apache Spark and its machine learning library to develop and train a Naeve Bayes classifier.  During this lab, we will also use a Jupyter Notebook to interact with a Spark cluster and explore text data as well as access data from files, object storage and through SQL to learn when each method is useful.   </p> <p><i><b>Agenda:</b></i></p> <p>12:00 to 01:00 pm - Registration and Lunch<br/>01:00 to 02:00 pm - Overview of Apache Spark<br/>02:00 to 05:00 pm - Hands-on Lab - Spark Machine Learning/Text Classifier</p> <p>To confirm your seat, please register here:  <b><a href=""http://ibm.co/1MGVQ6b""><a href=""http://ibm.co/1MGVQ6b"" class=""linkified"">http://ibm.co/1MGVQ6b</a></a></b></p> <p><br/>Lunch will be provided.  Join Evolving Solutions and IBM for some networking and refreshments after the hands-on lab.</p> ","18000000","1363601061000","7667362","open","44.97999954223633","-93.2699966430664","Big Data Developers in Minneapolis","Big-Data-Developers-in-Minneapolis","Developers","zip 55343","229874912","https://www.meetup.com/Big-Data-Developers-in-Minneapolis/events/229874912/","","Big Data & Apache Spark Developer Day","","","","past","1461862800000","1461887003000","-18000000","5801 Opus Pkwy","","Minnetonka","us","14912712","44.89772415161133","USA","-93.40635681152344","Minneapolis Marriott Southwest ","","False","MN","55343","public","0","40"
"2","1461977062000","<p>On June 6, 2016, leading minds in data and analytics from Tesla, Netflix, Silicon Valley Data Science, and IBM will come together to demonstrate how open data and analytics technologies such as R, Spark, Python and more are forming a vibrant ecosystem.  The community has a shared goal of working with all data to build unexpected insights and launch new business applications.</p> <p>The Apache Spark Maker Community Event will bring together data scientists, data engineers, data developers, and data designers June 6th @ 6pm at Galvanize, San Francisco. Here’s the plan:   </p> <p>- The Big Reveal – New sample Apache Spark apps and tools</p> <p>- Use Cases – Monsanto will share how they are using R and Spark to optimize their supply chain</p> <p>- Learning Session - Hear from experts working on Spark projects and building the Spark ecosystem of open data and analytics technologies</p> <p>- Networking Opportunity – Food, drinks and data, explore a Hall of Innovation showcasing Spark demos</p> <p>Join us. Learn more here:  <b><i><a href=""http://www.ibm.com/analytics/us/en/events/apache-spark/"">Apache Spark Maker Community Event</a></i></b> </p> <p>Registration begins at 5:30 PM and the discussion starts at 6:30 PM; food and drinks will be served. You must register for this event. </p> <p>To get your ticket, and attend in person, click <b><a href=""https://www.eventbrite.com/e/apache-sparktm-maker-community-event-registration-24742595770?cm_mc_uid=39680333471514613509392&amp;cm_mc_sid_50200000=1461961944"">HERE</a></b>. </p> <p>Can't attend in person? We'll be live streaming this event on a computer screen near you! Register for the  <b><a href=""https://www.eventbrite.com/e/livestream-apache-sparktm-maker-community-event-registration-24790223225?cm_mc_uid=39680333471514613509392&amp;cm_mc_sid_50200000=1461961944"">live stream</a></b> and we'll send you a calendar update and login link.</p> ","14400000","1363601061000","7667362","open","44.97999954223633","-93.2699966430664","Big Data Developers in Minneapolis","Big-Data-Developers-in-Minneapolis","Developers","","230756439","https://www.meetup.com/Big-Data-Developers-in-Minneapolis/events/230756439/","","Apache Spark Maker Community Event","","","","past","1465252200000","1465268287000","-18000000","44 Tehama Street","","San Francisco","us","24126294","37.78749465942383","USA","-122.39653015136719","Galvanize U","","False","CA","","public","0","12"
"0","1464822392000","<p><b>THIS IS A GLOBAL ON-LINE HACKATHON THAT BEGINS MAY 23, 2016 AND <i>NOW ENDS AUGUST 23, 2016</i>.  SUBMISSIONS DUE AUGUST 23rd BY 5:00 PM EST. </b></p> <p><b>We’re extending the hackathon deadline to August 23</b> - that’s 20 additional days to build your Spark enterprise app. (View the revised competition calendar <b><a href=""http://apachespark.devpost.com/details/dates"">HERE</a></b><b>.  </b>We're giving you more time because....</p> <p>We’re adding <b>new enterprise data resources</b> to the site and we want to give you a chance to incorporate these into your projects, if you so choose.  Our awesome data co-sponsors <b><a href=""http://www.yelp.com/nyc"">Yelp</a></b> and <b><a href=""https://uncharted.software/"">Uncharted Software</a></b> have generously shared some of their enterprise data sets for you to use during the hackathon.</p> <p>Yelp’s data includes 2.2M reviews by 552K users for 77K businesses. The Uncharted data includes Bitcoin network transactions from processing the Bitcoin blockchain as of mid-2014 <i>and</i> Amazon product reviews from 1995 through 2003. For a fuller description and data access, visit our <b><a href=""http://apachespark.devpost.com/details/resources#datasets"">resources page</a></b>.</p> <p>Uncharted Software also has a couple cool Spark data visualization libraries you should check out: <b><a href=""http://unchartedsoftware.github.io/salt/"">Salt</a></b> and <b><a href=""http://unchartedsoftware.github.io/sparkpipe-core/"">SparkPipe.</a></b></p> <p>And, in case you’d like to weigh the effects of weather on business operations, we’re also offering access to the full suite of <b><a href=""http://apachespark.devpost.com/details/weather_data"">Weather Company APIs</a></b> for the duration of the hackathon.</p> <p>Finally, if you’re looking for a hosting solution for your Spark app, we’re now offering <b>extended Bluemix trials for all hackathon participants</b>. Using Bluemix services to build your project is <b><i>totally optional</i></b>, but might be a good way to get your app up and running — particularly with the IBM Analytics for Apache Spark service.</p> <p><b><a href=""http://apachespark.devpost.com/details/bluemix_promo"">You can request your extended Bluemix trial code here.</a> </b></p> <p>For all hackathon participants, trials will extend through November 1, 2016.</p> <p><i>Now go forth and optimize for the enterprise!</i></p> <p>---------------------</p> <p>Build an Apache Spark application to address a real business problem or core concern related to customer care, marketing, risk management or operations. Join IBM and Devpost for a global hackathon using <b><a href=""http://apachespark.devpost.com/?utm_source=facebook-partner&amp;utm_medium=wall-post&amp;utm_campaign=apachespark"">Apache Spark Makers Build</a></b>.  There are $100,000 in cash prizes.  Submissions can be sent in up to August 23rd.</p> <p><i>Participation Details: </i>To participate in the global virtual hackathon, you can <b><a href=""http://apachespark.devpost.com/?utm_source=facebook-partner&amp;utm_medium=wall-post&amp;utm_campaign=apachespark"">register here</a></b>.  Please review all registration guidelines.</p> <p>For the hack, you will apply Apache Spark's powerful analytics capabilities to enterprise and other relevant data so data scientists and software developers can build an analytics or mobile/web app that tackles a key business problem in marketing, customer case, operations or risk management.  The grand prize is $50,000, and the top three winners each get a meeting with the judge or<br/>Spark community expert of their choice; the judging panel includes data experts from Tesla, Netflix, and Silicon Valley Data Science.</p> <p>Go to <b><a href=""http://apachespark.devpost.com/?utm_source=facebook-partner&amp;utm_medium=wall-post&amp;utm_campaign=apachespark"">apachespark.devpost.com</a></b> for full details and registration.  Please review all registration rules.</p> <p><b> <i>Questions?</i></b></p> <p>We're here to help. If you have any questions about the hackathon, post on the <b><a href=""http://apachespark.devpost.com/forum_topics"">discussion forum</a> </b>or email <b><i>support@devpost.com </i></b>and we'll respond as soon as we can.</p> ","","1363601061000","7667362","open","44.97999954223633","-93.2699966430664","Big Data Developers in Minneapolis","Big-Data-Developers-in-Minneapolis","Developers","","231578269","https://www.meetup.com/Big-Data-Developers-in-Minneapolis/events/231578269/","","Show Us Your Apps - Apache Spark Maker Build Global Hackathon","","","","past","1471989600000","1472002195000","-18000000","Any Street","","Any City","us","24581652","36.77825927734375","USA","-119.41793060302734","Global Online Hackathon","","False","CA","","public","0","11"
"0","1472445394000","<p>On September 27, 2016, leading minds in data and analytics will come together and unveil the latest in cloud technology, enabling you to more efficiently put data to work. Experience how Spark, Hadoop, Python, and more are being used to bring together all types of data professionals –from data engineers, to data scientists, developers and business analysts –to work in new collaborative ways.</p> <p>The IBM DataFirst Launch Event will unite data and analytics leaders and practitioners from the open source community, startups, and enterprises. Check the <i><b><a href=""http://www.ibm.com/analytics/us/en/events/datafirst/index.html"">event site</a></b></i> for the latest lineup of guest speakers. The event takes place @ 6pm at the Hudson Mercantile Building, NYC.</p> <p>Here’s the plan:<br/>• The Big Reveal –Experience new ways to work for data engineers, data scientist, developers, and business analysts, both individually and collectively.</p> <p>•Hands-on sessions – With interactive experiences for each of these professions.</p> <p>•Use Cases –Community leaders and guest speakers will share their expertise and vision<br/>•Networking Opportunity – Food, drinks, data, collaborative demos, and a party on the rooftop</p> <p>Learn more here:<a href=""http://www.ibm.com/analytics/us/en/events/datafirst/index.html#"">  <i><b>DataFirst Launch Event</b></i></a></p> <p>Check-in and networking begins at 6:00 PM.  Food and drinks will be served. You must register for this event.</p> <p>To get your ticket, and attend in person, click <b><a href=""https://www.eventbrite.com/e/ibm-datafirst-launch-event-registration-26725283041"">HERE</a></b>.  </p> <p>Can't attend in person? We'll be live streaming this event.  Register for the <b><a href=""https://www.eventbrite.com/e/livestream-ibm-datafirst-launch-event-registration-26906650516"">LIVE STREAM </a></b>and we'll send you a calendar update and login link. </p> ","14400000","1363601061000","7667362","open","44.97999954223633","-93.2699966430664","Big Data Developers in Minneapolis","Big-Data-Developers-in-Minneapolis","Developers","zip 10018","233702535","https://www.meetup.com/Big-Data-Developers-in-Minneapolis/events/233702535/","","DataFirst Launch Event – Experience new ways to put your data to work","","","","past","1475017200000","1475033246000","-18000000","500 West 36th Street","","New York","us","24745891","40.755863189697266","USA","-73.99864959716797","Hudson Mercantile Bldg","","False","NY","","public","0","10"
"10","1475864256000","<p>In order to confirm your seat, you must register by sending an email to:<br/><b>whits@us.ibm.com.</b></p> <p><br/>IBM is offering a free workshop for clients and practitioners on Apache Spark. This is a full day of education on Spark with hands on exercises instructed in person by Spark experts. The course will provide a detailed overview of Apache Spark with real world hands on examples of data wrangling and machine learning. The exercises will be done in Jupyter notebooks with publicly available datasets. Participants will use IBM’s fully managed Cloud platform.</p> <p><i><b>Who should go</b></i>: Anyone interested in learning more about Apache Spark.</p> <p><i><b>Prerequisite</b></i>: A working knowledge of Coding (Preferred Python and/or Scala) would be helpful.</p> <p><i><b>What to expect</b></i>:<br/>- Expect to spend a full day of lecture and hands on exercises attacking real-world data challenges using Apache Spark. In 8 hours you will learn the basic essentials of Apache Spark and why it's important to your organization.<br/>- This workshop will focus on data wrangling and machine learning.</p> <p><i><b>Agenda</b></i>:<br/>8:30am - Check-in, Breakfast, Networking<br/>9:00am – Kickoff, Apache Spark Overview<br/>10:00am – Lab 1, Intro to Spark - Hands on exercise<br/>11:00am –  Apache Spark SQL Overview<br/>12:00pm –  Lunch<br/>1:00 pm – Lab 2, Spark SQL - Hands on exercise<br/>2:00 pm – Overview of Data Science &amp; Machine Learning w/ Apache Spark<br/>3:00 pm – Lab 3, Machine Learning w/ Spark – Hands on exercise<br/>4:00 pm -  Wrap up – Feedback from attendees</p> <p><i><b>Registration</b></i>:<br/>Reserve your seat by <b>sending an email to <i>whits@us.ibm.com</i></b>. For additional questions, please email whits@us.ibm.com.</p> <p><i><b>What to Bring</b></i>:<br/>Attendees are encouraged to bring your own laptop, as we will be leveraging a cloud platform for all exercises. A limited number of additional laptops will also be available.</p> ","28800000","1363601061000","7667362","open","44.97999954223633","-93.2699966430664","Big Data Developers in Minneapolis","Big-Data-Developers-in-Minneapolis","Developers","4th Floor - Zip 55402","234698587","https://www.meetup.com/Big-Data-Developers-in-Minneapolis/events/234698587/","","Apache Spark - Hands-on Introduction","","","","past","1476711000000","1479849538000","-18000000","650 3rd Avenue South ","","Minneapolis","us","24832698","44.9758186340332","USA","-93.26813507080078","IBM","","False","MN","","public","0","48"
"0","1481831080000","<p>RSVP: <a href=""http://bit.ly/2gOcufe""><a href=""http://bit.ly/2gOcufe"" class=""linkified"">http://bit.ly/2gOcufe</a></a></p> <p>This webinar will cover an overview of Watson Data Platform capabilities and how to empower users across the organization to make the most out of their data. What if you can shorten the time it takes to create value out of your existing organizational data ? </p> <p>What if you can provision a common analytic engine with managed services that will enable you to embrace multiple cloud platforms ? IBM Watson Data Platform is the first cloud-based data and analytics platform to support cognitive businesses. It enables access, collaboration and paths to insights by connecting all users through trusted access to a variety of data, discovering new possibilities and opportunities with built-in intelligence, automation and machine learning and accelerating outcomes with rapid deployment of new data models and fast embedding of insights into processes, applications and services. </p> <p>Let us show you how Watson Data Platform can be the milestone of your organization analytics strategy and empower your organization into the new Cognitive analytics era.</p> <p><b>Speaker Bio: </b><br/>Gerardo Rodríguez Díaz – is an avid traveler, technologist enthusiast and Big data and Analytics cloud solution specialist focused on communications and computer systems integrations industries across North America. GRD areas of specialization are IT, Marketing and Business Intelligence having worked across European, North and South American markets.</p> ","3600000","1363601061000","7667362","open","44.97999954223633","-93.2699966430664","Big Data Developers in Minneapolis","Big-Data-Developers-in-Minneapolis","Developers","Time is Eastern Standard Time","236263706","https://www.meetup.com/Big-Data-Developers-in-Minneapolis/events/236263706/","","Making Data Simple in the Cognitive Era","","","","past","1482256800000","1482262277000","-21600000","http://bit.ly/2gOcufe","","Minneapolis","us","24947638","0.0","USA","0.0","Live Webinar","","False","MN","","public","0","19"
"1","1485389024000","<p>The demand for machine learning is booming! </p> <p>Calling all IT executives, data scientists, Chief Data Officers, data architects and other data geeks.  Join us on <b>February 15th from 2:00-5:30 pm ET </b>via livestream  (replay available starting February 16th) , and discover how machine learning is fundamentally changing the way we work and live.  Hear about cognitive applications that anticipate behavior and learn from data without being explicitly programmed.</p> <p>You'll learn about the latest breakthrough developments on machine learning as well as Spark, data and analytics. Mike Gualtieri, Vice President and Principal Analyst, Forrester, will present his view on how to best leverage technologies such as big data, predictive analytics, Hadoop/Spark, machine learning, data science, and AI.  Rob Thomas, General Manager, IBM Analytics will host an agenda which will include guest speakers and cover the following topics:</p> <p>•  Machine Learning Overview</p> <p>•  Top Trends in Machine Learning &amp; Cognitive Applications</p> <p>•  Cognitive Analytics and Machine Learning for the Enterprise</p> <p>•  Live Product Demonstration &amp; Client Roundtable on Machine Learning</p> <p>•  Data Innovation with Hybrid Transaction/Analytical Processing</p> <p>•  Spark &amp; Machine Learning for Enterprise Systems</p> <p>For additional details and to REGISTER, please visit <i><b><a href=""http://www.ibm.com/analytics/us/en/events/machine-learning/"">MACHINE LEARNING.</a></b></i></p> <p>Register NOW and we'll send you a reminder!</p> ","12600000","1363601061000","7667362","open","44.97999954223633","-93.2699966430664","Big Data Developers in Minneapolis","Big-Data-Developers-in-Minneapolis","Developers","Livestream is Eastern Standard Time (EST) - Adjust to your time zone","237202700","https://www.meetup.com/Big-Data-Developers-in-Minneapolis/events/237202700/","","Machine Learning Launch","","","","past","1487188800000","1487212524000","-21600000","http://ibm.co/MLevent","","Minneapolis","us","25012523","0.0","USA","0.0","LIVESTREAM","","False","MN","","public","0","72"
