"comment_count","created","description","duration","group_created","group_id","group_join_mode","group_lat","group_lon","group_name","group_urlname","group_who","how_to_find_us","id","link","manual_attendance_count","name","rsvp_close_offset","rsvp_limit","rsvp_open_offset","status","time","updated","utc_offset","venue_address_1","venue_address_2","venue_city","venue_country","venue_id","venue_lat","venue_localized_country_name","venue_lon","venue_name","venue_phone","venue_repinned","venue_state","venue_zip","visibility","waitlist_count","yes_rsvp_count"
"0","1430876967000","<p><b>REMINDER: </b></p> <p><br/><b>In order to reserve your spot, register here: <a href=""https://www.eventbrite.com/e/the-future-of-analytics-in-action-atlanta-registration-16658865114""><a href=""https://future-of-analytics-atlanta.eventbrite.com"" class=""linkified"">https://future-of-analytics-atlanta.eventbrite.com</a></a> </b></p> <p><br/>Information has become one of the world’s most valuable natural resources.  We’re swimming in data, but it can be challenging to capitalize on it. </p> <p>Now is the time to harness your data in game-changing ways.  If your company is exploring new approaches to innovate with systems of insight and customer engagement to improve operational decision making and generate new revenue streams, then The Future of Analytics in Action is a must-attend event.</p> <p>Come hear how a comprehensive set of integrated cloud data services covering content, database, and analytics capabilities is creating new opportunities to transform industries, including financial services, insurance, automotive, healthcare, food services, media and entertainment, and more. </p> <p>Attendees will:<br/>- hear real-world client examples of companies leveraging Bluemix, Cloud Data Services, and Watson Analytics to disrupt their industries;<br/>- see demonstrations of how IBM’s cloud-based services deliver a rich developer experience and a fast on-ramp to bring offerings to market in as little as 90 days.<br/>- network with peers to understand how companies are deploying these new technologies in cost-efficient ways to create competitive advantage</p> <p><b>Agenda </b></p> <p>8:30am  - Registration and Continental Breakfast<br/>9:00am  - The Future of Analytics in Action: The Art of the<br/>                    Possible<br/>10:00am - Demonstration<br/>10:30am  - Break<br/>10:45am  - Real World Insights: A Client's Perspective<br/>11:15am    - Open Q&amp;A<br/>12:00pm  - Lunch and Networking<br/>1:00pm    h- Close and thank you for attending.</p> <p><b>In order to reserve your spot, register here:<br/></b></p> <p><b><a href=""https://www.eventbrite.com/e/the-future-of-analytics-in-action-atlanta-registration-16658865114""><a href=""https://future-of-analytics-atlanta.eventbrite.com"" class=""linkified"">https://future-of-analytics-atlanta.eventbrite.com</a></a><br/></b></p> ","16200000","1362746690000","7520772","open","33.86000061035156","-84.4000015258789","Big Data Developers in Atlanta","Big-Data-Developers-in-Atlanta","Developers","","222336367","https://www.meetup.com/Big-Data-Developers-in-Atlanta/events/222336367/","","The Future of Analytics in Action","","","","past","1432816200000","1432834991000","-14400000","6303 Barfield Road","","Atlanta","us","17317892","33.927974700927734","USA","-84.35977935791016","IBM","","False","GA","30328","public","0","26"
"0","1434248003000","<p><i><b>THIS IS A WEB CONFERENCE ONLY.  TIME OF WEB CONFERENCE LOCALLY IS BASED ON LIVE-STREAM START - PACIFIC DAYLIGHT TIME. DETAILS TO CONNECT TO LIVE-STREAM ARE INDICATED BELOW.  </b></i></p> <p>Apache Spark is an open source processing engine built around speed, ease of use, and analytics. If you have large amounts of data that requires low latency processing that a typical Map Reduce program cannot provide, Spark is the alternative.</p> <p>Spark performs at speeds up to 100 times faster than Map Reduce for iterative algorithms or interactive data mining. Spark provides in-memory cluster computing for lightning fast speed and supports Java, Scala, and Python APIs for ease of development. Spark allows data scientists to build models quickly and supports iterative jobs on distributed datasets. This means more people can apply deep intelligence into applications to make everything smarter, including the Internet of Things (IoT), machine learning, web, mobile, social, business process and more. </p> <p>Do you believe in the value of Spark, in the speed, efficiency and flexibility of this in-memory compute engine? IBM does.  Emphatically.That's why we're committed to do everything we can to accelerate the adoption of Spark for enterprise analytics, where Spark promises seemingly unlimited value.</p> <p>On June 15, 2015, IBM will host a Spark Community event in San Francisco, California: IBM | Spark - The Start of Something Big in Data and Design. There will be a live demo showcase, refreshments, and a Town Hall discussion featuring some of the most trail-blazing data scientists in today's Spark Community, including:</p> <p>•  Edd Dumbill, VP Strategy, Silicon Valley Data Science<br/>•  Mike Tamir, Chief Science Officer &amp; VP of Data Science &amp; Education at Galvanize<br/>•   Fernando Perez, Staff Scientist at Lawrence Berkeley National Laboratory &amp; Founding Investigator of the Berkeley Institute for Data Science<br/>•   Haoyuan Li, CEO and Founder of Tachyon Nexus<br/>•   Shankar Venkataraman, Distinguished Engineer &amp; CTO, IBM Analytics Platform at IBM<br/>•   Paco Nathan, Director, Community Evangelism, Databricks</p> <p>Spark Community members will also deliver 5-minute lightning talks to describe exciting projects they're working on.</p> <p>We will provide a livestream presentation of what these Spark leaders have to say.</p> <p><b>Live Streaming Link:</b></p> <p><b>To get additional details about Spark you can sign up now for a reminder at:</b></p> <p><b><a href=""http://www.ibm.com/analytics/us/en/technology/spark/""><a href=""http://www.ibm.com/analytics/us/en/technology/spark/"" class=""linkified"">http://www.ibm.com/analytics/us/en/technology/spark/</a></a></b></p> <p><b>Scroll down to ""Can't attend in Person""?  Sign up for a reminder and add it to your calendar.</b></p> <p>Additional information on Spark:</p> <p>Link to Spark Fundamentals Course in Big Data University</p> <p><a href=""http://bigdatauniversity.com/bdu-wp/bdu-course/spark-fundamentals/""><a href=""http://bigdatauniversity.com/bdu-wp/bdu-course/spark-fundamentals/"" class=""linkified"">http://bigdatauniversity.com/bdu-wp/bdu-course/spark-fundamentals/</a></a></p> <p>Link to Spark Technology Information</p> <p><a href=""http://www.ibm.com/analytics/us/en/technology/spark/""><a href=""http://www.ibm.com/analytics/us/en/technology/spark/"" class=""linkified"">http://www.ibm.com/analytics/us/en/technology/spark/</a></a></p> <p>Happy Sparking.</p> ","92700000","1362746690000","7520772","open","33.86000061035156","-84.4000015258789","Big Data Developers in Atlanta","Big-Data-Developers-in-Atlanta","Developers","","223230072","https://www.meetup.com/Big-Data-Developers-in-Atlanta/events/223230072/","","IBM | Spark - The start of something big in data & design (Web Conference Only))","","","","past","1434420000000","1434513724000","-14400000","","","","","","","","","","","","","","public","0","27"
"4","1462918239000","<p>This is a full day of education on Apache Spark with hands on exercises instructed in person by Apache Spark experts. The POT will provide a detailed overview of Apache Spark and Data Science methodology. The Lab will be performed using open source Jupyter notebooks on publicly available datasets. Participants will use IBM’s fully managed Apache Spark Cloud platform available for educational purposes. Note.. Just an RSVP on the meetup is not enough, you must register (See link below)</p> <p>Registration:<br/>Seats are limited, so please have your folks register today to reserve their spots!<br/><a href=""https://www.eventbrite.com/e/ibms-hands-on-introduction-to-apache-spark-for-data-scientist-developers-tickets-24956722228"" class=""linkified"">https://www.eventbrite.com/e/ibms-hands-on-introduction-to-apache-spark-for-data-scientist-developers-tickets-24956722228</a></p> <p>Agenda:</p> <p>8:30am – 9:00am Breakfast, Socialize<br/>9:00am – 9:30am Spark &amp; IBM<br/>9:30am – 10:30am Apache Spark Overview<br/>10:30am – 11:30am Lab 1, Hello Spark - Hand on exercise<br/>11:30 am – 12:00pm Apache Spark SQL Overview<br/>12:00 pm – 1:00pm Lunch<br/>1:00pm – 2:00pm Lab 2, Spark SQL - Hands on exercises<br/>2:00pm – 3:00pm Overview of Data Science &amp; Machine Learning w/ Apache Spark<br/>3:00pm – 4:00pm Lab 3, Machine Learning w/ Spark – Hands on exercises<br/>4:00pm – 4:30pm Wrap-up – Feedback from attendees<br/>5:00pm – 6:30pm Optional Happy Hour at Taco Mac Perimeter</p> <p>We're looking forward to seeing y'all !</p> ","","1362746690000","7520772","open","33.86000061035156","-84.4000015258789","Big Data Developers in Atlanta","Big-Data-Developers-in-Atlanta","Developers","","231026380","https://www.meetup.com/Big-Data-Developers-in-Atlanta/events/231026380/","","Please join us for a free IBM sponsored proof of technology on Apache Spark","PT88H45M","15","","past","1463488200000","1463796012000","-14400000","6303 Barfield Road","","Atlanta","us","17317892","33.927974700927734","USA","-84.35977935791016","IBM","","False","GA","30328","public","0","26"
"0","1461976673000","<p>On June 6, 2016, leading minds in data and analytics from Tesla, Netflix, Silicon Valley Data Science, and IBM will come together to demonstrate how open data and analytics technologies such as R, Spark, Python and more are forming a vibrant ecosystem.  The community has a shared goal of working with all data to build unexpected insights and launch new business applications.</p> <p>The Apache Spark Maker Community Event will bring together data scientists, data engineers, data developers, and data designers June 6th @ 6pm at Galvanize, San Francisco. Here’s the plan:   </p> <p>- The Big Reveal – New sample Apache Spark apps and tools</p> <p>- Use Cases – Monsanto will share how they are using R and Spark to optimize their supply chain</p> <p>- Learning Session - Hear from experts working on Spark projects and building the Spark ecosystem of open data and analytics technologies</p> <p>- Networking Opportunity – Food, drinks and data, explore a Hall of Innovation showcasing Spark demos</p> <p>Join us. Learn more here:  <b><i><a href=""http://www.ibm.com/analytics/us/en/events/apache-spark/"">Apache Spark Maker Community Event</a></i></b> </p> <p>Registration begins at 5:30 PM and the discussion starts at 6:30 PM; food and drinks will be served. You must register for this event. </p> <p>To get your ticket, and attend in person, click <b><a href=""https://www.eventbrite.com/e/apache-sparktm-maker-community-event-registration-24742595770?cm_mc_uid=39680333471514613509392&amp;cm_mc_sid_50200000=1461961944"">HERE</a></b>. </p> <p>Can't attend in person? We'll be live streaming this event on a computer screen near you! Register for the  <b><a href=""https://www.eventbrite.com/e/livestream-apache-sparktm-maker-community-event-registration-24790223225?cm_mc_uid=39680333471514613509392&amp;cm_mc_sid_50200000=1461961944"">live stream</a></b> and we'll send you a calendar update and login link.</p> ","14400000","1362746690000","7520772","open","33.86000061035156","-84.4000015258789","Big Data Developers in Atlanta","Big-Data-Developers-in-Atlanta","Developers","","230756159","https://www.meetup.com/Big-Data-Developers-in-Atlanta/events/230756159/","","Apache Spark Maker Community Event","","","","past","1465248600000","1465263857000","-14400000","44 Tehama Street","","San Francisco","us","24126294","37.78749465942383","USA","-122.39653015136719","Galvanize U","","False","CA","","public","0","15"
"0","1464821902000","<p><b>THIS IS A GLOBAL ON-LINE HACKATHON THAT BEGINS MAY 23, 2016 AND <i>NOW ENDS AUGUST 23, 2016</i>.  SUBMISSIONS DUE AUGUST 23rd BY 5:00 PM EST. </b></p> <p><b>We’re extending the hackathon deadline to August 23</b> - that’s 20 additional days to build your Spark enterprise app. (View the revised competition calendar <b><a href=""http://apachespark.devpost.com/details/dates"">HERE</a></b><b>.  </b>We're giving you more time because....</p> <p>We’re adding <b>new enterprise data resources</b> to the site and we want to give you a chance to incorporate these into your projects, if you so choose.  Our awesome data co-sponsors <b><a href=""http://www.yelp.com/nyc"">Yelp</a></b> and <b><a href=""https://uncharted.software/"">Uncharted Software</a></b> have generously shared some of their enterprise data sets for you to use during the hackathon.</p> <p>Yelp’s data includes 2.2M reviews by 552K users for 77K businesses. The Uncharted data includes Bitcoin network transactions from processing the Bitcoin blockchain as of mid-2014 <i>and</i> Amazon product reviews from 1995 through 2003. For a fuller description and data access, visit our <b><a href=""http://apachespark.devpost.com/details/resources#datasets"">resources page</a></b>.</p> <p>Uncharted Software also has a couple cool Spark data visualization libraries you should check out: <b><a href=""http://unchartedsoftware.github.io/salt/"">Salt</a></b> and <b><a href=""http://unchartedsoftware.github.io/sparkpipe-core/"">SparkPipe.</a></b></p> <p>And, in case you’d like to weigh the effects of weather on business operations, we’re also offering access to the full suite of <b><a href=""http://apachespark.devpost.com/details/weather_data"">Weather Company APIs</a></b> for the duration of the hackathon.</p> <p>Finally, if you’re looking for a hosting solution for your Spark app, we’re now offering <b>extended Bluemix trials for all hackathon participants</b>. Using Bluemix services to build your project is <b><i>totally optional</i></b>, but might be a good way to get your app up and running — particularly with the IBM Analytics for Apache Spark service.</p> <p><b><a href=""http://apachespark.devpost.com/details/bluemix_promo"">You can request your extended Bluemix trial code here.</a> </b></p> <p>For all hackathon participants, trials will extend through November 1, 2016.</p> <p><i>Now go forth and optimize for the enterprise!</i></p> <p>---------------------</p> <p>Build an Apache Spark application to address a real business problem or core concern related to customer care, marketing, risk management or operations. Join IBM and Devpost for a global hackathon using <b><a href=""http://apachespark.devpost.com/?utm_source=facebook-partner&amp;utm_medium=wall-post&amp;utm_campaign=apachespark"">Apache Spark Makers Build</a></b>.  There are $100,000 in cash prizes.  Submissions can be sent in up to August 23rd.</p> <p><i>Participation Details: </i>To participate in the global virtual hackathon, you can <b><a href=""http://apachespark.devpost.com/?utm_source=facebook-partner&amp;utm_medium=wall-post&amp;utm_campaign=apachespark"">register here</a></b>.  Please review all registration guidelines.</p> <p>For the hack, you will apply Apache Spark's powerful analytics capabilities to enterprise and other relevant data so data scientists and software developers can build an analytics or mobile/web app that tackles a key business problem in marketing, customer case, operations or risk management.  The grand prize is $50,000, and the top three winners each get a meeting with the judge or<br/>Spark community expert of their choice; the judging panel includes data experts from Tesla, Netflix, and Silicon Valley Data Science.</p> <p>Go to <b><a href=""http://apachespark.devpost.com/?utm_source=facebook-partner&amp;utm_medium=wall-post&amp;utm_campaign=apachespark"">apachespark.devpost.com</a></b> for full details and registration.  Please review all registration rules.</p> <p><b> <i>Questions?</i></b></p> <p>We're here to help. If you have any questions about the hackathon, post on the <b><a href=""http://apachespark.devpost.com/forum_topics"">discussion forum </a></b>or email <b><i>support@devpost.com </i></b>and we'll respond as soon as we can.</p> ","","1362746690000","7520772","open","33.86000061035156","-84.4000015258789","Big Data Developers in Atlanta","Big-Data-Developers-in-Atlanta","Developers","","231578118","https://www.meetup.com/Big-Data-Developers-in-Atlanta/events/231578118/","","Show Us Your Apps - Apache Spark Maker Build Global Hackathon","","","","past","1471986000000","1471998690000","-14400000","Any Street","","Any City","us","24581652","36.77825927734375","USA","-119.41793060302734","Global Online Hackathon","","False","CA","","public","0","7"
"0","1472443665000","<p>On September 27, 2016, leading minds in data and analytics will come together and unveil the latest in cloud technology, enabling you to more efficiently put data to work. Experience how Spark, Hadoop, Python, and more are being used to bring together all types of data professionals –from data engineers, to data scientists, developers and business analysts –to work in new collaborative ways.</p> <p>The IBM DataFirst Launch Event will unite data and analytics leaders and practitioners from the open source community, startups, and enterprises. Check the <i><b><a href=""http://www.ibm.com/analytics/us/en/events/datafirst/index.html"">event site</a></b></i> for the latest lineup of guest speakers. The event takes place @ 6pm at the Hudson Mercantile Building, NYC.</p> <p>Here’s the plan:<br/>• The Big Reveal –Experience new ways to work for data engineers, data scientist, developers, and business analysts, both individually and collectively.</p> <p>•Hands-on sessions – With interactive experiences for each of these professions.</p> <p>•Use Cases –Community leaders and guest speakers will share their expertise and vision<br/>•Networking Opportunity – Food, drinks, data, collaborative demos, and a party on the rooftop</p> <p>Learn more here:<a href=""http://www.ibm.com/analytics/us/en/events/datafirst/index.html#"">  <i><b>DataFirst Launch Event</b></i></a></p> <p>Check-in and networking begins at 6:00 PM.  Food and drinks will be served. You must register for this event.</p> <p>To get your ticket, and attend in person, click <b><a href=""https://www.eventbrite.com/e/ibm-datafirst-launch-event-registration-26725283041"">HERE</a></b>.  </p> <p>Can't attend in person? We'll be live streaming this event.  Register for the <b><a href=""https://www.eventbrite.com/e/livestream-ibm-datafirst-launch-event-registration-26906650516"">LIVE STREAM </a></b>and we'll send you a calendar update and login link. </p> ","14400000","1362746690000","7520772","open","33.86000061035156","-84.4000015258789","Big Data Developers in Atlanta","Big-Data-Developers-in-Atlanta","Developers","zip 10018","233702006","https://www.meetup.com/Big-Data-Developers-in-Atlanta/events/233702006/","","DataFirst Launch Event – Experience new ways to put your data to work","","","","past","1475013600000","1475029771000","-14400000","500 West 36th Street","","New York","us","24745891","40.755863189697266","USA","-73.99864959716797","Hudson Mercantile Bldg","","False","NY","","public","0","9"
"4","1480620534000","<p>IBM is offering a free hands-on lab for clients and practitioners on Apache Spark. This is a full day of education on Spark with hands on exercises instructed in person by Spark experts. The course will provide a detail overview of Apache Spark with real world hands on examples of data wrangling and machine learning. The exercises will be done in Jupyter notebooks with publicly available datasets. Participants will use IBM’s fully managed free Cloud platform available for educational purposes.</p> <p><b>IN ORDER TO PROVIDE NAMES TO SECURITY AND TO CONFIRM YOUR SEAT, PLEASE REGISTER HERE:        <a href=""http://bit.ly/2gG9il3""><a href=""http://bit.ly/2gG9il3"" class=""linkified"">http://bit.ly/2gG9il3</a></a></b></p> <p><br/><b><i>Who should attend: </i></b><br/>Anyone interested in learning more about Apache Spark.</p> <p><i><b>Prerequisite: </b></i><br/>A working knowledge of Coding (Preferred Python and/or Scala), understand distributed computing, Spark and SQL.</p> <p><i><b>What to expect: </b></i><br/>Expect to spend a full day of lecture and hands on exercises attacking real-world data challenges using Apache Spark. In 8 hours you will learn the basic essentials of Apache Spark and why it's important to your organization. This workshop will focus on data wrangling and machine learning.</p> <p><br/><i><b>Full Day Agenda:</b></i></p> <p><br/>8:30am      Breakfast, Registration, Socialize</p> <p><br/>9:00am      Kickoff, Apache Spark Overview</p> <p><br/>10:00am     Lab 1, Hello Spark - Hand on exercise</p> <p><br/>11:00 am     Apache Spark SQL Overview</p> <p><br/>12:00 pm     Lunch</p> <p><br/>1:00 pm       Lab 2, Spark SQL - Hands on exercises</p> <p><br/>2:00 pm       Overview of Data Science &amp; Machine Learning w/ Apache Spark</p> <p><br/>3:00 pm       Lab 3, Machine Learning w/ Spark – Hands on exercises</p> <p><br/>4:00 pm       Wrap up – Feedback from attendee</p> <p>Reminder:  Please register <b><a href=""http://bit.ly/2gG9il3"">HERE</a></b> to confirm your seat.</p> ","28800000","1362746690000","7520772","open","33.86000061035156","-84.4000015258789","Big Data Developers in Atlanta","Big-Data-Developers-in-Atlanta","Developers","","235964718","https://www.meetup.com/Big-Data-Developers-in-Atlanta/events/235964718/","","Hands-on Intro to Apache Spark for Data Engineers, Data Scientist and Developers","","","","past","1481635800000","1481665981000","-18000000","6303 Barfield Road","","Atlanta","us","17317892","33.927974700927734","USA","-84.35977935791016","IBM","","False","GA","30328","public","0","31"
"0","1481830953000","<p>RSVP: <a href=""http://bit.ly/2gOcufe""><a href=""http://bit.ly/2gOcufe"" class=""linkified"">http://bit.ly/2gOcufe</a></a></p> <p>This webinar will cover an overview of Watson Data Platform capabilities and how to empower users across the organization to make the most out of their data. What if you can shorten the time it takes to create value out of your existing organizational data ? </p> <p>What if you can provision a common analytic engine with managed services that will enable you to embrace multiple cloud platforms ? IBM Watson Data Platform is the first cloud-based data and analytics platform to support cognitive businesses. It enables access, collaboration and paths to insights by connecting all users through trusted access to a variety of data, discovering new possibilities and opportunities with built-in intelligence, automation and machine learning and accelerating outcomes with rapid deployment of new data models and fast embedding of insights into processes, applications and services. </p> <p>Let us show you how Watson Data Platform can be the milestone of your organization analytics strategy and empower your organization into the new Cognitive analytics era.</p> <p><b>Speaker Bio: </b><br/>Gerardo Rodríguez Díaz – is an avid traveler, technologist enthusiast and Big data and Analytics cloud solution specialist focused on communications and computer systems integrations industries across North America. GRD areas of specialization are IT, Marketing and Business Intelligence having worked across European, North and South American markets.</p> ","3600000","1362746690000","7520772","open","33.86000061035156","-84.4000015258789","Big Data Developers in Atlanta","Big-Data-Developers-in-Atlanta","Developers","Time is Eastern Standard Time","236263669","https://www.meetup.com/Big-Data-Developers-in-Atlanta/events/236263669/","","Making Data Simple in the Cognitive Era","","","","past","1482253200000","1482258638000","-18000000","http://bit.ly/2gOcufe","","Atlant","us","24947636","0.0","USA","0.0","Live Webinar","","False","GA","","public","0","15"
