"comment_count","created","description","duration","group_created","group_id","group_join_mode","group_lat","group_lon","group_name","group_urlname","group_who","how_to_find_us","id","link","manual_attendance_count","name","rsvp_close_offset","rsvp_limit","rsvp_open_offset","status","time","updated","utc_offset","venue_address_1","venue_address_2","venue_city","venue_country","venue_id","venue_lat","venue_localized_country_name","venue_lon","venue_name","venue_phone","venue_repinned","venue_state","venue_zip","visibility","waitlist_count","yes_rsvp_count"
"9","1440795813000","<p>Want to win $5,000 in cash prizes and the opportunity to present your final project to a panel of Judges at IBM Insight 2015 in Las Vegas?</p> <p>Check out more here: <a href=""http://hacktheweather.github.io/"" class=""linkified"">http://hacktheweather.github.io/</a></p> <p><br/><b>Hack the Weather</b> will challenge teams of developers to use The Weather Company weather and forecast data and IBM data science tools to create a smart data application or model.</p> <p><b>Prizes:</b></p> <p>·  Three finalist teams will be brought to Las Vegas, October 26-28, 2015 for Insight 2015! You’ll present your project at the Dev@ event during the conference to a panel or IBM and industry judges. We’ll get you there, too.  Your team members will receive roundtrip airfare, two nights accommodation and a full conference pass. * ±</p> <p>·  Grand Prize: The winning team will receive $5,000</p> <p>* Each individual must meet certain IBM Legal.<br/>± Additional desired nights of accommodation are the responsibility of each individual.</p> <p><b>Rules:</b></p> <p>- Max of 3 members per team.</p> <p><br/>- Original idea (not submitted to a previous hackathon). You must start coding at the hackathon.</p> <p><br/>- Successfully extract value using The Weather Company data</p> <p><br/>- Use Data Scientist Workbench as the development and demonstration platform.</p> <p><br/>- Submit code to the hackathon's GitHub organization. Your team must include all notebooks created in Data Scientist Workbench.</p> <p><br/>- Present solution to a panel of judges (10 minutes in total for presentation and demo).</p> <p><br/>- Finalists to present their solution to a panel of Judges at IBM Insight, on October 27 (10 minutes in total for presentation and demo).</p> <p><b>Judging Criteria</b> <i><br/>* Innovation:</i> How innovative is the solution?<i><br/>* Relevance:</i> Does it solve a real problem?<br/>* <i>Functionality:</i> How functional is your code?</p> <p><br/><b>Schedule<br/></b></p> <p><b><i>Friday, September 18</i></b><br/>4:00 PM Registration and Networking<br/>5:00 PM Welcome and Introductions<br/>5:30 PM Environment Demo and Hackathon Guidelines<br/>6:00 PM Team formation and idea creation<br/>12:00 AM Wrap-up for the day</p> <p><b><i>Saturday, September 19</i></b><br/>9:00 AM Breakfast and Announcements<br/>9:45 AM Get hacking!<br/>12:00 PM Lunch<br/>6:00 PM Dinner<br/>12: 00 AM Wrap-up for the day</p> <p><b><i>Sunday, September 20</i></b><br/>9:00 AM Breakfast and Hack to the finish line<br/>11:30 PM Hackathon stops! Presentation Prep<br/>12:00 PM Presentations and lunch<br/>• Presentations to a panel of judges<br/>• 5-10 minutes each<br/>2:00 PM Closing announcements<br/>2:15 PM Doors close</p> <p>*Winners to be announced within 48 Hours of September 20th.</p> <p><b>Sponsors</b></p> <p>The Weather Company, IBM</p> <p>Want to Sponsor? Contact us directly!</p> ","166500000","1338938692000","4013112","open","37.18000030517578","-121.75","Big Data Developers","BigDataDevelopers","Members","","224955602","https://www.meetup.com/BigDataDevelopers/events/224955602/","","Hack the Weather","","","","past","1442617200000","1443133611000","-25200000","44 Tehama St 1st Floor","","San Francisco","US","23841803","37.787330627441406","USA","-122.39646911621094","GalvanizeU","","False","","","public","0","57"
"2","1443709293000","<p><b>FLASH SALE - REGISTER BY 11/05 AND GET 50% DISCOUNT - USE PROMOCODE  <i>STC50.</i></b></p> <p><b>CHECK OUT OUR NEW AGENDA ITEMS:  <a href=""http://www.spark.tc/datapalooza/full-topics/""><a href=""http://www.spark.tc/datapalooza/full-topics/"" class=""linkified"">http://www.spark.tc/datapalooza/full-topics/</a></a></b></p> <p><b>SPACE IS LIMITED - GET YOUR TICKET SOON - 20% DISCOUNT FOR MEETUP MEMBERS!! USE PROMO CODE: MEETUPDISC - REGISTER AT URL BELOW:<br/></b></p> <p><i><b><a href=""https://www.eventbrite.com/e/datapalooza-tickets-18259176689"">Datapalooza - 11/10/15</a></b></i></p> <p>Are you ready to change the way your company works with data?  Are you ready to inspire groundbreaking data products?  Join us for <b><a href=""http://www.spark.tc/datapalooza/"">Datapalooza</a></b> in San Francisco on November 10-12, 2015.</p> <p><br/>Datapalooza is a three-day (3 day) immersive experience for the data science community.  If you are a data scientist, data engineer or a data app developer, Datapalooza will help you take your skills to the next level, all while listening to some great music and learning among a diverse community of your fellow data science professionals.</p> <p><a href=""https://www.youtube.com/watch?v=sfCniMsPClU"" class=""embedded"">https://www.youtube.com/watch?v=sfCniMsPClU</a></p> <p>Working with the<a href=""http://www.spark.tc/?cm_mc_uid=32344930583214135108183&amp;cm_mc_sid_50200000=1443647616""> <b>Spark Technology Center</b></a> and <b><a href=""http://www.ibm.com/analytics/us/en/technology/spark/"">IBM</a></b>, plus leading industry experts including <b><a href=""http://www.galvanize.com/"">Galvanize</a></b>, <b><a href=""http://www.svds.com/"">Silicon Valley Data Science</a></b>, <b><a href=""https://www.typesafe.com/"">Typesafe</a></b> and others, you'll be able to craft a business-ready data product in JUST THREE DAYS.  Yes...a data product in just 3 days!</p> <p><br/>Did we mention music?  Come for the data products...stay for the concert.  The Band <b>""Big Data""</b> will be performing a concert for<b><a href=""http://www.spark.tc/datapalooza/""> Datapalooza</a></b> on November 11th.</p> <p><br/>Use Promotion Code <b>MeetupDisc</b> and get a 20% discount if you get your ticket soon.  To get your ticket,<b><a href=""https://www.eventbrite.com/e/datapalooza-tickets-18259176689""> click here</a></b>.</p> <p><i><b>Don't miss this event - Rock Your Data ... join us on November 10th.</b></i></p> ","201600000","1338938692000","4013112","open","37.18000030517578","-121.75","Big Data Developers","BigDataDevelopers","Members","","225752015","https://www.meetup.com/BigDataDevelopers/events/225752015/","","ROCK YOUR DATA at Datapalooza...Build a data product in 3 days!","","","","past","1447171200000","1447449636000","-28800000","44 Tehama St 1st Floor","","San Francisco","US","23841803","37.787330627441406","USA","-122.39646911621094","GalvanizeU","","False","","","public","0","25"
"0","1446911726000","<p>Get ready to rock your data at a meetup on Tuesday, November 10th.  Join us on the 5th floor of Galvanize for a mix and mingle with your fellow Datapalooza attendees.  Pick up some tips and tricks from the experts and have some fun.</p> <p><i>Not attending Datapalooza?</i>  Join us at the meetup anyway for some networking, food and refreshments.  Meet the Data Scientists, Data Engineers and Data App Developers who are building their data products. </p> <p><br/><b>Experience the buzz!  </b></p> ","7200000","1338938692000","4013112","open","37.18000030517578","-121.75","Big Data Developers","BigDataDevelopers","Members","5th Floor","226612191","https://www.meetup.com/BigDataDevelopers/events/226612191/","","Get Ready to Rock! #Datapalooza","","","","past","1447205400000","1447213489000","-28800000","44 Tehama St 1st Floor","","San Francisco","US","23841803","37.787330627441406","USA","-122.39646911621094","GalvanizeU","","False","","","public","0","9"
"8","1452086089000","<p><b>*Note, </b>expedite your check in at Galvanize and <b><a href=""https://www.eventbrite.com/e/sf-ds-meetup-using-spark-mllib-to-predict-most-popular-tweets-tickets-20329007609"">register here </a></b></p> <p><b>Using Spark MLlib To Predict Most Popular Tweets  </b><br/>Spark's Machine Learning Library (MLlib) enables running Machine Learning algorithms in a scalable way on massive datasets. In this talk we will use Spark and MLlib to analyze tweets and predict the number of stars and retweets that a tweet will get. The talk will include a tutorial on Spark and MLlib.</p> <p><b>Prerequisites: </b><br/>Beginner. Familiarity with a programming language will be helpful.</p> <p><b>What You'll Learn: </b><br/>After this talk you will be able to:<br/><b>1.</b> Use Spark to process large data sets.<br/><b>2.</b> Use Spark MLlib to apply Machine Learning algorithms to large data sets.<br/><b>3. </b>Understand pros and cons of using Spark vs other Machine Learning technologies. </p> <p><b>What to Bring: </b><br/>Asim will share source code for the talk. Attendees can bring a laptop to download and try the demos on their own machines.</p> <p><b>Meet Your Speaker: </b><br/><a href=""https://twitter.com/asimjalis""><b>Asim Jalis</b></a> is a Lead Instructor in Data Engineering at Galvanize. He has worked as a software engineer and instructor at Cloudera, Microsoft, and Hewlett-Packard. He has an MS in computer science from the University of Virginia and an MA in mathematics from the University of Wisconsin—Madison.</p> <p><b>*Note,</b> expedite your check in at Galvanize and<b> <a href=""https://www.eventbrite.com/e/sf-ds-meetup-using-spark-mllib-to-predict-most-popular-tweets-tickets-20329007609"">register here </a></b></p> ","10800000","1338938692000","4013112","open","37.18000030517578","-121.75","Big Data Developers","BigDataDevelopers","Members","","227884899","https://www.meetup.com/BigDataDevelopers/events/227884899/","","Using Spark MLlib To Predict Most Popular Tweets","","","","past","1453860900000","1453873745000","-28800000","44 Tehama St 1st Floor","","San Francisco","US","23841803","37.787330627441406","USA","-122.39646911621094","GalvanizeU","","False","","","public","0","63"
"1","1453431471000","<p><b>RSVP here: <a href=""http://www.meetup.com/Advanced-Apache-Spark-Meetup/events/226122226/""><a href=""http://www.meetup.com/Advanced-Apache-Spark-Meetup/events/226122226/"" class=""linkified"">http://www.meetup.com/Advanced-Apache-Spark-Meetup/events/226122226/</a></a></b></p> <p>We're super excited to announce that<b> Martin Odersky</b> - <b><i>the father of Scala</i></b> as well as my co-worker at the IBM Spark Technology Center, <b>Jakob Odersky</b> - has agreed to come speak at our meetup!!</p> <p>The topic is TBD, but I'm sure it will be awesome.</p> <p>Also, come enjoy a code-level deep dive into Spark + approximation algorithms and probabilistic data structures such as Count Min Sketch, HyperLogLog, BloomFilters, MinHash/Locality Sensitive Hashing (LSH), and DIMSUM sampling.</p> <p>As always, we'll feature many practical demos showing Spark's use of these approximation techniques in Spark Core (RDD), Spark SQL (DataFrames, Datasets), Spark Streaming, Spark ML/MLlib, and Spark GraphX.</p> <p>We'll also demonstrate how to integrate Spark, Spark Streaming with Twitter Algebird - a library of monoids including HyperLogLog, Count Min Sketch, MinHash/LSH, and Bloom Filters</p> <p>Lastly, we'll demo the integration between Spark and the Redis HyperLogLog implementation (PFCOUNT, PFADD). </p> <p><b>Agenda</b></p> <p>6:30-7pm   Mingle + Eat/Drink Awesome Food/Beverage from our Sponsor (not Pizza!)</p> <p>7pm-7:15pm   Meetup Announcements &amp; Introductions</p> <p>7:15-8:00pm   Evening with Martin Odersky!!!!  (Topic TBA)</p> <p>8:00-8:45pm   Spark, Spark Streaming, Spark SQL, Spark ML/MLlib, GraphX + Approximate Algorithms &amp; Probabilistic Data Structures, Twitter Algebird, Locality Sensitive Hashing, DIMSUM Sampling, Lots of Demos!</p> <p>8:45-9pm  Demingle </p> <p><b>Related Links and Notes</b></p> <p><a href=""http://web.stanford.edu/class/cs345a/slides/05-LSH.pdf""><a href=""http://web.stanford.edu/class/cs345a/slides/05-LSH.pdf"" class=""linkified"">http://web.stanford.edu/class/cs345a/slides/05-LSH.pdf</a></a></p> <p><a href=""http://web.stanford.edu/class/cs345a/slides/04-highdim.pdf""><a href=""http://web.stanford.edu/class/cs345a/slides/04-highdim.pdf"" class=""linkified"">http://web.stanford.edu/class/cs345a/slides/04-highdim.pdf</a></a></p> <p><a href=""http://goo.gl/VZf7oK""><a href=""http://goo.gl/VZf7oK"" class=""linkified"">http://goo.gl/VZf7oK</a></a></p> <p><a href=""http://cdn.oreillystatic.com/en/assets/1/event/105/Algebra%20for%20Scalable%20Analytics%20Presentation.pdf""><a href=""http://cdn.oreillystatic.com/en/assets/1/event/105/Algebra%20for%20Scalable%20Analytics%20Presentation.pdf"" class=""linkified"">http://cdn.oreillystatic.com/en/assets/1/event/105/Algebra%20for%20Scalable%20Analytics%20Presentation.pdf</a></a></p> <p><a href=""http://www.infoq.com/presentations/abstract-algebra-analytics""><a href=""http://www.infoq.com/presentations/abstract-algebra-analytics"" class=""linkified"">http://www.infoq.com/presentations/abstract-algebra-analytics</a></a></p> <p><a href=""http://eugenezhulenev.com/talks/interactive-audience-analytics/""><a href=""http://eugenezhulenev.com/talks/interactive-audience-analytics/"" class=""linkified"">http://eugenezhulenev.com/talks/interactive-audience-analytics/</a></a></p> <p><a href=""https://databricks.com/blog/2015/10/13/interactive-audience-analytics-with-spark-and-hyperloglog.html""><a href=""https://databricks.com/blog/2015/10/13/interactive-audience-analytics-with-spark-and-hyperloglog.html"" class=""linkified"">https://databricks.com/blog/2015/10/13/interactive-audience-analytics-with-spark-and-hyperloglog.html</a></a></p> <p><a href=""https://gist.github.com/debasishg/8172796""><a href=""https://gist.github.com/debasishg/8172796"" class=""linkified"">https://gist.github.com/debasishg/8172796</a></a></p> <p><a href=""https://www.mapr.com/blog/some-important-streaming-algorithms-you-should-know-about""><a href=""https://www.mapr.com/blog/some-important-streaming-algorithms-you-should-know-about"" class=""linkified"">https://www.mapr.com/blog/some-important-streaming-algorithms-you-should-know-about</a></a></p> <p>Custom HyperLogLog: </p> <p>* <a href=""https://github.com/collectivemedia/spark-hyperloglog/tree/master/src/main/scala/org/apache/spark/sql/hyperloglog""><a href=""https://github.com/collectivemedia/spark-hyperloglog/tree/master/src/main/scala/org/apache/spark/sql/hyperloglog"" class=""linkified"">https://github.com/collectivemedia/spark-hyperloglog/tree/master/src/main/scala/org/apache/spark/sql/hyperloglog</a></a></p> <p>Redis HLL:</p> <p><a href=""http://antirez.com/news/75""><a href=""http://antirez.com/news/75"" class=""linkified"">http://antirez.com/news/75</a></a></p> <p>Custom Aggregations: </p> <p>* Closed API, may not work in next version of Spark<br/>* All code must go under org.apache.spark.sql<br/>* Use org.apache.spark.sql.catalyst.expression.Sum for example</p> <p><a href=""http://research.neustar.biz/""><a href=""http://research.neustar.biz/"" class=""linkified"">http://research.neustar.biz/</a></a></p> <p>LSH:  <a href=""http://twitter.github.io/algebird/index.html#com.twitter.algebird.MinHasher32""><a href=""http://twitter.github.io/algebird/index.html#com.twitter.algebird.MinHasher32"" class=""linkified"">http://twitter.github.io/algebird/index.html#com.twitter.algebird.MinHasher32</a></a></p> <p><a href=""http://www.slaney.org/malcolm/yahoo/Slaney2008-LSHTutorial.pdf""><a href=""http://www.slaney.org/malcolm/yahoo/Slaney2008-LSHTutorial.pdf"" class=""linkified"">http://www.slaney.org/malcolm/yahoo/Slaney2008-LSHTutorial.pdf</a></a></p> <p><a href=""http://www.michael-noll.com/blog/2013/12/02/twitter-algebird-monoid-monad-for-large-scala-data-analytics/""><a href=""http://www.michael-noll.com/blog/2013/12/02/twitter-algebird-monoid-monad-for-large-scala-data-analytics/"" class=""linkified"">http://www.michael-noll.com/blog/2013/12/02/twitter-algebird-monoid-monad-for-large-scala-data-analytics/</a></a></p> <p><a href=""http://github.com/twitter/algebird""><a href=""http://github.com/twitter/algebird"" class=""linkified"">http://github.com/twitter/algebird</a></a></p> <p><a href=""http://github.com/avibryant/simmer""><a href=""http://github.com/avibryant/simmer"" class=""linkified"">http://github.com/avibryant/simmer</a></a></p> <p><a href=""http://esumitra.github.io/algebird-boston-spark/#""><a href=""http://esumitra.github.io/algebird-boston-spark/"" class=""linkified"">http://esumitra.github.io/algebird-boston-spark/</a>#</a></p> <p><a href=""https://github.com/twitter/algebird/wiki/Learning-Algebird-Monoids-with-REPL""><a href=""https://github.com/twitter/algebird/wiki/Learning-Algebird-Monoids-with-REPL"" class=""linkified"">https://github.com/twitter/algebird/wiki/Learning-Algebird-Monoids-with-REPL</a></a></p> <p><a href=""http://research.neustar.biz/tag/count-min-sketch/""><a href=""http://research.neustar.biz/tag/count-min-sketch/"" class=""linkified"">http://research.neustar.biz/tag/count-min-sketch/</a></a></p> <p><a href=""http://research.neustar.biz/2012/10/25/sketch-of-the-day-hyperloglog-cornerstone-of-a-big-data-infrastructure/""><a href=""http://research.neustar.biz/2012/10/25/sketch-of-the-day-hyperloglog-cornerstone-of-a-big-data-infrastructure/"" class=""linkified"">http://research.neustar.biz/2012/10/25/sketch-of-the-day-hyperloglog-cornerstone-of-a-big-data-infrastructure/</a></a></p> <p>Apache NiFi as Streaming Producer:</p> <p><a href=""http://ingest.tips/2014/12/22/getting-started-with-apache-nifi/""><a href=""http://ingest.tips/2014/12/22/getting-started-with-apache-nifi/"" class=""linkified"">http://ingest.tips/2014/12/22/getting-started-with-apache-nifi/</a></a></p> <p><a href=""https://blogs.apache.org/nifi/entry/integrating_apache_nifi_with_apache""><a href=""https://blogs.apache.org/nifi/entry/integrating_apache_nifi_with_apache"" class=""linkified"">https://blogs.apache.org/nifi/entry/integrating_apache_nifi_with_apache</a></a></p> <p><a href=""http://donlehmanjr.com/Science/03%20Decay%20Ave/032.htm""><a href=""http://donlehmanjr.com/Science/03%20Decay%20Ave/032.htm"" class=""linkified"">http://donlehmanjr.com/Science/03%20Decay%20Ave/032.htm</a></a></p> ","10800000","1338938692000","4013112","open","37.18000030517578","-121.75","Big Data Developers","BigDataDevelopers","Members","","228272659","https://www.meetup.com/BigDataDevelopers/events/228272659/","","Evening with Martin Odersky! (Topic TBD) +Spark Approximations +Twitter Algebird","","","","past","1454034600000","1454046488000","-28800000","44 Tehama St 1st Floor","","San Francisco","US","23841803","37.787330627441406","USA","-122.39646911621094","GalvanizeU","","False","","","public","0","54"
"7","1457398950000","<p><b>Taking Hadoop and Spark to the Cloud + Beer Tasting!</b></p> <p><br/>Kick off your week at Strata + Hadoop World with free beer tasting and meet and greet with folks from the Strata Conference and Spark Technology Center.</p> <p><i><b>Satheesh Bandaram, </b></i>Director of Hadoop, Spark and Cloud Services at IBM Analytics, will kick off the evening with a short presentation on IBM’s recent Hadoop and Spark open source contributions.</p> <p><br/>He will be followed by <i><b>Joel Horwitz</b></i>, Director of Business Development, who will share details of a pilot ecosystem program for Apache Spark.  The ecosystem program includes a growing list of partners including:</p> <p><i><b>Cloud Service:</b></i> WANdisco, Mesosphere<br/><i><b>Data Science/Machine Learning:</b></i> H2O.ai, Dato, Skymind, DataRobot, Alpine, Kaggle<br/><i><b>Data Training:</b></i> Galvanize, DataCamp, LightBend<br/><i><b>Data Consulting: </b></i>SVDS</p> <p><br/>After the short presentation, we'll mingle over complimentary beer tasting and a tour of the brewery.  Pizza will be provided.</p> <p><br/>Free parking is available at the facility. Space is limited so RSVP early.</p> ","10800000","1338938692000","4013112","open","37.18000030517578","-121.75","Big Data Developers","BigDataDevelopers","Members","Zip Code 95112","229424567","https://www.meetup.com/BigDataDevelopers/events/229424567/","","Taking Hadoop and Spark to the Cloud + Beer Tasting!","","165","","past","1459301400000","1459355260000","-25200000","2099 S. 10th Street #30","","San Jose","us","23616903","37.31034469604492","USA","-121.85784149169922","Strike Brewing Company","","False","CA","95112","public","0","184"
"4","1461962909000","<p>On June 6, 2016, leading minds in data and analytics from Tesla, Netflix, Silicon Valley Data Science, and IBM will come together to demonstrate how open data and analytics technologies such as R, Spark, Python and more are forming a vibrant ecosystem.  The community has a shared goal of working with all data to build unexpected insights and launch new business applications.</p> <p>The Apache Spark Maker Community Event will bring together data scientists, data engineers, data developers, and data designers June 6th @ 6pm at Galvanize, San Francisco. Here’s the plan:   </p> <p>- The Big Reveal – New sample Apache Spark apps and tools</p> <p>- Use Cases – Monsanto will share how they are using R and Spark to optimize their supply chain</p> <p>- Learning Session - Hear from experts working on Spark projects and building the Spark ecosystem of open data and analytics technologies</p> <p><br/>- Networking Opportunity – Food, drinks and data, explore a Hall of Innovation showcasing Spark demos</p> <p><br/>Join us. Learn more here: </p> <p><b><i><a href=""http://www.ibm.com/analytics/us/en/events/apache-spark/"">Apache Spark Maker Community Event</a></i></b> </p> <p>Registration begins at 5:30 PM and the discussion starts at 6:30 PM; food and drinks will be served. You must register for this event. </p> <p><br/>To get your ticket, and attend in person, click <b><a href=""https://www.eventbrite.com/e/apache-sparktm-maker-community-event-registration-24742595770?cm_mc_uid=39680333471514613509392&amp;cm_mc_sid_50200000=1461961944"">HERE</a></b>. </p> <p>Can't attend in person? We'll be live streaming this event on a computer screen near you! Register for the <br/><b><a href=""https://www.eventbrite.com/e/livestream-apache-sparktm-maker-community-event-registration-24790223225?cm_mc_uid=39680333471514613509392&amp;cm_mc_sid_50200000=1461961944"">live stream</a></b> and we'll send you a calendar update and login link.</p> ","14400000","1338938692000","4013112","open","37.18000030517578","-121.75","Big Data Developers","BigDataDevelopers","Members","","230751856","https://www.meetup.com/BigDataDevelopers/events/230751856/","","Apache Spark Maker Community Event","","","","past","1465259400000","1465275350000","-25200000","44 Tehama St 1st Floor","","San Francisco","US","23841803","37.787330627441406","USA","-122.39646911621094","GalvanizeU","","False","","","public","0","80"
"4","1465366848000","<p>Kick off the <b><i>Hadoop Summit</i></b>  with free beer at Gordon Biersch. Meet and greet with folks attending the Summit and others in the business community.</p> <p><br/><b>Ritika Gunnar, Vice President of Offering Management</b>, will kick off the evening with a short presentation on IBM’s recent Hadoop and Apache Spark analytics announcements.</p> <p><br/>After the short presentation, we'll mingle over complimentary beer and appetizers.</p> <p><br/>Validated Parking available for a 2-hour period at the Pavilion Garage (S. Second Street). Parking after the 2 hours is a flat rate of $6.00.  There is other parking in the area.</p> <p>Space is limited for this meetup so please RSVP early.</p> ","7200000","1338938692000","4013112","open","37.18000030517578","-121.75","Big Data Developers","BigDataDevelopers","Members","Outside Patio","231736978","https://www.meetup.com/BigDataDevelopers/events/231736978/","","Innovations in Spark and Hadoop Analytics + Beer Tasting!","","","","past","1467075600000","1467305177000","-25200000","33 East San Fernando Street","","San Jose","us","5773822","37.334659576416016","USA","-121.88850402832031","Gordon Biersch Brewery Restaurant","","False","CA","95113","public","0","139"
